"","RegionName","RegionCode","Date","indicator_type","past_value","past_flag","present_value","present_flag","Notes"
"81","Newfoundland and Labrador","CAN_NL","20-May-21","C3_Cancel public events",2,"T",1,"G","Effective 20 may 2021, in Newfoundland and Labrador (NL) “communities from South Branch down to Port aux Basques, including Codroy Valley, and across to Rose Blanche-Harbour le Cou [in southwest Newfoundland]… will return to Alert Level 2 [from 4]. This is following increased testing by Western Health where it was determined there was no evidence of widespread community spread”. All of NL is now at Alert Level 2: “Traditional parades and large-scale outdoor ceremonies or events, including community fireworks and bonfires, are not recommended at this time... Organizers should consider adjusting event plans to follow the Guidelines for Distanced Gatherings, and/or making alternate arrangements that would eliminate or reduce any associated gatherings to under 100 people.” See Government of NL websites, archived:  https://web.archive.org/web/20210519181610/https://www.gov.nl.ca/releases/2021/health/0519n05/  https://web.archive.org/web/20210522101021/https://www.gov.nl.ca/covid-19/alert-system/alert-level-2/"
"82","Newfoundland and Labrador","CAN_NL","22-May-21","C3_Cancel public events",1,"G",2,"T","22 may 2021 is the first full day that the government of Newfoundland and Labrador (NL) moved “the Lewisporte to Summerford area of the province [north-central Newfoundland] to Alert Level 4....funerals, burials, weddings, and religious and cultural ceremonies are limited to no more than 10 people...Performance spaces are closed.” The rest of the province remains at Alert Level 2: “Traditional parades and large-scale outdoor ceremonies or events, including community fireworks and bonfires, are not recommended at this time... Organizers should consider adjusting event plans to follow the Guidelines for Distanced Gatherings, and/or making alternate arrangements that would eliminate or reduce any associated gatherings to under 100 people.” See Government of NL websites, archived: https://web.archive.org/web/20210522104755/https://www.gov.nl.ca/releases/2021/health/0521n06/  https://web.archive.org/web/20210522105210/https://www.gov.nl.ca/covid-19/alert-system/alert-level-4/  https://web.archive.org/web/20210522101021/https://www.gov.nl.ca/covid-19/alert-system/alert-level-2/"
"83","New Brunswick","CAN_NB","24-May-21","C3_Cancel public events",1,"G",1,"G","On 24 may 2021, the province of New Brunswick (NB) is at the Yellow level Throughout NB: “For formal events, an operational plan is required...large live performance facilities ...may operate under a COVID-19 operational plan...Sports Tournaments ...may be permitted, subject to the approval of an operational plan and risk assessment.” See Province of NB website, archived:   https://web.archive.org/web/20210524103931/https://www2.gnb.ca/content/gnb/en/corporate/promo/covid-19/alert-levels.html  https://web.archive.org/web/20210517165348/https://www2.gnb.ca/content/gnb/en/corporate/promo/covid-19/alert-levels/yellow%20level.html"
"84","Newfoundland and Labrador","CAN_NL","24-May-21","C3_Cancel public events",2,"T",2,"T","On 24 may 2021, note for 22 May continues to apply with Alert Level 4 extended to entire north-east coast of Newfoundland. See government of Newfoundland and Labrador website, archived: https://web.archive.org/web/20210524175422/https://www.gov.nl.ca/releases/2021/health/0524n01/ "
"85","Nova Scotia","CAN_NS","24-May-21","C3_Cancel public events",2,"G",2,"G","Public events in the remain prohibited in the province. Source: https://archive.fo/WBZ04"
"86","Northwest Territories","CAN_NT","25-May-21","C3_Cancel public events",1,"G",1,"G","No change to previous policy. Northwest Territories have extended the territory-wide Public Health Emergency to June 8, 2021.    Guidelines on public events continue to be in place:  Organized public events such as community feasts, barbeques, outdoor small concerts, and outdoor bingo are allowed for up to a maximum of 50 people, and if appropriate public health measures are in place.  Organized indoor events not held at households like banquets and receptions can be held with a maximum of 25 people as long as appropriate public health measures like physical distancing and hand-washing are in-place.    https://web.archive.org/web/20210531230609/https://www.gov.nt.ca/en/newsroom/public-service-announcement-public-health-emergency-extended-through-june-8  https://web.archive.org/web/20210531234729/https://www.gov.nt.ca/covid-19/en/services/reopening-nwt-phases"
"87","Yukon","CAN_YT","25-May-21","C3_Cancel public events",1,"G",1,"G","From 25th May, the numbers in attendence at organised indoor and outdoor gatherings and events could increase to 200 individuals with physical distancing provided the venue or space can accommodate.    Source: https://web.archive.org/web/20210601224937if_/https://yukon.ca/en/news/public-health-restrictions-be-lifted-may-25"
"88","Alberta","CAN_AB","28-May-21","C3_Cancel public events",2,"G",2,"G","As an early part of Stage 1 re-opening, places of worship can now have 15% of fire code occupancy. This is an increase from 15 individuals.    https://web.archive.org/web/20210530224846/https://www.alberta.ca/release.cfm?xID=78245A07B1BCA-D29D-4853-55C609A2834F05E3"
"89","Manitoba","CAN_MB","30-May-21","C3_Cancel public events",2,"G",2,"G","No policy change: https://web.archive.org/web/20210609073804/https://www.gov.mb.ca/covid19/prs/index.html"
"90","Saskatchewan","CAN_SK","30-May-21","C3_Cancel public events",2,"G",1,"G","70% of the 40 and older population has had their first dose, enabling the first step in the """"Re Opening Roadmap"""" on May 30th. Further stages of the reopening plan will be implemented three weeks after similar vaccine milestones (eg. three weeks after 70% of 18+ with first vaccine).    This changes the ongoing and several times extended public health order stopping public gatherings. Indoor gatherings may now have up to 30 people and outdoor ones 150.     https://web.archive.org/web/20210530193404/https://www.saskatchewan.ca/government/news-and-media/2021/may/30/covid19-update-for-may-30-717609-vaccines-administered-171-new-cases-148-recoveries-one-new-death  https://web.archive.org/web/20210601210713/https://www.saskatchewan.ca/government/news-and-media/2021/june/01/reopening-roadmap-government-sets-vaccination-threshold-for-removal-of-gathering-size-limits-mask-or      "
"91","New Brunswick","CAN_NB","31-May-21","C3_Cancel public events",1,"G",1,"G","On 31 may 2021, the province of New Brunswick (NB) is at the Yellow level Throughout NB: “For formal events, an operational plan is required...large live performance facilities ...may operate under a COVID-19 operational plan...Sports Tournaments ...may be permitted, subject to the approval of an operational plan and risk assessment.” See Province of NB website, archived:   https://web.archive.org/web/20210531100754/https://www2.gnb.ca/content/gnb/en/corporate/promo/covid-19/alert-levels.html  https://web.archive.org/web/20210531100908/https://www2.gnb.ca/content/gnb/en/corporate/promo/covid-19/alert-levels/yellow%20level.html"
"92","Newfoundland and Labrador","CAN_NL","31-May-21","C3_Cancel public events",2,"T",2,"T","On 31 may 2021, the provincial government of Newfoundland and Labrador (NL) continues to apply Alert Level 4 to the north-east coast of Newfoundland (Central Health Region) and to part of the Western Health Region (where level 4 took effect on 30 May). At Alert Level 4: “funerals, burials, weddings, and religious and cultural ceremonies are limited to no more than 10 people...Performance spaces are closed.” The rest of the province remains at Alert Level 2: “Traditional parades and large-scale outdoor ceremonies or events, including community fireworks and bonfires, are not recommended at this time... Organizers should consider adjusting event plans to follow the Guidelines for Distanced Gatherings, and/or making alternate arrangements that would eliminate or reduce any associated gatherings to under 100 people.” See government of NL websites, archived:  https://web.archive.org/web/20210531134852/https://www.gov.nl.ca/covid-19/  https://web.archive.org/web/20210531135044/https://www.gov.nl.ca/covid-19/alert-system/alert-level-4/  https://web.archive.org/web/20210531135156/https://www.gov.nl.ca/covid-19/alert-system/alert-level-2/"
"93","Northwest Territories","CAN_NT","01-Jun-21","C3_Cancel public events",1,"G",1,"G","No change to previous policy.  Guidelines on public events continue to be in place:  Organized public events such as community feasts, barbeques, outdoor small concerts, and outdoor bingo are allowed for up to a maximum of 50 people, and if appropriate public health measures are in place.  Organized indoor events not held at households like banquets and receptions can be held with a maximum of 25 people as long as appropriate public health measures like physical distancing and hand-washing are in-place.    https://web.archive.org/web/20210607210231/https://www.gov.nt.ca/covid-19/en/services/reopening-nwt-phases"
"94","New Brunswick","CAN_NB","07-Jun-21","C3_Cancel public events",1,"G",1,"G","On 7 June 2021, the province of New Brunswick (NB) is at the Yellow level: “For formal events, an operational plan is required...large live performance facilities ...may operate under a COVID-19 operational plan...Sports Tournaments ...may be permitted, subject to the approval of an operational plan and risk assessment.” See Province of NB website, archived:   https://web.archive.org/web/20210607153557/https://www2.gnb.ca/content/gnb/en/corporate/promo/covid-19/alert-levels.html  https://web.archive.org/web/20210605194810/https://www2.gnb.ca/content/gnb/en/corporate/promo/covid-19/alert-levels/yellow%20level.html"
"95","Newfoundland and Labrador","CAN_NL","07-Jun-21","C3_Cancel public events",2,"T",2,"T","On 7 june 2021, the provincial government of Newfoundland and Labrador (NL) continues to apply Alert Level 4 to part of the Western Health Region (St. George’s-Stephenville-Port au Port Area). The north-east coast of Newfoundland (Central Health Region) is at Alert Level 3. The rest of the province remains at Alert Level 2. At Alert Level 4: “funerals, burials, weddings, and religious and cultural ceremonies are limited to no more than 10 people...Performance spaces are closed.” At Alert Level 2: “Traditional parades and large-scale outdoor ceremonies or events, including community fireworks and bonfires, are not recommended at this time... Organizers should consider adjusting event plans to follow the Guidelines for Distanced Gatherings, and/or making alternate arrangements that would eliminate or reduce any associated gatherings to under 100 people.” See government of NL website, archived:   https://web.archive.org/web/20210607101132/https://www.gov.nl.ca/covid-19/  https://web.archive.org/web/20210607102202/https://www.gov.nl.ca/covid-19/files/Summary-Table-of-COVID-19-Alert-Level-System-graphic.pdf"
"96","Newfoundland and Labrador","CAN_NL","09-May-21","C4_Restrictions on gatherings",3,"G",3,"G","On 9 may 2021, in Newfoundland and Labrador (NL), the entire province remains at Alert Level 2.  “Your household bubble can interact with up to 20 close, consistent contacts from outside your household (Steady 20)...Formal gatherings run by a recognized business or organization are limited to no more than 100 people. Physical distancing must be maintained...Performance spaces can open with a maximum capacity of 100 people per auditorium or room.” See Government of NL website, archived:  https://web.archive.org/web/20210509112951/https://www.gov.nl.ca/covid-19/alert-system/alert-level-2/"
"97","Manitoba","CAN_MB","10-May-21","C4_Restrictions on gatherings",4,"G",4,"G","No policy change: https://web.archive.org/web/20210519101621/https://www.gov.mb.ca/covid19/prs/index.html"
"98","New Brunswick","CAN_NB","10-May-21","C4_Restrictions on gatherings",3,"G",3,"G","On 10 may 2021, most of the province of New Brunswick (NB) is at the Yellow level. The Edmundston/Upper Madawaska area is at the Orange level: “Formal outdoor gatherings with physical distancing of 50 people or fewer are permitted with an operational plan… Informal gatherings (inside or out) are permitted only with your household and members of your Steady 10...Entertainment venues ...occupancy limit is set at 50 or fewer”. There are some differences between Yellow and Orange, but both are consistent with 3 = “Restrictions on gatherings of 11-100 people”. Initially coded incorrectly as 3T and subsequently corrected to 3G. See Province of NB website, archived:   https://web.archive.org/web/20210509123032/https://www2.gnb.ca/content/gnb/en/corporate/promo/covid-19/alert-levels/orange%20level.html"
"99","Nova Scotia","CAN_NS","10-May-21","C4_Restrictions on gatherings",4,"G",4,"G","It remains the case that only members within a household is allowed to gather. Source: https://archive.fo/5xTiW"
"100","Northwest Territories","CAN_NT","11-May-21","C4_Restrictions on gatherings",3,"G",3,"G","No change to previous policy.  Outdoor gatherings continue to be restricted to a maximum of 50 people. Indoor gatherings continue to be restricted to a maximum of 25 people.    https://web.archive.org/web/20210517222405/https://www.gov.nt.ca/covid-19/en/services/health-and-well-being/advice-gatherings-and-events  https://web.archive.org/web/20210517220329/https://www.gov.nt.ca/en/newsroom/public-health-emergency-extended-through-may-25"
"101","Nunavut","CAN_NU","12-May-21","C4_Restrictions on gatherings",4,"T",4,"T","In Iqaluit, outdoor gatherings remain restricted to 5 people, whilst indoor gatherings are restricted to a household plus 5 people for emergencies only.      However from 12th May, restrictions in Kinngait eased so that whilst indoor gatherings remain restricted to a household plus 5 people, outdoor gatherings are now restricted to 25 people (though with 2-metres social distancing in public, between individuals of different households). Indoor gatherings outside of homes are restricted to 10 people. Gatherings at community halls and conference spaces and within government and Inuit organization facilities are restricted to 25 or 50% capacity.     Sources:    https://web.archive.org/web/20210520112252/https://www.gov.nu.ca/sites/default/files/public_health_measures_for_remaining_baffin_may_12_eng.pdf    https://web.archive.org/web/20210520112505/https://www.gov.nu.ca/sites/default/files/public_health_measures_for_iqaluit_may_4_eng.pdf "
"102","Newfoundland and Labrador","CAN_NL","13-May-21","C4_Restrictions on gatherings",3,"G",4,"T","13 may 2021 is the first full day that the government of Newfoundland and Labrador (NL) moved southwest Newfoundland “from South Branch down to Port aux Basques, including Codroy Valley, and across to Rose Blanche-Harbour le Cou to Level 4.” The rest of the province remains at Alert Level 2. “Guidance for Distanced Gatherings: Level 4 Maximum #10 Level 2 Maximum #100* This limit applies to formal gatherings that are run by a recognized business/organization. Informal gatherings (such as informal family/friend gatherings) in Alert Level 2 are limited to only those in your Steady 20.” See Government of NL website, archived: https://web.archive.org/web/20210513003611/https://www.gov.nl.ca/releases/2021/health/0512n08/  https://web.archive.org/web/20210517131551/https://www.gov.nl.ca/covid-19/guidance-for-gatherings/"
"103","Ontario","CAN_ON","13-May-21","C4_Restrictions on gatherings",4,"G",4,"G","Stay-at-Home Order legally extended to June 2.    """"With the new, more contagious variants continuing to pose significant risks, the Ontario government, in consultation with the Chief Medical Officer of Health, has extended the Stay-at-Home Order (O. Reg. 265/21) until at least June 2, 2021. All public health and workplace safety measures under the provincewide emergency brake will also remain in effect.""""    https://web.archive.org/web/20210514131629/https://news.ontario.ca/en/release/1000124/ontario-extending-stay-at-home-order-until-june-2"
"104","Prince Edward Island","CAN_PE","14-May-21","C4_Restrictions on gatherings",3,"G",3,"G","Islanders are encouraged to keep gatherings small, although gatherings are permitted from 10-50 people in the current 'caution' state.     https://archive.vn/huOUc  https://archive.vn/mY5yV  https://archive.vn/hWFbQ  https://archive.vn/zUAkB"
"105","New Brunswick","CAN_NB","17-May-21","C4_Restrictions on gatherings",3,"G",3,"G","On 17 may 2021, the province of New Brunswick (NB) is at the Yellow level. “Indoor informal – Your household and Steady15. Indoor formal – Occupancy limits are based on capacity of facility to maintain physical distancing of people who are not members of the same household or Steady15 and are to be no more than 50% of the facility’s capacity. Continuous mask use is required....Outdoor gatherings with physical distancing of 50 people or fewer are permitted with physical distancing...Faith venues can continue to be open as long as two metre of distance is maintained between people outside of their household or Steady15 at a maximum of 50% of the venue, and everyone is wearing a mask.”  See Province of NB website, archived:   https://web.archive.org/web/20210517165348/https://www2.gnb.ca/content/gnb/en/corporate/promo/covid-19/alert-levels/yellow%20level.html  "
"106","Newfoundland and Labrador","CAN_NL","17-May-21","C4_Restrictions on gatherings",4,"T",4,"T","Note for 13 May still applies."
"107","Nova Scotia","CAN_NS","17-May-21","C4_Restrictions on gatherings",4,"G",4,"G","It remains the case that only members within a household is allowed to gather. Source: https://archive.fo/36AEe"
"108","Saskatchewan","CAN_SK","17-May-21","C4_Restrictions on gatherings",4,"G",4,"G","New public health order from May 17 extends restrictions on gatherings, with no inter-household private gatherings. No change. Although things look like they will change by the end of the month.      https://web.archive.org/web/20210516193402/https://www.saskatchewan.ca/government/news-and-media/2021/may/16/covid19-update-for-may-16-590952-vaccines-administered-167-new-cases-156-recoveries-one-new-death"
"109","Northwest Territories","CAN_NT","18-May-21","C4_Restrictions on gatherings",3,"G",3,"G","No change to previous policy.    Guidelines on public events continue to be in place:  Organized public events such as community feasts, barbeques, outdoor small concerts, and outdoor bingo are allowed for up to a maximum of 50 people, and if appropriate public health measures are in place.  Organized indoor events not held at households like banquets and receptions can be held with a maximum of 25 people as long as appropriate public health measures like physical distancing and hand-washing are in-place.    https://web.archive.org/web/20210524232134/https://www.gov.nt.ca/covid-19/en/services/health-and-well-being/advice-gatherings-and-events"
"110","Manitoba","CAN_MB","20-May-21","C4_Restrictions on gatherings",4,"G",4,"G","No policy change: https://web.archive.org/web/20210531214401/https://www.gov.mb.ca/covid19/prs/index.html"
"111","Newfoundland and Labrador","CAN_NL","20-May-21","C4_Restrictions on gatherings",4,"T",3,"G","Effective 20 may 2021, in Newfoundland and Labrador (NL) “communities from South Branch down to Port aux Basques, including Codroy Valley, and across to Rose Blanche-Harbour le Cou [in southwest Newfoundland]… will return to Alert Level 2 [from 4]. This is following increased testing by Western Health where it was determined there was no evidence of widespread community spread”. All of NL is now at Alert Level 2: “Formal gatherings run by a recognized business or organization are limited to no more than 100 people. Physical distancing must be maintained....Informal gatherings are limited to only those in your Steady 20.” See Government of NL websites, archived:  https://web.archive.org/web/20210519181610/https://www.gov.nl.ca/releases/2021/health/0519n05/  https://web.archive.org/web/20210522101021/https://www.gov.nl.ca/covid-19/alert-system/alert-level-2/"
"112","Newfoundland and Labrador","CAN_NL","22-May-21","C4_Restrictions on gatherings",3,"G",4,"T","22 may 2021 is the first full day that the government of Newfoundland and Labrador (NL) moved “the Lewisporte to Summerford area of the province [north-central Newfoundland] to Alert Level 4....Gatherings at funerals, burials, weddings, and religious and cultural ceremonies are limited to no more than 10 people, including the officiant. Physical distancing must be maintained. Public visitations and wakes are prohibited. Informal gatherings are limited to only those in your bubble.” The rest of the province remains at Alert Level 2: “Formal gatherings run by a recognized business or organization are limited to no more than 100 people. Physical distancing must be maintained....Informal gatherings are limited to only those in your Steady 20.” See Government of NL websites, archived: https://web.archive.org/web/20210522104755/https://www.gov.nl.ca/releases/2021/health/0521n06/  https://web.archive.org/web/20210522105210/https://www.gov.nl.ca/covid-19/alert-system/alert-level-4/  https://web.archive.org/web/20210522101021/https://www.gov.nl.ca/covid-19/alert-system/alert-level-2/"
"113","New Brunswick","CAN_NB","24-May-21","C4_Restrictions on gatherings",3,"G",3,"G","On 24 may 2021, the province of New Brunswick (NB) is at the Yellow level. “Indoor informal – Your household and Steady15. Indoor formal – Occupancy limits are based on capacity of facility to maintain physical distancing of people who are not members of the same household or Steady15 and are to be no more than 50% of the facility’s capacity. Continuous mask use is required....Outdoor gatherings with physical distancing of 50 people or fewer are permitted with physical distancing...Faith venues can continue to be open as long as two metre of distance is maintained between people outside of their household or Steady15 at a maximum of 50% of the venue, and everyone is wearing a mask.”  See Province of NB website, archived:   https://web.archive.org/web/20210524103931/https://www2.gnb.ca/content/gnb/en/corporate/promo/covid-19/alert-levels.html  https://web.archive.org/web/20210524103426/https://www2.gnb.ca/content/gnb/en/corporate/promo/covid-19/alert-levels/yellow%20level.html"
"114","Newfoundland and Labrador","CAN_NL","24-May-21","C4_Restrictions on gatherings",4,"T",4,"T","On 24 may 2021, note for 22 May continues to apply with Alert Level 4 extended to entire north-east coast of Newfoundland. See government of Newfoundland and Labrador website, archived: https://web.archive.org/web/20210524175422/https://www.gov.nl.ca/releases/2021/health/0524n01/ "
"115","Nova Scotia","CAN_NS","24-May-21","C4_Restrictions on gatherings",4,"G",4,"G","It remains the case that only members within a household are allowed to gather. Source: https://archive.fo/WBZ04"
"116","Northwest Territories","CAN_NT","25-May-21","C4_Restrictions on gatherings",3,"G",3,"G","No change to previous policy. Northwest Territories have extended the territory-wide Public Health Emergency to June 8, 2021.    Guidelines on public events continue to be in place:  Organized public events such as community feasts, barbeques, outdoor small concerts, and outdoor bingo are allowed for up to a maximum of 50 people, and if appropriate public health measures are in place.  Organized indoor events not held at households like banquets and receptions can be held with a maximum of 25 people as long as appropriate public health measures like physical distancing and hand-washing are in-place.    https://web.archive.org/web/20210531230609/https://www.gov.nt.ca/en/newsroom/public-service-announcement-public-health-emergency-extended-through-june-8  https://web.archive.org/web/20210524232134/https://www.gov.nt.ca/covid-19/en/services/health-and-well-being/advice-gatherings-and-events"
"117","Yukon","CAN_YT","25-May-21","C4_Restrictions on gatherings",3,"G",3,"G","From 25th May, social gathering sizes could increase to up to 20 individuals indoors with mask use and phsyical distancing, and outdoor gatherings of up to 100 individuals with physical distancing.    Source: https://web.archive.org/web/20210601224937if_/https://yukon.ca/en/news/public-health-restrictions-be-lifted-may-25  "
"118","Alberta","CAN_AB","26-May-21","C4_Restrictions on gatherings",4,"G",4,"G","As the premier announced Alberta's 'Open for Summer Plan', Stage 1 will begin on June 1, as Alberta has already met the criteria (""""Two weeks after 50 per cent of Albertans age 12-plus have received at least one dose of vaccine and COVID-19 hospitalizations are below 800 and declining""""). In this stage, outdoor social gatherings can increase from 5 to 10 people. However, indoor social gatherings are still prohibited. Wedding ceremonies will be permitted to have up to 10 people (including the officiant, people getting married, witnesses and photographer), but receptions are still prohibited. Funerals are allowed 20 people (not including """"facility staff, funeral clergy or organizers not considered guests""""), with receptions still prohibited. In addition, """"outdoor physical, performance and recreational activities are permitted with up to 10 distanced people, for all ages.""""         https://web.archive.org/web/20210530224846/https://www.alberta.ca/release.cfm?xID=78245A07B1BCA-D29D-4853-55C609A2834F05E3"
"119","Manitoba","CAN_MB","30-May-21","C4_Restrictions on gatherings",4,"G",4,"G","No policy change: https://web.archive.org/web/20210609073804/https://www.gov.mb.ca/covid19/prs/index.html"
