"","RegionName","RegionCode","Date","indicator_type","past_value","past_flag","present_value","present_flag","Notes"
"1","Nova Scotia","CAN_NS","06-Jun-21","C1_School closing",1,"G",2,"T","CoVID cases have been connected to Graham Creighton Junior High, Dartmouth and Bedford and Forsyth Education Centres (Dartmouth Campus). The schools will therefore remain closed to students until Thursday, June 10. Source: https://archive.fo/CkB1m"
"2","Prince Edward Island","CAN_PE","06-Jun-21","C1_School closing",1,"G",1,"G","no change"
"3","New Brunswick","CAN_NB","07-Jun-21","C1_School closing",1,"G",1,"G","On 7 June 2021, the province of New Brunswick (NB) is at the Yellow level Throughout NB: “Schools: All educational and camp facilities are open under appropriate public health guidance, virtual to be used for at-risk groups. Post-secondary educational institutions may operate.” Some PSE institutions are still operating largely online -- e.g., at University of NB: “On-campus, in-person summer term courses will be offered through alternative delivery methods so you can continue your spring and summer studies from the comfort and safety of your home.” See Province of NB and UNB websites, archived: https://web.archive.org/web/20210605194706/https://www.unb.ca/cel/summer-at-unb.html  https://web.archive.org/web/20210607153557/https://www2.gnb.ca/content/gnb/en/corporate/promo/covid-19/alert-levels.html  https://web.archive.org/web/20210605194810/https://www2.gnb.ca/content/gnb/en/corporate/promo/covid-19/alert-levels/yellow%20level.html"
"4","Newfoundland and Labrador","CAN_NL","07-Jun-21","C1_School closing",1,"G",1,"G","On 7 June 2021, in the province of Newfoundland and Labrador (NL): “an enhanced ‘Scenario 2’ blended learning education delivery model for most high school students …[who] attend school on alternate days to reduce the number of students in class at one time. Those who are not physically in class on a given day will continue their learning from home…[and]  connect virtually with teachers and classmates for at least a portion of each class.” Younger students in elementary school grades receive in-class instruction throughout the province. At Memorial University: “The School of Human Kinetics and Recreation (HKR) will return to offering its programs fully on campus in the spring 2021 semester (beginning in mid-May and ending in mid-August)...The Faculty of Medicine, Faculty of Nursing, School of Pharmacy and Marine Institute will continue with on-campus instruction … Other faculties and schools with spring semester course offerings will continue with primarily remote instruction.” See NL English School District and Memorial University websites, archived: https://web.archive.org/web/20210607141308/https://www.mun.ca/covid19/students/spring.php  https://web.archive.org/web/20210607141219/https://www.nlesd.ca/includes/files/news/doc/1618333573432.pdf  "
"5","Manitoba","CAN_MB","08-Jun-21","C1_School closing",2,"T",2,"T","No policy change: https://web.archive.org/web/20210627232635/https://www.manitoba.ca/covid19/prs/reopening/milestone-one.html"
"6","Nova Scotia","CAN_NS","08-Jun-21","C1_School closing",2,"T",2,"T","A CoVID case has been linked to Halifax West High School. The school has therefore been closed to in-person classes until June 11, 2021. Source: https://archive.fo/ea9uG"
"7","Northwest Territories","CAN_NT","08-Jun-21","C1_School closing",1,"G",1,"G","Schools continues to remain open. As a result of recent outbreaks, there is a new School Symptom Screening and Testing Process in place.  Students and staff who experience symptoms upon being tested will be encouraged to stay home, be assessed by a healthcare provider and issued an assessment card before returning to school.    https://web.archive.org/web/20210531231430/https://www.hss.gov.nt.ca/en/newsroom/introduction-new-school-symptom-screening-and-testing-process"
"8","Nova Scotia","CAN_NS","09-Jun-21","C1_School closing",2,"T",2,"T","A CoVID case has been linked to Fairview Junior High School. The school has therefore been closed to in-person classes until June 14, 2021. Source: https://archive.fo/vQRKh"
"9","Nunavut","CAN_NU","09-Jun-21","C1_School closing",2,"T",2,"T","On June 9th, schools in Kinngait and Iqaluit (the only ones at Stage 3) moved to Stage 2. This means that Elementary shcool students return full-time to in-school learning. Middle and High School students however will continue to receive a mix of in-person and home-learning. These students will attend school two to three days a week with staggered schedules to reduce physical interaction. As school is closed for two or three days a week for these students, the code has been left as 2 (require closing, some levels).    Sources:     http://web.archive.org/web/20210616081758/https://www.gov.nu.ca/health/news/public-health-restrictions-eased-kinngait-and-iqaluit-masks-mandatory-across-territory    http://web.archive.org/web/20210616081130/https://gov.nu.ca/sites/default/files/files/2020-21_opening_plan_for_nunavut_schools_-_eng.pdf"
"10","Alberta","CAN_AB","10-Jun-21","C1_School closing",2,"G",1,"G","On June 10, post-secondary schools were permitted to resume in-person learning. K-12 schools throughout Alberta have also resumed in-person learning.    https://web.archive.org/web/20210614034913/https://www.alberta.ca/release.cfm?xID=7934477F07AEA-A03E-C928-08F2CE679254D785"
"11","Nova Scotia","CAN_NS","11-Jun-21","C1_School closing",2,"T",2,"T","A CoVID case has been linked to Breton Education Centre. The school remains closed to in-person learning. Source: https://archive.fo/kj3Gs"
"12","Nova Scotia","CAN_NS","13-Jun-21","C1_School closing",2,"T",2,"T","A CoVID case has been linked to Rocky Lake Junior High. The school has been closed to in-person instruction until June 16, 2021. Source: https://archive.fo/lkXd3"
"13","New Brunswick","CAN_NB","14-Jun-21","C1_School closing",1,"G",1,"G","On 14 June 2021, the province of New Brunswick (NB) is at the Yellow level: “Schools: All educational and camp facilities are open under appropriate public health guidance, virtual to be used for at-risk groups. Post-secondary educational institutions may operate.” Some PSE institutions are still operating largely online -- e.g., at University of NB: “On-campus, in-person summer term courses will be offered through alternative delivery methods so you can continue your spring and summer studies from the comfort and safety of your home.” See Province of NB and UNB websites, archived:   https://web.archive.org/web/20210614140630/https://www2.gnb.ca/content/gnb/en/corporate/promo/covid-19/alert-levels.html  https://web.archive.org/web/20210614140847/https://www2.gnb.ca/content/gnb/en/corporate/promo/covid-19/alert-levels/yellow%20level.html  https://web.archive.org/web/20210614140950/https://www.unb.ca/cel/summer-at-unb.html  "
"14","Newfoundland and Labrador","CAN_NL","14-Jun-21","C1_School closing",1,"G",1,"G","On 14 June 2021, in the province of Newfoundland and Labrador (NL): “an enhanced ‘Scenario 2’ blended learning education delivery model for most high school students …[who] attend school on alternate days to reduce the number of students in class at one time. Those who are not physically in class on a given day will continue their learning from home…[and]  connect virtually with teachers and classmates for at least a portion of each class.” Younger students in elementary school grades receive in-class instruction throughout the province. At Memorial University: “The School of Human Kinetics and Recreation (HKR) will return to offering its programs fully on campus in the spring 2021 semester (beginning in mid-May and ending in mid-August)...The Faculty of Medicine, Faculty of Nursing, School of Pharmacy and Marine Institute will continue with on-campus instruction … Other faculties and schools with spring semester course offerings will continue with primarily remote instruction.” See NL English School District and Memorial University websites, archived: https://web.archive.org/web/20210614172118/https://www.nlesd.ca/includes/files/news/doc/1618333573432.pdf  https://web.archive.org/web/20210614172323/https://www.mun.ca/covid19/students/spring.php"
"15","Northwest Territories","CAN_NT","15-Jun-21","C1_School closing",1,"G",1,"G","Schools continues to remain open. As a result of recent outbreaks, the new School Symptom Screening and Testing Process continues to be in place.  Students and staff who experience symptoms upon being tested will be encouraged to stay home, be assessed by a healthcare provider and issued an assessment card before returning to school.    https://web.archive.org/web/20210531231430/https://www.hss.gov.nt.ca/en/newsroom/introduction-new-school-symptom-screening-and-testing-process"
"16","Nova Scotia","CAN_NS","16-Jun-21","C1_School closing",2,"T",2,"T","A new COVID-19 case was identified on June 16, connected to Prospect Road Elementary, Hatchet Lake, in Central Zone. The school will be closed to students until Monday, June 21, 2021. Source: https://archive.fo/RJpYW"
"17","Prince Edward Island","CAN_PE","16-Jun-21","C1_School closing",1,"G",1,"G","There are no changes to the schools policy. increased sanitation and masks are required in schools, with social distancing where necessary.     the province is in stage 1 of re-opening:   (Effective June 6, 2021)    Moving Forward Step 1: FAQs    Personal gatherings will increase to up to 20 people indoors and outdoors.  Weddings and funerals will be permitted with a maximum of 150 people, in cohorts of 50, hosted by a recognized business or organization.  Special occasion events (ex: backyard weddings, anniversary parties) hosted by individuals are permitted with up to 50 people with a reviewed operational plan.  Restaurants may have a table size of up to 20; no restricted closing time for in-person consumption of food and beverage.    https://archive.vn/yZPrK"
"18","New Brunswick","CAN_NB","21-Jun-21","C1_School closing",1,"G",1,"G","On 21 June 2021, the entire province of New Brunswick (NB) is at Yellow alert -- phase 2 on the path to green: “Schools: All educational and camp facilities are open under appropriate public health guidance, virtual to be used for at-risk groups. Post-secondary educational institutions may operate.” Some PSE institutions are still operating largely online -- e.g., at University of NB: “On-campus, in-person summer term courses will be offered through alternative delivery methods so you can continue your spring and summer studies from the comfort and safety of your home.” See Province of NB and UNB websites, archived:   https://web.archive.org/web/20210619184600/https://www2.gnb.ca/content/dam/gnb/Departments/eco-bce/Promo/covid-19/path-to-green.pdf  https://web.archive.org/web/20210621020706/https://www.unb.ca/cel/summer-at-unb.html  https://web.archive.org/web/20210621111612/https://www2.gnb.ca/content/gnb/en/corporate/promo/covid-19/alert-levels/yellow%20level.html"
"19","Newfoundland and Labrador","CAN_NL","21-Jun-21","C1_School closing",1,"G",1,"G","On 21 June 2021, in the province of Newfoundland and Labrador (NL): “an enhanced ‘Scenario 2’ blended learning education delivery model for most high school students …[who] attend school on alternate days to reduce the number of students in class at one time. Those who are not physically in class on a given day will continue their learning from home…[and]  connect virtually with teachers and classmates for at least a portion of each class.” Younger students in elementary school grades receive in-class instruction throughout the province. At Memorial University: “The School of Human Kinetics and Recreation (HKR) will return to offering its programs fully on campus in the spring 2021 semester (beginning in mid-May and ending in mid-August)...The Faculty of Medicine, Faculty of Nursing, School of Pharmacy and Marine Institute will continue with on-campus instruction … Other faculties and schools with spring semester course offerings will continue with primarily remote instruction.” See NL English School District and Memorial University websites, archived: https://web.archive.org/web/20210621150255/https://www.mun.ca/covid19/students/spring.php  https://web.archive.org/web/20210621150136/https://www.nlesd.ca/includes/files/news/doc/1618333573432.pdf"
"20","Nova Scotia","CAN_NS","21-Jun-21","C1_School closing",2,"T",1,"G","Prospect Road Elementary, Hatchet Lake, in Central Zone re-opened to students on June 21, 2021. There are therefore currently no school closures in the province. Source: https://archive.fo/RJpYW"
"21","Northwest Territories","CAN_NT","22-Jun-21","C1_School closing",1,"G",1,"G","Schools continues to remain open. As a result of recent outbreaks, the new School Symptom Screening and Testing Process continues to be in place.  Students and staff who experience symptoms upon being tested will be encouraged to stay home, be assessed by a healthcare provider and issued an assessment card before returning to school.    https://web.archive.org/web/20210531231430/https://www.hss.gov.nt.ca/en/newsroom/introduction-new-school-symptom-screening-and-testing-process"
"22","Nova Scotia","CAN_NS","24-Jun-21","C1_School closing",1,"G",2,"T","A case of COVID-19 was linked to St. Joseph's - A. McKay Elementary and two cases to Joseph Howe Elementary. St. Joseph's is closed and will re-open to students on June 30, 2021 for closing activities and to retrieve any supplies and personal items. Joseph Howe Elementary will re-open to students on June 28, 2021.    1. Source: https://archive.fo/r1W80  2. Source: https://archive.fo/hiBXI  3. Source: https://archive.fo/RNLlZ"
"23","Nunavut","CAN_NU","25-Jun-21","C1_School closing",2,"T",2,"T","On 25th June in Rankin Inlet and all Qikiqtani communities except Iqaluit, public health measures were eased. Schools moved to Stage 1 of the Opening Plan for Nunavut Schools. Schools in Iqaluit remain at Stage 2    Sources:     http://web.archive.org/web/20210701083813/https://www.gov.nu.ca/health/news/public-health-restrictions-be-eased-across-qikiqtani-rankin-inlet    http://web.archive.org/web/20210616081130/https://gov.nu.ca/sites/default/files/files/2020-21_opening_plan_for_nunavut_schools_-_eng.pdf"
"24","Prince Edward Island","CAN_PE","27-Jun-21","C1_School closing",1,"G",1,"G","There are no changes to the schools policy. increased sanitation and masks are required in schools, with social distancing where necessary.     the province is in stage 1 of re-opening:   (Effective June 6, 2021)    Moving Forward Step 1: FAQs    Personal gatherings will increase to up to 20 people indoors and outdoors.  Weddings and funerals will be permitted with a maximum of 150 people, in cohorts of 50, hosted by a recognized business or organization.  Special occasion events (ex: backyard weddings, anniversary parties) hosted by individuals are permitted with up to 50 people with a reviewed operational plan.  Restaurants may have a table size of up to 20; no restricted closing time for in-person consumption of food and beverage.    https://archive.vn/yZPrK"
"25","New Brunswick","CAN_NB","28-Jun-21","C1_School closing",1,"G",1,"G","On 28 June 2021, the entire province of New Brunswick (NB) is at Yellow alert -- phase 2 on the path to green: “Schools: All educational and camp facilities are open under appropriate public health guidance, virtual to be used for at-risk groups. Post-secondary educational institutions may operate.” Elementary and secondary schools are now on the regular summer break: “summer learning program for students entering grade 10, 11 or 12 in the upcoming school year,...Courses will be offered … as regular distance learning courses. Courses will be taught by online teachers”. Some PSE institutions are still operating largely online -- e.g., at University of NB: “On-campus, in-person summer term courses will be offered through alternative delivery methods so you can continue your spring and summer studies from the comfort and safety of your home.” See Province of NB and UNB websites, archived: https://web.archive.org/web/20210628191913/https://www2.gnb.ca/content/gnb/en/news/news_release.2021.06.0505.html  https://web.archive.org/web/20210628193814/https://www2.gnb.ca/content/gnb/en/corporate/promo/covid-19/alert-levels/yellow%20level.html  https://web.archive.org/web/20210628193221/https://secure1.nbed.nb.ca/sites/ASD-W/LeoHayesHigh/Guidance/Documents/Summer%20Learning%20for%20Students%202021.pdf  https://web.archive.org/web/20210628194005/https://www.unb.ca/cel/summer-at-unb.html"
"26","Newfoundland and Labrador","CAN_NL","28-Jun-21","C1_School closing",1,"G",1,"G","On 28 June 2021, in the province of Newfoundland and Labrador (NL), elementary and secondary schools are on the regular summer break. “The Provincial Government is working … on a full return to school for September”. At Memorial University: “The School of Human Kinetics and Recreation (HKR) will return to offering its programs fully on campus in the spring 2021 semester (beginning in mid-May and ending in mid-August)...The Faculty of Medicine, Faculty of Nursing, School of Pharmacy and Marine Institute will continue with on-campus instruction … Other faculties and schools with spring semester course offerings will continue with primarily remote instruction. Spring Semester extends over a 14-week period beginning in mid-May and ending in mid-August.” See government of NL and Memorial University websites, archived:  https://web.archive.org/web/20210628140956/https://www.gov.nl.ca/releases/2021/education/0624n02/  https://web.archive.org/web/20210628141323/https://www.mun.ca/covid19/students/spring.php"
"27","Northwest Territories","CAN_NT","28-Jun-21","C1_School closing",1,"G",1,"G","Schools continues to remain open. As a result of recent outbreaks, the new School Symptom Screening and Testing Process continues to be in place.  Students and staff who experience symptoms upon being tested will be encouraged to stay home, be assessed by a healthcare provider and issued an assessment card before returning to school.    https://web.archive.org/web/20210531231430/https://www.hss.gov.nt.ca/en/newsroom/introduction-new-school-symptom-screening-and-testing-process"
"28","Alberta","CAN_AB","30-Jun-21","C1_School closing",1,"G",1,"G","Alberta Education released their guidance for the 2021-22 school year on June 30. The next school year is planned to be in-person and with mostly pre-pandemic rules (no masking or social distancing, but will have extra hygiene measures in place), however contingency plans for modified in-person (i.e., masking, distancing) and online learning are listed in case COVID-19 cases rise. It is also noted in the guidance that since those born later than 2010 are not eligible for the vaccine yet, there may be additional COVID-19 measures in place for K-6 learners. Coding is left as 1 as summer school seems to be planned as online, or if in-person, with COVID-19 measures in place.    https://web.archive.org/web/20210703201115/https://open.alberta.ca/dataset/13d2242a-d310-419e-960c-6fe273d0f7b3/resource/ddac0c8a-a68d-46e1-9d76-2a4d34385273/download/edc-school-year-plan-2021-2022.pdf    "
"29","Yukon","CAN_YT","30-Jun-21","C1_School closing",1,"G",1,"G","No policy change. Schools remain open full-time, with sanitary measures in place.    Sources:    https://web.archive.org/web/20210630115100/https://yukon.ca/en/school-operations-covid-19    https://web.archive.org/web/20210630115004/https://yukon.ca/en/health-safety-schools-covid-19"
"30","New Brunswick","CAN_NB","05-Jul-21","C1_School closing",1,"G",1,"G","On 5 July 2021, the entire province of New Brunswick (NB) remains at Yellow alert -- phase 2 on the path to green: “Schools: All educational and camp facilities are open under appropriate public health guidance, virtual to be used for at-risk groups. Post-secondary educational institutions may operate.” Elementary and secondary schools are now on the regular summer break: “summer learning program for students entering grade 10, 11 or 12 in the upcoming school year,...Courses will be offered … as regular distance learning courses. Courses will be taught by online teachers”. Some PSE institutions are still operating largely online -- e.g., at University of NB: “On-campus, in-person summer term courses will be offered through alternative delivery methods so you can continue your spring and summer studies from the comfort and safety of your home.” See Province of NB and UNB websites, archived:   https://web.archive.org/web/20210703180650/https://www2.gnb.ca/content/gnb/en/corporate/promo/covid-19/alert-levels/yellow%20level.html  https://web.archive.org/web/20210703180719/https://secure1.nbed.nb.ca/sites/ASD-W/LeoHayesHigh/Guidance/Documents/Summer%20Learning%20for%20Students%202021.pdf  https://web.archive.org/web/20210703180934/https://www.unb.ca/cel/summer-at-unb.html"
"31","Newfoundland and Labrador","CAN_NL","05-Jul-21","C1_School closing",1,"G",1,"G","On 5 July 2021, in the province of Newfoundland and Labrador (NL), elementary and secondary schools are on the regular summer break. “The Provincial Government is working … on a full return to school for September”. At Memorial University: “The School of Human Kinetics and Recreation (HKR) will return to offering its programs fully on campus in the spring 2021 semester (beginning in mid-May and ending in mid-August)...The Faculty of Medicine, Faculty of Nursing, School of Pharmacy and Marine Institute will continue with on-campus instruction … Other faculties and schools with spring semester course offerings will continue with primarily remote instruction. Spring Semester extends over a 14-week period beginning in mid-May and ending in mid-August.” See government of NL and Memorial University websites, archived:  https://web.archive.org/web/20210702193659/https://www.mun.ca/covid19/students/spring.php  https://web.archive.org/web/20210628140956/https://www.gov.nl.ca/releases/2021/education/0624n02/"
"32","Prince Edward Island","CAN_PE","06-Jun-21","C2_Workplace closing",1,"G",1,"G","no change in code - but from 6 June, there is no restricted open/close time for restaurants.     https://archive.vn/A60Ee"
"33","New Brunswick","CAN_NB","07-Jun-21","C2_Workplace closing",1,"G",1,"G","On 7 June 2021, the entire province of New Brunswick (NB) is at the Yellow level: “All types of businesses and activities are allowed to operate under a COVID-19 operational plan... Occupancy of any facility must be based on the ability to maintain physical distancing between people that are not members of their household or Steady15...Entertainment venues ...may operate under a COVID-19 operational plan. Capacity is based on a maximum of 50% of the facility with physical distancing between patrons who are not members of the same household or Steady15.” See Province of NB website, archived: https://web.archive.org/web/20210607153557/https://www2.gnb.ca/content/gnb/en/corporate/promo/covid-19/alert-levels.html  https://web.archive.org/web/20210605194810/https://www2.gnb.ca/content/gnb/en/corporate/promo/covid-19/alert-levels/yellow%20level.html"
"34","Newfoundland and Labrador","CAN_NL","07-Jun-21","C2_Workplace closing",2,"T",2,"T","On 7 june 2021, the provincial government of Newfoundland and Labrador (NL) continues to apply Alert Level 4 to part of the Western Health Region (St. George’s-Stephenville-Port au Port Area). The north-east coast of Newfoundland (Central Health Region) is at Alert Level 3. The rest of the province remains at Alert Level 2 with businesses open under public health guidelines. At Alert Level 4: “Gym and fitness facilities, yoga studios, swimming pools, tennis and squash facilities, arenas, and dance studios are closed...Performance spaces are closed...Restaurants are closed for in-person dining ...Bars and lounges are closed. Cinemas and bingo halls are closed.” See government of NL website, archived:  https://web.archive.org/web/20210607101132/https://www.gov.nl.ca/covid-19/  https://web.archive.org/web/20210607102202/https://www.gov.nl.ca/covid-19/files/Summary-Table-of-COVID-19-Alert-Level-System-graphic.pdf"
"35","Quebec","CAN_QC","07-Jun-21","C2_Workplace closing",2,"G",2,"G","Restrictions in red zones were lifted and the following regions moved to orange zones: Montreal, Laval, MRC of Beauce-Sartigan / L'Islet / Montmagny / Robert-Cliche (Chaudiere-Appalaches), and MRC of Kamourasaka / Rivieres-du-Loup / Temiscouata / Les Basques (Bas-Saint-Laurent).  The following regions moved from orange to yellow zones: Saguenay-Lac-Saint-Jean, Mauricie and Centre-du-Quebec, Rimouski-Neigette, Mitis, Matapedia and Matane.  The following regions moved from yellow to green zones: Abitibi-Temiscamingue, Cote-Nord, and Nord-du-Quebec.    https://web.archive.org/web/20210622041647/https://www.quebec.ca/premier-ministre/actualites/detail/toutes-les-regions-du-quebec-en-zone-orange-jaune-ou-verte-des-le-7-juin-31958"
"36","Manitoba","CAN_MB","08-Jun-21","C2_Workplace closing",3,"T",3,"T","No policy change: https://web.archive.org/web/20210627232635/https://www.manitoba.ca/covid19/prs/reopening/milestone-one.html"
