"","RegionName","RegionCode","Date","indicator_type","past_value","past_flag","present_value","present_flag","Notes"
"738","Rhode Island","US_RI","08-Dec","C6_Stay.at.home.requirements",1,"G",1,"G","Beginning November 30th, Rhode Island will be hitting Pause for two weeks. The Pause is intended  to reduce community transmission of COVID-19 by dialing down overall mobility and reducing social  gatherings. These reductions are key to stemming Rhode Island’s recent increase in cases and  hospitalizations over the winter months.    http://web.archive.org/web/20201202090304/https://reopeningri.com/wp-content/uploads/2020/11/ReopeningRI-Pause-guidelines-v-F-1.pdf"
"739","South Carolina","US_SC","08-Dec","C6_Stay.at.home.requirements",1,"G",1,"G","Gov. McMaster Executive Order 2020-75 went into effect December 8 to extend the State of Emergency for an additional 15 days until December 23rd. Also, Executive Order No. 2020-73 (Modifying Amending Emergency Measures) is extended for the duration of the State of Emergency.     Link:  https://web.archive.org/web/20201211012939/https://governor.sc.gov/sites/default/files/Documents/Executive-Orders/2020-12-08%20FILED%20Executive%20Order%20No.%202020-75%20-%20State%20of%20Emergency.pdf"
"740","Iowa","US_IA","09-Dec","C6_Stay.at.home.requirements",0,NA,0,NA,"Iowa Governor Kim Reynolds didn't recommend Iowans to stay at home. However, she suggested that vulnerable Iowans should limit high risk activities and activities outside home.     https://web.archive.org/web/20201209231114/https://governor.iowa.gov/sites/default/files/documents/Public%20Health%20Proclamation%20-%202020.12.09.pdf    "
"741","New York","US_NY","09-Dec","C6_Stay.at.home.requirements",1,"G",1,"G","No further updates. "
"742","Connecticut","US_CT","10-Dec","C6_Stay.at.home.requirements",1,"T",1,"T","No change:   On 5 November, the Connecticut State Health Department issued a statewide advisory advising all residents to stay home from 10PM to 5AM. Coded as targeted since the recommendation only covers night hours.    See Office of the Governor Press Release:  https://archive.fo/EADY6"
"743","Georgia","US_GA","10-Dec","C6_Stay.at.home.requirements",2,"T",2,"T","No changes to policy after checking all relevant sources. "
"744","Hawaii","US_HI","10-Dec","C6_Stay.at.home.requirements",2,"G",2,"G","""The Halawa Correctional Facility (HCF) has confirmed three (3) inmates and 10 staff tested positive for COVID-19. The positive inmates were placed in medical isolation. Inmate and staff testing are underway. As a precautionary measure, the HCF warden implemented facility-wide isolation and quarantine protocols, effective today, which includes suspending all inmate movement within the facility as well as transfers to and from the facility, for a minimum of 14 days. There is a total of 936 inmates at HCF. DOH was notified and has already begun contact tracing.      Meanwhile, surge testing of O‘ahu Community Correctional Center (OCCC) and Waiawa Correctional Center (WCF) inmates and staff is continuous. The three (3) OCCC inmate test results received were negative. No new test results were reported for WCF but an additional 12 inmates have recovered increasing the total recoveries to 160 and bringing the active positive inmate cases down to 52, with two (2) inmates hospitalized.  Of the 22 WCF staff results received 20 were negative and two (2) were inconclusive. All WCF staff who tested positive have recovered and been cleared to return work.""     https://web.archive.org/web/20201214173359/https://health.hawaii.gov/news/covid-19/hawaii-covid-19-daily-news-digest-december-10-2020/"
"745","North Carolina","US_NC","10-Dec","C6_Stay.at.home.requirements",1,"G",1,"G","No changes to policy after checking all relevant sources.  "
"746","Ohio","US_OH","10-Dec","C6_Stay.at.home.requirements",1,"G",1,"G","Ohio Department of Health will be extending the 10 p.m. to 5 a.m. statewide curfew (""Stay at Home Tonight"") until January 2, 2021. The curfew started on Nov 19 and was initially to end on Dec 10.    https://web.archive.org/web/20201214052356/https://coronavirus.ohio.gov/wps/portal/gov/covid-19/resources/news-releases-news-you-can-use/covid-19-update-12-10-20"
"747","Vermont","US_VT","10-Dec","C6_Stay.at.home.requirements",1,"G",1,"G","No changes detected in this indicator - Addendum 8 to Amended and Restated Executive Order 01-20 remains in effect.    Includes limits on socializing with members of other households and encourages working from home where possible.     https://web.archive.org/web/20201121224452/https://governor.vermont.gov/sites/scott/files/documents/ADDENDUM%208%20TO%20AMENDED%20AND%20RESTATED%20EXECUTIVE%20ORDER%2001-20.pdf"
"748","Arkansas","US_AR","11-Dec","C6_Stay.at.home.requirements",1,"G",1,"G"," Effective December 11, Executive Order (EO) 51 signed by Governor Hutchinson formally extends the public health and disaster emergency declaration state-wide for an additional twenty days to December 31, 2020.     In it, he extends several EOs and directs people to follow the Arkansas Department of Health.     https://web.archive.org/web/20201213021724/https://governor.arkansas.gov/images/uploads/executiveOrders/EO_20-51.pdf     The Arkansas Department of Health hasn’t changed any restrictions -  on workplace closings, public events, gatherings, stay at home requirements, etc.     https://web.archive.org/web/20201213032035/https://www.healthy.arkansas.gov/programs-services/topics/novel-coronavirus   "
"749","California","US_CA","11-Dec","C6_Stay.at.home.requirements",2,"T",2,"T","On December 11, the Greater Sacramento region joined the regional Stay at Home order, which is in effect for counties with less than 15% ICU availability. It joins the Southern California and San Joaquin Valley regions under the order.    KCRA article: https://web.archive.org/web/20201221065413/https://www.kcra.com/article/greater-sacramento-region-under-regional-stay-at-home-order-thursday/34920681"
"750","North Carolina","US_NC","11-Dec","C6_Stay.at.home.requirements",1,"G",2,"G","Governor Roy Cooper and the North Carolina Department of Health and Human Services Secretary, Mandy Cohen, announced that announced that North Carolina will begin a modified Stay at Home Order after a rapid increase in COVID-19 trends in the state. The Order requires people to stay at home between 10 pm and 5 am and takes effect Friday, December 11 and will be in place until at least January 8, 2021.     https://web.archive.org/save/https://governor.nc.gov/news/key-metrics-increasing-rapidly-north-carolina-begin-modified-stay-home-order-slow-covid-19?fbclid=IwAR3iZ8lIht4XjfxecnnCd8q9GXULRmhn19ZQqG0eReIQiS_8yn5oFLv06Yg    https://web.archive.org/save/https://files.nc.gov/governor/documents/files/EO181-Modified-Stay-at-Home-Early-Closure-Order.pdf   "
"751","Rhode Island","US_RI","12-Dec","C6_Stay.at.home.requirements",1,"G",1,"G","Rhode Island on Pause has been extended for another week, ends on 20th December 2020.    http://web.archive.org/web/20201215195035/https://governor.ri.gov/documents/orders/Executive-Order-20-105.pdf    http://web.archive.org/web/20201219192238/https://reopeningri.com/wp-content/uploads/2020/11/ReopeningRI-Pause-guidelines-v-F-1.pdf"
"752","Alaska","US_AK","13-Dec","C6_Stay.at.home.requirements",1,"T",1,"T","EO-16 remains in effect in Anchorage - individuals are recommended to stay at home.    EO-16:  https://web.archive.org/web/20201206221719/https://www.muni.org/covid-19/documents/signed%20eo-16.pdf  "
"753","Delaware","US_DE","14-Dec","C6_Stay.at.home.requirements",1,"G",2,"G","Beginning on Monday, December 14, 2020 and ending on January 11, 2021 Delaware residents are advised and strongly encouraged to stay home as often as possible and to only leave home to go to work or school, or for necessary needs such as seeking medical care, going to the grocery store or pharmacy, or picking up food.     Given the new restrictions, I’m changing the code to a 2G.    https://web.archive.org/web/20201213040318/https://governor.delaware.gov/wp-content/uploads/sites/24/2020/12/Fourth-Revision-to-the-27th-Modification-of-the-Declaration-of-a-SOE-State-of-Delaware-12.10.20.pdf "
"754","Georgia","US_GA","14-Dec","C6_Stay.at.home.requirements",2,"T",2,"T","No changes to policy after checking all relevant sources. "
"755","Montana","US_MT","14-Dec","C6_Stay.at.home.requirements",1,"G",1,"G","No further updates "
"756","New Hampshire","US_NH","14-Dec","C6_Stay.at.home.requirements",1,"G",1,"G","As of 14 December 2020, New Hampshire's 'Stay at Home 2.0' plan remains in place, encouraging individuals to minimise contact with others beyond their household.    https://web.archive.org/web/20201214224906/https://www.covidguidance.nh.gov/sites/g/files/ehbemt381/files/files/inline-documents/guidance-universal.pdf"
"757","New York","US_NY","14-Dec","C6_Stay.at.home.requirements",1,"G",1,"G","No further updates. "
"758","Oklahoma","US_OK","14-Dec","C6_Stay.at.home.requirements",1,"T",1,"T"," For  those vulnerable individuals living in Counties color-coded Orange or Red on  the OSDH’s Alert System website, such individuals should consider staying in  their home or place of residence except for working in a critical infrastructure  sector and conducting essential errands.    Link: https://web.archive.org/web/20201214215731/https://www.sos.ok.gov/documents/executive/1975.pdf"
"759","Virginia","US_VA","14-Dec","C6_Stay.at.home.requirements",1,"G",2,"G","Gov Northam's Executive Order (EO-72) effective Monday, December 14, 2020, shall remain in full force and effect until 11:59 p.m., January 31, 2021.    The Virginia curfew, which Northam called a “modified stay-at-home order,” will require residents to stay home between midnight and 5 a.m. Exceptions will be made for people traveling for work or seeking medical attention and certain food items.    All individuals in Virginia should remain at their place of residence between the hours of  12:00 a.m. and 5:00 a.m. Individuals may leave their residences for the purposes of:  a. Obtaining food, beverages, goods, or services as permitted in this Order;  b. Seeking medical attention, essential social services, governmental services, assistance  from law enforcement, or emergency services;  c. Taking care of other individuals or animals;  d. Traveling required by court order or to facilitate child custody, visitation, or child care;  e. Engaging in exercise, provided individuals comply with social distancing requirements;  f. Traveling to and from one’s residence, place of worship, or work;  g. Traveling to and from an educational institution;  h. Volunteering with organizations that provide charitable or social services; or  i. Leaving one’s residence due to a reasonable fear for health or safety, at the direction of  law enforcement, or at the direction of another government agency.      https://web.archive.org/web/20201213190606/https://www.governor.virginia.gov/media/governorvirginiagov/executive-actions/EO-72-and-Order-of-Public-Health-Emergency-Nine-Common-Sense-Surge-Restrictions-Certain-Temporary-Restrictions-Due-to-Novel-Coronavirus-(COVID-19).pdf"
"760","Minnesota","US_MN","15-Dec","C6_Stay.at.home.requirements",1,"G",1,"G","“We have safe and effective vaccines starting to come into the state, but it will be many months before everyone has a chance to get vaccinated. In the meantime, we need to keep things moving in the right direction by doing those things we know help reduce COVID-19 transmission. That means masking up, keeping socially distant, washing your hands, staying home when sick and getting tested when appropriate.”    https://archive.fo/SJeO6"
"761","North Carolina","US_NC","15-Dec","C6_Stay.at.home.requirements",2,"G",2,"G","No changes to policy after checking all relevant sources."
"762","Georgia","US_GA","16-Dec","C6_Stay.at.home.requirements",2,"T",2,"T","No changes to policy after checking all relevant sources. "
"763","Maine","US_ME","16-Dec","C6_Stay.at.home.requirements",1,"G",1,"G","Governor Mills' Executive Order of 31st May 2020 urging the over-60s and those with pre-existing medical conditions to stay at home as much as possible is still in effect as of 21st December, so this indicator remains at 1G. "
"764","Nebraska","US_NE","16-Dec","C6_Stay.at.home.requirements",2,"T",1,"G","On December 16, the Department of Health and Human Service discussed about the quarantine reminder.     DHHS recently updated DHMs to match the latest Centers for Disease Control and Prevention (CDC) recommendations shortening the window for quarantine.  For those who’ve been exposed to someone with COVID-19 or anyone experiencing COVID-19 symptoms, quarantine can end after seven days if all of the following conditions have been met:  The person seeks a COVID-19 test on day five following their exposure and tests negative,  The person is not experiencing COVID-19 symptoms, and  The person continues to self-monitor for symptoms and wears a mask through day 14.  Those who’ve been exposed to COVID-19 but don’t take a test can end quarantine when all of the following conditions have been met:  At least 10 days have passed since their exposure,  No COVID-19 symptoms have developed, and  The person continues to self-monitor for symptoms, and wears a mask through day 14.  Those testing positive for COVID-19 must isolate for at least 10 days from when their symptoms began, or the date of their test if no symptoms are present. Isolation can end when:  The person is fever-free without the use of fever reducing medicine for 24 hours, and  Some COVID-19 symptoms may linger, but symptoms are improving.    http://web.archive.org/web/20201221210203/http://dhhs.ne.gov/Pages/DHHS-COVID-19-Weekly-Update-12162020.aspx  "
"765","New Jersey","US_NJ","16-Dec","C6_Stay.at.home.requirements",1,"G",1,"G","(No change).     New Jersey Gov. Phil Murphy issued a state of emergency Wednesday ahead of the powerful winter storm that will begin moving through this afternoon. The state of emergency goes into effect at 2 p.m.    https://web.archive.org/web/20201219050206/https://philadelphia.cbslocal.com/2020/12/16/new-jersey-weather-gov-phil-murphy-issues-state-of-emergency-winter-storm/"
"766","Florida","US_FL","17-Dec","C6_Stay.at.home.requirements",2,"T",2,"T","Commencing December 17th, Miami-Dade County extends the local State of Emergency for an additional 7 days. No new closure/containment measurs have been issued.  Link:  https://web.archive.org/web/20201217031154/https://www.miamidade.gov/information/library/12.16.20-state-of-emergency-declaration-extension-41.pdf"
"767","California","US_CA","18-Dec","C6_Stay.at.home.requirements",2,"T",2,"T","On December 18, all counties in the Bay Area region joined Southern California, San Joaquin Valley, and the Greater Sacramento regions in the regional stay at home order which is in effect if a region's ICU capacity is less than 15%. The only region not under the stay at home order is Northern California. Some of the Bay area counties voluntarily joined the stay at home order earlier in December.    Calif. COVID-19 website: https://web.archive.org/web/20201221070332/https://covid19.ca.gov/stay-home-except-for-essential-needs/    NBC article:  https://web.archive.org/web/20201221070140/https://www.nbcbayarea.com/news/local/all-bay-area-counties-now-under-states-regional-stay-at-home-order/2425099/  "
"768","Florida","US_FL","18-Dec","C6_Stay.at.home.requirements",2,"T",2,"T","Miami-Dade County continues Emergency Order 27-20 that imposes a nightly curfew across the County between 12:00am and 6:00am. The curfew shall be extended from 12:00 a.m. to 1 :00 a.m. on December 24 and December  31, 2020.   Link:  https://web.archive.org/web/20201220191844/http://www.miamidade.gov/information/library/coronavirus-emergency-order-27-20-amendment-4.pdf    Palm Beach County extends the local State of Emergency until December 25th, 2020. No new closure/containment measures have been issued.   Link:  https://web.archive.org/web/20201220191238/https://discover.pbcgov.org/PDF/COVID19/Declaration-of-Continuing-State-of-Emergency.pdf"
"769","Alaska","US_AK","20-Dec","C6_Stay.at.home.requirements",1,"T",1,"T","EO-16 remains in effect in Anchorage - individuals are recommended to stay at home.    EO-16:  https://web.archive.org/web/20201220232934/https://www.muni.org/covid-19/documents/signed%20eo-16.pdf"
"770","Illinois","US_IL","21-Dec","C6_Stay.at.home.requirements",2,"G",2,"G","As of December 21, 2020, the state's Executive Order 2020-73, which ""encourages people to stay home to the greatest extent possible"", is still in effect. Source: https://archive.fo/ZusGe"
"771","Alaska","US_AK","16-Nov","C7_Restrictions.on.internal.movement",2,"G",2,"G","Governor Mike Dunleavy issued COVID-19 Outbreak order 6, effective 16 November 2020.    All travellers entering Alaska have 3 options:  - Present evidence of a pre-travel COVID-19 test with negative results = Must follow strict social distancing for 5 days after arrival, or until they leave Alaska.  - Present evidence of a pre-travel COVID-19 test without results = Must follow strict social distancing until test results arrive.   - No pre-travel COVID-19 test = Must pay $250 for a test at the airport, this is free for residents.      COVID-19 Outbreak Health Order 6:  https://web.archive.org/web/20201121200016/https://covid19.alaska.gov/wp-content/uploads/2020/11/Outbreak-Health-Order-No-6-lnternational-and-Interstate-Travel.pdf  "
"772","Georgia","US_GA","16-Nov","C7_Restrictions.on.internal.movement",0,NA,0,NA,"On 16 October 2020, Governor Brian Kemp signed Executive Order 11.13.20.01, renewing current COVID-19 restrictions through November 30, 2020. Thus, the previous guidance is still in place.    Reference:  https://web.archive.org/save/https://madmimi.com/p/ef7a711?pact=1262003-160630373-12644654706-afc6c3a4be0dc88bdaeee6cdbad9459c595454e9&fbclid=IwAR3Mnz0Fxz1hXXoBNzZEY4hN0B2hNuq-G6f96r8sYFHmGm0GyJYR_PUdIa4"
"773","Hawaii","US_HI","16-Nov","C7_Restrictions.on.internal.movement",2,"G",2,"G"," The 15th Proclamation of Governor Ige on November 16 states that ""all persons entering Hawai‘i shall submit to the mandatory screening process and complete the mandatory documentation identified in the Rules Relating to COVID-19 Screening Process and Travel Self-Quarantine."" The self-quarantine period is 14 days.     https://web.archive.org/web/20201122191437/https://governor.hawaii.gov/wp-content/uploads/2020/11/2011051-ATG_Fifteenth-Proclamation-Related-to-the-COVID-19-Emergency-distribution-signed.pdf"
"774","Illinois","US_IL","16-Nov","C7_Restrictions.on.internal.movement",2,"T",2,"T","Noting that Chicago’s new advisory recommends people to cancel their Thanksgiving plans and travel.     https://web.archive.org/web/20201116024530/https://www.chicago.gov/content/dam/city/sites/covid/health-orders/201112_Stay%20at%20home%20advisory%20and%20guidance_vF.pdf   "
"775","Maine","US_ME","16-Nov","C7_Restrictions.on.internal.movement",2,"G",2,"G","On 13th November, Governor Mills announced that, from 16th November 2020, Massachusetts would no longer be exempt from Maine’s quarantine/negative test requirement. This applies to Maine residents returning from Massachusetts, as well as Massachusetts residents travelling to Maine. The indicator’s level does not change.     Source: http://web.archive.org/web/20201113204135/https://www.maine.gov/governor/mills/news/ahead-holiday-season-mills-administration-announces-massachusetts-no-longer-exempt-quarantine"
"776","New Jersey","US_NJ","16-Nov","C7_Restrictions.on.internal.movement",1,"G",1,"G","""New Jersey welcomes travel to and from our state.    However, to save lives and prevent the spread of COVID-19, the State has issued an incoming travel advisory that all individuals entering New Jersey from states with a significant spread of COVID-19 should quarantine for 14-days after leaving that state.    Under the 14-day quarantine travel advisory announced by the Governors of New Jersey, New York and Connecticut, individuals traveling to or returning to New Jersey from states with increasing rates of COVID-19 are advised to self-quarantine for 14 days. This includes travel by train, bus, car, plane and any other method of transportation.    The 14-day quarantine travel advisory applies to travel from certain ""impacted states"" identified as those that 1) have an average daily number of new cases higher than 10 per 100,000 residents over a seven-day period or 2) have a 10% or higher positivity rate over a seven-day period. The advisory applies to travel from states that meet either of these levels.""    https://web.archive.org/web/20201122224522/https://covid19.nj.gov/faqs/nj-information/travel-and-transportation/which-states-are-on-the-travel-advisory-list-are-there-travel-restrictions-to-or-from-new-jersey"
"777","Rhode Island","US_RI","16-Nov","C7_Restrictions.on.internal.movement",1,"G",1,"G","Any person coming to Rhode Island for a non-work-related purpose from locations  with a high community spread rate as set forth on a list maintained by RIDOH at  health.ri.gov/covid must immediately self-quarantine for 14 days or until such time as  they receive a negative COVID-19 test. This quarantine requirement shall not apply  to a person who has a negative COVID-19 test from a specimen taken no more than  seventy-two (72) hours prior to arrival in Rhode Island. This paragraph shall not  apply to public health, public safety or healthcare workers. It shall also not apply to  Executive Order 20-98  November 19, 2020  Page 4  anyone traveling for medical treatment, to attend funeral or memorial services, to  obtain necessities such as groceries, gas or medication, to drop off or pick up children  from day care or to anyone who must work on their boats.     http://web.archive.org/web/20201120021341/https://governor.ri.gov/documents/orders/Executive-Order-20-98.pdf"
"778","Virgin Islands","US_VI","16-Nov","C7_Restrictions.on.internal.movement",2,"G",0,NA,"This was incorrectly coded previously, I believe. There are no restrictions on movement within the US Virgin Islands."
"779","Connecticut","US_CT","17-Nov","C7_Restrictions.on.internal.movement",2,"G",2,"G","""Executive Order Regarding Travel: Pursuant to Governor Lamont's Executive Order No. 9I, anyone traveling into Connecticut from a state, other than New York, New Jersey, or Rhode Island, with a positive case rate higher than 10 per 100,000 residents, or higher than a 10% test positivity rate over a 7-day rolling average, or from a country for which the Centers for Disease Control and Prevention (CDC) has issued a Level 3 Travel Health Notice, are directed to self-quarantine for a 14-day period from the time of last contact within the identified state or country.""    https://web.archive.org/web/20201129224137/https://portal.ct.gov/coronavirus/travel"
"780","Missouri","US_MO","17-Nov","C7_Restrictions.on.internal.movement",1,"T",1,"T","On Nov. 13, St. Louis County announced a new “Safer at Home” order, effective Nov. 17. “This order means that you must stay at home unless it is necessary to leave for specific activities such as going to work or school, seeking medical care, or buying food or other daily necessities. Exceptions are made for going to church, for visiting family members, and for care for those who need assistance, including children.”  https://archive.fo/YbSOw https://archive.fo/o0l2c"
"781","Washington DC","US_DC","18-Nov","C7_Restrictions.on.internal.movement",2,"G",2,"G","Individuals arriving from states other than Maryland, Virginia, Hawaii and Vermont continue to require 14-day quarantine upon entry into the DC area as well as a CoVID-19 test within 72 hours of traveling.   Source: https://web.archive.org/web/20201123193034/https://www.nbcwashington.com/news/coronavirus/dc-requires-covid-19-testing-for-travelers-from-all-but-four-states/2467594/"
"782","North Carolina","US_NC","18-Nov","C7_Restrictions.on.internal.movement",1,"G",1,"G","No changes to policy after checking all relevant sources."
"783","Oregon","US_OR","19-Nov","C7_Restrictions.on.internal.movement",1,"T",1,"T","The governors of Oregon, Washington and California issued travel advisories mid-November urging visitors entering their states or returning home from travel outside these states to self-quarantine. The advisories urge against non-essential out-of-state travel, ask people to self-quarantine for 14 days after arriving from another state or country, and encourage residents to stay local.    Oregon’s travel advisory does not apply to people who cross state borders for “essential travel,” including work, study, critical infrastructure support, supply chains, economic services, health, immediate medical care and safety and security.    https://web.archive.org/web/20201129164530/https://www.oregon.gov/newsroom/Pages/NewsDetail.aspx?newsid=53708"
"784","Minnesota","US_MN","20-Nov","C7_Restrictions.on.internal.movement",0,NA,1,"G","Incoming visitors and residents that travel out-of-state are asked to quarantine for 14 days upon entry (or reentry) to Minnesota.    Link: https://web.archive.org/web/20201123185257/https://www.exploreminnesota.com/info/coronavirus-covid-19-information"
