"","RegionName","RegionCode","Date","indicator_type","past_value","past_flag","present_value","present_flag","Notes"
"302","Minnesota","US_MN","15-Dec","C2_Workplace.closing",2,"G",2,"G","Gyms and fitness studios : May open for individual exercise at 25 percent capacity, or 100 people maximum, with masks and 12 feet of physical distancing between individuals. Additional guidance about group classes, which can begin January 4, will be forthcoming.  Youth and adult sports: Practices can resume January 4. Additional guidance regarding the resumption of practices will be forthcoming. Additionally, organized sports activity is no longer directly tied to county case data or school learning model.  Outdoor entertainment venues : Open at 25 percent capacity, up to 100 people at a time. If food and drink are served, all must be seated.    https://archive.fo/SJeO6"
"303","North Carolina","US_NC","15-Dec","C2_Workplace.closing",2,"G",2,"G","No changes to policy after checking all relevant sources."
"304","New Jersey","US_NJ","15-Dec","C2_Workplace.closing",1,"G",1,"G","(No change)"
"305","Washington","US_WA","15-Dec","C2_Workplace.closing",2,"G",2,"G","Restrictions are in effect through Jan 4 per Governor Inslee's Proclamation 20-25.9. All Washington counties must be in compliance with the closures and restrictions in place, regardless of the which phase they are in under the Safe Start Reopening Plan. For details: https://web.archive.org/web/20201221202051/https://coronavirus.wa.gov/what-you-need-know/safe-start/whats-open-each-phase"
"306","Florida","US_FL","16-Dec","C2_Workplace.closing",0,NA,0,NA,"Effective December 16th, Broward County local Emergency Order 20-29 including a COVID-19 Comprehensive Emergency Order (CEO) supercedes all previous local emergency orders. All businesses and workplaces are allowed to operate as long as they remain in compliance with the CEO regulations and CDC guidelines, and clearly communicate social distancing measures to customers and employees.     Link:  https://web.archive.org/web/20201216013534/https://www.broward.org/CoronaVirus/Documents/Emergency%20Order%2020-29.pdf"
"307","Georgia","US_GA","16-Dec","C2_Workplace.closing",1,"G",1,"G","No changes to policy after checking all relevant sources. "
"308","Florida","US_FL","17-Dec","C2_Workplace.closing",0,NA,0,NA,"Commencing December 17th, Miami-Dade County extends the local State of Emergency for an additional 7 days. No new closure/containment measurs have been issued.  Link:  https://web.archive.org/web/20201217031154/https://www.miamidade.gov/information/library/12.16.20-state-of-emergency-declaration-extension-41.pdf"
"309","Iowa","US_IA","17-Dec","C2_Workplace.closing",1,"G",1,"G","On December 17th, Iowa Governor Kim Reynolds issued a proclamation that allows businesses to reopen or continue to reopen as long as they follow social distancing guidelines, public health measures, and mask mandate. For details on the regulations of specific businesses, please visit: http://web.archive.org/web/20201216222954/https://governor.iowa.gov/sites/default/files/documents/Public%20Health%20Proclamation%20-%202020.12.16.pdf "
"310","Florida","US_FL","18-Dec","C2_Workplace.closing",0,NA,0,NA,"Palm Beach County extends the local State of Emergency until December 25th, 2020. No new closure/containment measures have been issued.     Link:  https://web.archive.org/web/20201220191238/https://discover.pbcgov.org/PDF/COVID19/Declaration-of-Continuing-State-of-Emergency.pdf"
"311","Oregon","US_OR","18-Dec","C2_Workplace.closing",2,"G",2,"G","Effective Dec. 18 through Dec. 31, there will be 29 counties in the Extreme Risk level, one county at Moderate Risk, and six counties at Lower Risk. County risk levels are reassigned every two weeks. For more information on what businesses are required to close or adjust services in the different levels, see here:    https://web.archive.org/web/20201221143442/https://coronavirus.oregon.gov/Pages/living-with-covid-19.aspx    https://web.archive.org/web/20201221143034/https://www.oregon.gov/newsroom/Pages/NewsDetail.aspx?newsid=53904"
"312","Arkansas","US_AR","19-Dec","C2_Workplace.closing",1,"G",2,"T","While Arkansas as a state is still in Phase 2, which allows for dine-in service to be at 66%, in Little Rock and in Bentonville (for some), restaurants, bars, and clubs are open for in-person service but have reduced indoor and outdoor seating to 33% of total capacity.    Since some districts are restricting business more than others, I’m changing the code to a 2T.     Additionally, effective immediately, Little Rock District Court, 2nd Division (Traffic Court), will handle as many of its cases via “virtual court” as possible, using the WebEx program. Ticket recipients should contact the court to make sure they get on the “Cyber-Docket.”    Dine-in operations at the state level (last modified 9 September): https://web.archive.org/web/20201219154031/https://www.healthy.arkansas.gov/images/uploads/pdf/directive__restaurant_dine-in_modified.pdf     Little Rock dine-in: https://web.archive.org/web/20201219153221/https://www.littlerock.gov/city-administration/mayors-office/covid-19-information/dine-out-little-rock/     Bentonville dine-in: https://web.archive.org/web/20201219153325/https://www.visitbentonville.com/media/covid-19-bentonville-restaurants-events-attractions-and-retail/    Little Rock court: https://web.archive.org/web/20201219154144/https://www.littlerock.gov/city-administration/city-departments/district-courts/traffic-court/ "
"313","Alaska","US_AK","20-Dec","C2_Workplace.closing",2,"T",2,"T","EO-16 remains in effect in Anchorage. Bingo halls, private clubs, theatres and other recreational/entertainment facilities must close. Additionally, the hospitality industry must close, with the exception of outdoor dining, take-out and delivery service.    Employers are also encouraged to allow employees to work remotely, if possible to do so without significantly impeding business operations.    EO-16:  https://web.archive.org/web/20201220232934/https://www.muni.org/covid-19/documents/signed%20eo-16.pdf"
"314","Tennessee","US_TN","20-Dec","C2_Workplace.closing",1,"T",2,"G","Executive Order 70, effective and enforceable as of 11:59 p.m., CST, on December 20, 2020, shall remain in effect until 11:59 p.m., CST, on January 19, 2021.    ""...persons are encouraged to work remotely or via telework from home, where possible, and all employers and businesses are strongly urged to take steps to the greatest extent practicable to equip, encourage, allow, or require employees to work remotely or via telework from home.""    https://web.archive.org/web/20201221185500/https://publications.tnsosfiles.com/pub/execorders/exec-orders-lee70.pdf"
"315","Illinois","US_IL","21-Dec","C2_Workplace.closing",1,"G",1,"G","As of December 21, 2020, the Governor's Executive Order 2020-73 which urges businesses to facilitate remote work where possible is still in effect. Source: https://archive.fo/ZusGe"
"316","Delaware","US_DE","16-Nov","C3_Cancel.public.events",1,"G",1,"G","In a press release for the week of 16 November, Governor John Carney recommends that people do not meet with others outside the household, in view of recent spikes.    See the Press Release:  https://archive.fo/3Fl6e"
"317","Georgia","US_GA","16-Nov","C3_Cancel.public.events",2,"G",2,"G","On 16 October 2020, Governor Brian Kemp signed Executive Order 11.13.20.01, renewing current COVID-19 restrictions through November 30, 2020. Thus, the previous guidance is still in place.    Reference:  https://web.archive.org/save/https://madmimi.com/p/ef7a711?pact=1262003-160630373-12644654706-afc6c3a4be0dc88bdaeee6cdbad9459c595454e9&fbclid=IwAR3Mnz0Fxz1hXXoBNzZEY4hN0B2hNuq-G6f96r8sYFHmGm0GyJYR_PUdIa4"
"318","Illinois","US_IL","16-Nov","C3_Cancel.public.events",1,"G",1,"G","While the 1G continues, in the Chicago Advisory effective November 16, residents are “strongly advised” not to have guests in their homes unless they’re essential workers, to cancel traditional Thanksgiving celebrations, and to avoid travel.     https://web.archive.org/web/20201116024530/https://www.chicago.gov/content/dam/city/sites/covid/health-orders/201112_Stay%20at%20home%20advisory%20and%20guidance_vF.pdf "
"319","Kansas","US_KS","16-Nov","C3_Cancel.public.events",1,"G",2,"T","Johnson County enacted an Emergency Order effective November 16. As part of the EO, large events are prohibited. ""Outdoor and indoor entertainment venues with capacities in excess of 2,000 people may not host events. Businesses and organizations seeking to hold an event such as a conference, wedding or other mass gathering in excess of the limit must submit a plan to the Johnson County Department of Health and Environment specifying how they will ensure public safety during operations. Fairs, festivals, carnivals, parades and similar events are prohibited."" Johnson County EO FAQ's: https://web.archive.org/web/20201124055309/https://www.jocogov.org/sites/default/files/documents/CMO/November_13_emergency_order_FAQ_approved.pdf"
"320","North Dakota","US_ND","16-Nov","C3_Cancel.public.events",2,"T",1,"G","North Dakota Governor signed an executive order to implement mitigation measures, which take effect Nov. 16, and include the following pertaining to public events 1) All banquet, ballroom and event venues are limited to 25 percent of their maximum occupancy. 2) All high school winter sports and other extracurricular K-12 school activities are suspended until Dec. 14  -This doesn't cancel events, but requires usage of preventative measures.     https://web.archive.org/web/20201207080835/https://www.health.nd.gov/news/burgum-announces-new-requirements-businesses-gatherings-and-masks-delays-winter-activities    https://web.archive.org/web/20201207081215/https://www.governor.nd.gov/sites/www/files/documents/executive-orders/Executive%20Order%202020-43.pdf"
"321","Nebraska","US_NE","16-Nov","C3_Cancel.public.events",2,"T",1,"T","On November 16, he Governor reviewed Nebraska’s recently announced plan to tighten or loosen health restrictions in phases, based on trends in coronavirus-related hospitalizations.  A chart outlining each of the five, color-coded phases is available by clicking here.  Currently, Nebraska is in the “orange” phase.      Extra activities: Fan attendance limited to household members & 6 ft Separation  Church: 6  ft Separation between Household Units  Wedding & Funeral Reception: Parties of 8, 6 ft Separation, Dancing at Tables Only  Indoor Gathering: 25%, Parties of 8, 6 ft Separation  Outdoor Gatherings: 100%, Parties of 8, 6 ft Separation    See the Office of Governor press release, archived: https://web.archive.org/web/20201123133643/https://governor.nebraska.gov/press/gov-ricketts-encourages-nebraskans-continue-good-health-habits-support-restaurants"
"322","Rhode Island","US_RI","16-Nov","C3_Cancel.public.events",1,"G",1,"G"," Subject to strict adherence to physical distancing, masking, screening and sanitation  protocols, indoor venues of assembly, including convention centers, concert halls,  performance venues, and theaters may operate at up to 50% of capacity or 1 person  Executive Order 20-98  November 19, 2020  Page 5  per 100 square feet, subject to Phase III guidelines, to a cap of one hundred and  twenty-five (125) people.  12. Subject to strict adherence to social distancing, masking, screening and sanitation  protocols, outdoor venues of assembly that host events such as fairs, festivals,  concerts, and performances may operate at up to 66% of capacity or 1 person per 100  square feet, subject to Phase III guidelines, to a cap of one hundred and fifty (150)  people.  13. Consistent with the foregoing restrictions on places of assembly, religious and faithbased organizations may conduct indoor in-person activities up to 50% percent of  worship space capacity, subject to a cap of one hundred and twenty-five (125) people  and to the Phase III guidelines for religious and faith-based organizations which are  available at https://ReopeningRI.com. Live streaming or broadcasting of religious  services or attendance through outdoor drive-in services are permitted and strongly  recommended, particularly for vulnerable populations, including those over 65 years  of age. Outdoor religious services may operate at 66% of capacity to a cap of one  hundred and fifty (150) people, with physical distancing and masking in effect.  14. All houses of worship must develop a COVID-19 Control Plan which shall be  available for inspection by the Task Force created by Executive Order 20-32. A  template for COVID-19 Control Plans can be found at https://ReopeningRI.com.    http://web.archive.org/web/20201120021341/https://governor.ri.gov/documents/orders/Executive-Order-20-98.pdf"
"323","Virgin Islands","US_VI","16-Nov","C3_Cancel.public.events",1,"G",1,"G","Although staying at home is recommended, no policy to cancel events is in place.  https://web.archive.org/web/20201121230108/https://www.covid19usvi.com/"
"324","Connecticut","US_CT","17-Nov","C3_Cancel.public.events",1,"G",1,"G","Phase 2.1: Outdoor event venues up to 25% capacity, fairs and festivals up to 25% of last year's capacity    https://web.archive.org/web/20201129223314/https://portal.ct.gov/DECD/Content/Coronavirus-Business-Recovery/Sector-Rules-and-Certification-for-Reopen"
"325","Delaware","US_DE","17-Nov","C3_Cancel.public.events",1,"G",1,"G","In a press release for the week of 16 November, Governor John Carney recommends that people do not meet with others outside the household, in view of recent spikes.    See the Press Release:  https://archive.fo/3Fl6e"
"326","Iowa","US_IA","17-Nov","C3_Cancel.public.events",1,"G",1,"G","On November 17th, Iowa Governor Kim Reynolds put a new restriction on the number of event and gathering attendees. The maximum permitted capacity for indoor and outdoor events was 15 and 30 people, respectively. This restriction was effective until December 10th.  http://web.archive.org/web/20201117134300/https://governor.iowa.gov/sites/default/files/documents/Public%20Health%20Proclamation%20-%202020.11.16.pdf "
"327","Louisiana","US_LA","17-Nov","C3_Cancel.public.events",2,"G",1,"G","Link: https://web.archive.org/web/20201120105142/https://gov.louisiana.gov/assets/Proclamations/2020/158-JBE-2020-State-of-Emergency-Renewing-COVID-19-Resilient-Louisiana.pdf"
"328","Massachusetts","US_MA","17-Nov","C3_Cancel.public.events",1,"G",1,"G","No change in policy found."
"329","New Jersey","US_NJ","17-Nov","C3_Cancel.public.events",1,"G",1,"G","""Governor Phil Murphy today signed Executive Order No. 196, which lowers indoor and outdoor gathering limits. Effective Tuesday, November 17 at 6:00 a.m., the indoor gathering limit will decrease from 25 to 10 people. The outdoor gathering limit will decrease from 500 people to 150 people, effective Monday, November 23 at 6:00 a.m.""    https://web.archive.org/web/20201122222845/https://nj.gov/governor/news/news/562020/approved/20201116e.shtml"
"330","Washington DC","US_DC","18-Nov","C3_Cancel.public.events",2,"G",2,"G","No policy change"
"331","Iowa","US_IA","18-Nov","C3_Cancel.public.events",1,"G",1,"G","On November 18th, Iowa Governor Kim Reynolds issued a new proclamation which further clarified the requirements for athletic events and gatherings.   http://web.archive.org/web/20201118223240/https://governor.iowa.gov/sites/default/files/documents/Public%20Health%20Proclamation%20-%202020.11.18.pdf "
"332","Michigan","US_MI","18-Nov","C3_Cancel.public.events",1,"G",2,"G","On November 18th, the department of health and human services of Michigan made several changes to the state-wide response. Specifically:     Any indoor nonresidential gatherings are not allowed, and any non-residential outdoor venue can only host maximum 20 persons.     See archive: https://web.archive.org/web/20201118032616/https://www.michigan.gov/coronavirus/0,9753,7-406-98178_98455-545136--,00.html  "
"333","North Carolina","US_NC","18-Nov","C3_Cancel.public.events",1,"G",1,"G","No changes to policy after checking all relevant sources."
"334","Oregon","US_OR","18-Nov","C3_Cancel.public.events",2,"G",2,"G","A new health and safety framework will be implemented on December 3 following the statewide freeze measures. Four different risk levels for counties based on their level of COVID-19 spread—Extreme Risk, High Risk, Moderate Risk, and Lower Risk.    ""On Monday, November 30, the Oregon Health Authority will reexamine county data to determine which counties qualify for each risk level on December 3, following the end of the 2-Week Freeze. In each subsequent two-week period, the Oregon Health Authority will examine and publish county data weekly, but county risk levels will not change until the end of the second week. In the first week, counties will be given Warning Week data to prepare for potential risk level changes. In the second week, county risk levels will be updated based on that week’s data. More detailed information will be posted before December 3.""  https://web.archive.org/web/20201130194926/https://govstatus.egov.com/or-covid-19/"
"335","Pennsylvania","US_PA","18-Nov","C3_Cancel.public.events",1,"G",1,"G","(Based on the note detailed in C1, assuming that 67 people/1000 square feet is preferable for outdoor events, especially for venues with low occupancy, public events could potentially require cancellation and so I've coded it as a 2T)      https://web.archive.org/web/20201119161204/https://www.health.pa.gov/topics/disease/coronavirus/Pages/Guidance/Event-Occupancy.aspx"
"336","Florida","US_FL","19-Nov","C3_Cancel.public.events",1,"T",1,"T","Miami-Dade County extends the Local State of Emergency on November 19 for an additional 7 days. No new containment/closure measurements have been introduced.     Link:  https://web.archive.org/web/20201121184950/http://www.miamidade.gov/information/library/11.18.20-state-of-emergency-declaration-extension-37.pdf"
"337","New Mexico","US_NM","19-Nov","C3_Cancel.public.events",2,"G",2,"G","A public health order was updated Nov 19. This order bans all mass gatherings, defined as any event that brings together more than 5 people from different households inside or outside. Certain changes to the few and very specific exceptions are made, for example for religious services which are now limited to 25% of building capacity. In effect until Nov 30.     Source: https://web.archive.org/web/20201127140145/https://cv.nmhealth.org/wp-content/uploads/2020/11/111820-PHO.pdf"
"338","New York","US_NY","19-Nov","C3_Cancel.public.events",2,"T",2,"T","NYC Health's localized restrictions were updated and effective November 19th, the following restrictions (varying with respect to cluster codes - Red/Orange/Yellow) were in place.    Red Zone: Nonessential gatherings of any size are prohibited and must be postponed or cancelled. Any individual who encourages, promotes or organizes mass gatherings may be fined up to $15,000 per day.    Orange Zone: Nonessential indoor and outdoor gatherings must be limited to no more than 10 people. Any individual who encourages, promotes or organizes mass gatherings may be fined up to $15,000 per day.    Yellow Zone:  Nonessential indoor and outdoor gatherings must be limited to no more than 25 people. Any individual who encourages, promotes or organizes mass gatherings may be fined up to $15,000 per day    https://web.archive.org/web/20201118200503/https://www1.nyc.gov/assets/doh/downloads/pdf/covid/covid-19-localized-restrictions.pdf"
"339","Florida","US_FL","20-Nov","C3_Cancel.public.events",1,"T",1,"T","Palm Beach County extends the Continuing State of Emergency for an additional 7 days -- until November 27th. No new containment/closure measurements have been introduced.    Link:  https://web.archive.org/web/20201121184359/https://discover.pbcgov.org/PDF/COVID19/Declaration-of-Continuing-State-of-Emergency.pdf"
"340","Illinois","US_IL","20-Nov","C3_Cancel.public.events",1,"G",1,"G","Executive Order 2020-73 prohibits indoor group sporting and recreational activities including youth and recreational sports. They do not apply to collegiate or professional sports.    https://web.archive.org/web/20201120184527/https://www2.illinois.gov/Pages/Executive-Orders/ExecutiveOrder2020-73.aspx  "
"341","Minnesota","US_MN","20-Nov","C3_Cancel.public.events",1,"G",2,"G","From 20th November, there are strong recommendation for virtual services ONLY. Weddings, funerals, and other similar planned ceremonies can be held with the current rules in place, but all receptions and gatherings connected to these ceremonies must be canceled or postponed. Also it is noted that gathering is allowed with immediate household members ONLY.    Link: https://web.archive.org/web/20201123180316/https://mn.gov/covid19/for-minnesotans/stay-safe-mn/stay-safe-plan.jsp"
"342","Montana","US_MT","20-Nov","C3_Cancel.public.events",1,"G",1,"G","Public events of more than 25 people are not permitted if social distancing cannot be maintained.  As of November 20,  the state requires all businesses that must operate at no more than 50% capacity and enforce social distancing.  Groups of larger than 25 banned if social distancing cannot be maintained.  Bars and restaurants and tasting rooms must close at 10:00 pm.   Masks are required in any public indoor space.    https://web.archive.org/save/https://www.mtpr.org/post/montana-coronavirus-closures-restrictions"
"343","Alaska","US_AK","21-Nov","C3_Cancel.public.events",0,NA,0,NA,"No detected change in this indicator after searching executive orders, press releases and news articles."
"344","Tennessee","US_TN","21-Nov","C3_Cancel.public.events",2,"T",2,"T","Effective 21 November 2020, Nashville's government limits gatherings—public and private—to 8 people. This means all public events are still cancelled. See the guidance here: https://web.archive.org/web/20201207215021/https://www.tennessean.com/story/news/2020/11/19/nashville-covid-19-restrictions-gatherings-rules-8-people/3773047001/"
"345","Vermont","US_VT","21-Nov","C3_Cancel.public.events",2,"G",2,"G","No change detected.    As a result of gathering restrictions set out in Addendum 8 to Amended and Restated Executive Order 01-20, it is assumed that public events are cancelled as this restriction would prevent a sizeable public event from taking place.    Addendum 8 to Amended and Restated Executive Order 01-20:  https://web.archive.org/web/20201121224452/https://governor.vermont.gov/sites/scott/files/documents/ADDENDUM%208%20TO%20AMENDED%20AND%20RESTATED%20EXECUTIVE%20ORDER%2001-20.pdf"
"346","California","US_CA","22-Nov","C3_Cancel.public.events",2,"T",2,"T","On 20 November, public gatherings are still cancelled in widespread or purple tiers, with concert venues, convention centres and amusement parks still closed. Exceptions are made for outdoor protests, as long as a physical distance of at least 6 feet is maintained between persons or groups of persons from different households at all times. In addition, participants must wear a face covering or mask. Local Health Officers are advised to consider appropriate limitations on outdoor attendance capacities, factoring their jurisdiction’s key COVID-19 health indicators. Failure to follow these requirements may result in an order to disperse or other enforcement action.     California COVID-19 FAQ's: https://web.archive.org/web/20201123070758/https://covid19.ca.gov/stay-home-except-for-essential-needs/    California Blueprint for a Safer Economy website: https://web.archive.org/web/20201123065110/https://covid19.ca.gov/safer-economy/"
"347","Arizona","US_AZ","23-Nov","C3_Cancel.public.events",1,"G",1,"G","No policy change. Events can be approved to go ahead at the government's discretion if they exceed the 50-person gathering limit.  https://web.archive.org/web/20201130010442/https://www.aarp.org/politics-society/government-elections/info-2020/coronavirus-state-restrictions.html"
"348","Illinois","US_IL","23-Nov","C3_Cancel.public.events",1,"G",1,"G","Executive Order 2020-73, which encourages the limiting of gatherings and prohibits indoor events in still in effect. Source: https://web.archive.org/web/20201130122507/https://www2.illinois.gov/Pages/Executive-Orders/ExecutiveOrder2020-73.aspx"
"349","New Hampshire","US_NH","23-Nov","C3_Cancel.public.events",1,"G",1,"G","""Officials in the Twin States are urging people to stay closer to home for the holidays this year. The warnings come as the U.S. hit a high of 100,000 new COVID-19 cases for the first time on Wednesday, then setting new records in each of the three following days. New Hampshire also is reporting record highs in cases, and infections in Vermont are ticking upward as well, with the state reporting daily totals last week at levels not seen since June. In light of the recent spikes, some families like White’s are adjusting their holiday plans.""  In the Granite State, Republican Gov. Chris Sununu, who has seven siblings and dozens of nieces and nephews, told reporters at a late October news conference that he would celebrate both Thanksgiving and Christmas without extended family this year.    'We’re keeping it separate, keeping it in our immediate families, because there’s just no need to take that risk,' he said. 'I think it’s a small sacrifice to say we’re not going to travel. We’re not going to get involved in large groups. All the kids go to different schools. All the parents work, for the most part, in different locations. So that just adds that domino effect of risk that you’re bringing into play.'""    https://web.archive.org/web/20201129213925/https://www.vnews.com/Health-officials-urge-families-to-stay-close-to-home-for-the-holidays-37137759"
