"","RegionName","RegionCode","Date","indicator_type","past_value","past_flag","present_value","present_flag","Notes"
"342","New Brunswick","CAN_NB","08-Mar-21","H2_Testing policy",2,NA,2,NA,"On 8 march 2021, New Brunswick (NB) Public Health announced: “All of the test results from the three-day walk-in clinic in Zone 7 (Miramichi region) have been processed and were all negative.” Accordingly, NB has resumed standard testing: “If you have one or more symptoms you are able to be tested for COVID-19...If you were a close contact of a confirmed positive case, Public Health will contact you with directions on when to be tested.” See Province of NB websites, archived:  https://web.archive.org/web/20210308204504/https://www2.gnb.ca/content/gnb/en/corporate/promo/covid-19/news/news_release.2021.03.0174.html  https://web.archive.org/web/20210308214039/https://www2.gnb.ca/content/gnb/en/departments/ocmoh/cdc/content/respiratory_diseases/coronavirus/coronavirusexposure.html  "
"343","Manitoba","CAN_MB","09-Mar-21","H2_Testing policy",2,NA,2,NA,"No policy change: https://web.archive.org/web/20210315224139/https://manitoba.ca/covid19/media/index.html"
"344","Nunavut","CAN_NU","10-Mar-21","H2_Testing policy",1,NA,1,NA,"Nunavut's self-assessment tool still states that testing is recommended based on symptoms *and* identified exposure either by high risk contact and/or returned from travel. Since the decision to give an individual a test is not based on their symptoms alone, this policy has been coded as 1.    Source: https://web.archive.org/web/20210318091606/https://nu.thrive.health/covid19/en"
"345","Saskatchewan","CAN_SK","11-Mar-21","H2_Testing policy",3,NA,3,NA,"Testing continues. """"There were 2,850 COVID-19 tests processed in Saskatchewan on March 10, 2021.""""    https://web.archive.org/web/20210322163110/https://www.saskatchewan.ca/government/news-and-media/2021/march/11/covid19-update-for-march-11-95879-vaccines-administered-165-new-cases-153-recoveries-no-new-deaths"
"346","Newfoundland and Labrador","CAN_NL","12-Mar-21","H2_Testing policy",3,NA,3,NA,"12 March 2021 is the last day in the province of Newfoundland and Labrador Eastern Health region for “asymptomatic clinics, implemented last week to probe for pockets of the virus not yet detected... ‘We are pleased with the outcome,’ [the Chief Medical Officer] said, ...uncovered no positive cases out of about 3,000 swabs”. See CBC news website, archived: https://web.archive.org/web/20210314220441/https://www.cbc.ca/news/canada/newfoundland-labrador/covid-nl-march-10-1.5943569"
"347","New Brunswick","CAN_NB","15-Mar-21","H2_Testing policy",2,NA,2,NA,"On 15 march 2021, New Brunswick (NB) Public Health is continuing with standard symptomatic testing: “If you have one or more symptoms you are able to be tested for COVID-19...If you were a close contact of a confirmed positive case, Public Health will contact you with directions on when to be tested.” See Province of NB website, archived:  https://web.archive.org/web/20210315144746/https://www2.gnb.ca/content/gnb/en/departments/ocmoh/cdc/content/respiratory_diseases/coronavirus/coronavirusexposure.html"
"348","Newfoundland and Labrador","CAN_NL","15-Mar-21","H2_Testing policy",2,NA,2,NA,"As of 15 march 2021, the government of Newfoundland and Labrador (NL) continues to advise:“Individuals who develop symptoms of COVID-19 are advised to complete the COVID-19 self-assessment to determine if they should call 811...If it is determined by 811 that you require testing, this will be arranged through Public Health. Testing may be completed in the home, at a drive-thru testing site, or another location as determined by Public Health.” See NL government website, archived:  https://web.archive.org/web/20210315174151/https://www.gov.nl.ca/covid-19/faqs/"
"349","Nova Scotia","CAN_NS","15-Mar-21","H2_Testing policy",3,NA,3,NA,"Asymptomatic testing continues to be widely available and encouraged in the province in addition to symptomatic testing. Source: https://archive.fo/B9r4n"
"350","Manitoba","CAN_MB","16-Mar-21","H2_Testing policy",2,NA,2,NA,"No policy change: https://web.archive.org/web/20210321191927/https://manitoba.ca/covid19/media/index.html    However, this new eligibility did come into effect on March 19th: """"Individuals without symptoms of COVID-19 travelling to, or returning to, a First Nations or Indigenous and Northern Relations community can seek testing within three days of travel at no cost at several COVID-19 testing sites in Winnipeg, Thompson and The Pas."""""
"351","Northwest Territories","CAN_NT","16-Mar-21","H2_Testing policy",2,NA,2,NA,"No change to previous policy. """"Currently, COVID-19 testing prioritizes symptomatic individuals for COVID-19 testing, including those with mild symptoms.""""    https://web.archive.org/web/20210322222607/https://www.gov.nt.ca/covid-19/en/services/about-covid-19/testing"
"352","Ontario","CAN_ON","17-Mar-21","H2_Testing policy",2,NA,2,NA,"Province expanding testing program to more business sectors and providing guidance on self-administered tests.    """"The Ontario government is making it easier for businesses to test for COVID-19 in the workplace by providing guidance to employees who want to self-swab for a rapid antigen point-of-care test on a voluntary basis under the supervision of a trained individual. Based on the success of the initial deployment of rapid antigen testing, the government is also expanding the program to more sectors including first responders, emergency medical services, trucking and transportation, wastewater management, and post-secondary institutions.""""    https://web.archive.org/web/20210326004637/https://news.ontario.ca/en/release/60745/ontario-making-it-easier-to-administer-rapid-covid-19-testing-in-the-workplace"
"353","Prince Edward Island","CAN_PE","17-Mar-21","H2_Testing policy",2,NA,2,NA,"Anyone with symptoms can get tested.     https://archive.vn/yY5MG"
"354","Nova Scotia","CAN_NS","21-Mar-21","H2_Testing policy",3,NA,3,NA,"Symptomatic and asymptomatic testing continues to be widely available and encouraged in the province. Source: https://archive.fo/MVKri#selection-263.0-317.107"
"355","Alberta","CAN_AB","22-Mar-21","H2_Testing policy",2,NA,2,NA,"As of March 22, criteria for testing remains at anyone with symptoms, or in outbreak settings.    https://web.archive.org/web/20210322225714/https://www.albertahealthservices.ca/topics/Page17058.aspx  "
"356","Manitoba","CAN_MB","22-Mar-21","H2_Testing policy",2,NA,2,NA,"""""As of March 23, the following individuals are eligible for to access a rapid testing appointment at the Fast Pass site at 1066 Nairn Ave. in Winnipeg, whether or not they are showing symptoms:  • all Manitoba teachers, educational support staff and other staff working in schools and directly with students; and  • Manitoba staff working in licensed centre-based child-care facilities and child-care providers or individuals working in licensed home-based facilities.""""     https://web.archive.org/web/20210328171101/https://manitoba.ca/covid19/media/index.html"
"357","New Brunswick","CAN_NB","22-Mar-21","H2_Testing policy",2,NA,2,NA,"On 22 march 2021, New Brunswick (NB) Public Health is continuing with standard symptomatic testing: “If you have one or more symptoms you are able to be tested for COVID-19...If you were a close contact of a confirmed positive case, Public Health will contact you with directions on when to be tested.” See Province of NB website, archived:  https://web.archive.org/web/20210322175936/https://www2.gnb.ca/content/gnb/en/departments/ocmoh/cdc/content/respiratory_diseases/coronavirus/coronavirusexposure.html"
"358","Newfoundland and Labrador","CAN_NL","22-Mar-21","H2_Testing policy",2,NA,2,NA,"As of 22 march 2021, the government of Newfoundland and Labrador (NL) continues to advise:“Individuals who develop symptoms of COVID-19 are advised to complete the COVID-19 self-assessment to determine if they should call 811...If it is determined by 811 that you require testing, this will be arranged through Public Health. Testing may be completed in the home, at a drive-thru testing site, or another location as determined by Public Health.” See NL government website, archived:  https://web.archive.org/web/20210322193903/https://www.gov.nl.ca/covid-19/faqs/"
"359","Alberta","CAN_AB","23-Mar-21","H2_Testing policy",2,NA,2,NA,"On March 23, the provincial government announced an increase in availability of rapid tests:     """"At least two million rapid tests will be available for businesses and sectors in Alberta. This follows the successful rollout of more than 1.2 million rapid tests to long-term care facilities, schools, outbreak sites, hospitals, homeless shelters and industries across the province.    Any employer or service provider in Alberta can apply for the free rapid tests.""""    https://web.archive.org/web/20210329221033/https://www.alberta.ca/release.cfm?xID=77779BF6D80AE-F7DD-0C13-8123BEC09DEBB5DC"
"360","Saskatchewan","CAN_SK","23-Mar-21","H2_Testing policy",3,NA,3,NA,"Testing continues.     https://web.archive.org/web/20210327204821/https://www.cbc.ca/news/canada/saskatchewan/covid-sask-march-27-2021-1.5967084"
"361","Yukon","CAN_YT","23-Mar-21","H2_Testing policy",2,NA,2,NA,"Testing is still available to anyone experiencing respiratory illnesses or who have flu-like symptoms.      Source: https://web.archive.org/web/20210323204021if_/https://yukon.ca/en/find-respiratory-assessment-centre"
"362","New Brunswick","CAN_NB","28-Mar-21","H2_Testing policy",NA,NA,3,NA,"On 28 March 2021, in the province of New Brunswick (NB), testing continues to be available of asymptomatic individuals in the Red zone (city of Edmundston, upper Madawaska). “The COVID-19 assessment centres at the Edmundston Regional Hospital and the Grand Falls General Hospital will be open extended hours with additional testing capacity. Asymptomatic individuals who wish to be tested and who are NOT supposed to be self-isolating can go online and register.” See province of NB website, archived:  https://web.archive.org/web/20210329015423/https://www2.gnb.ca/content/gnb/en/corporate/promo/covid-19/news/news_release.2021.03.0241.html"
"363","Newfoundland and Labrador","CAN_NL","29-Mar-21","H2_Testing policy",2,NA,2,NA,"As of 29 march 2021, the government of Newfoundland and Labrador (NL) continues to advise:“Individuals who develop symptoms of COVID-19 are advised to complete the COVID-19 self-assessment to determine if they should call 811...If it is determined by 811 that you require testing, this will be arranged through Public Health. Testing may be completed in the home, at a drive-thru testing site, or another location as determined by Public Health.” See NL government website, archived:  https://web.archive.org/web/20210329131048/https://www.gov.nl.ca/covid-19/faqs/"
"364","Nova Scotia","CAN_NS","29-Mar-21","H2_Testing policy",3,NA,3,NA,"As of March 29, 2021, testing in the province--including asymptomatic testing--continues to be widely available. Source: https://archive.fo/GDE33"
"365","New Brunswick","CAN_NB","26-Feb-21","H3_Contact tracing",2,NA,2,NA,"On 26 February 2021, New Brunswick (NB) Public Health reaffirmed the contact tracing process: “Public Health follows a standard process when addressing instances where the public may have been exposed to a case of COVID-19. In cases where record-keeping is able to identify anyone who may have been exposed, officials contact these individuals directly and do not issue a separate announcement. In cases where officials cannot be certain of exactly who may have been exposed to the virus in a given location, Public Health issues an announcement to alert those who could have been affected and provides instructions.” This procedure confirms that coding at 2 = comprehensive remains warranted. See Province of NB website, archived:  https://web.archive.org/web/20210228174655/https://www2.gnb.ca/content/gnb/en/news/news_release.2021.02.0148.html"
"366","Prince Edward Island","CAN_PE","26-Feb-21","H3_Contact tracing",2,NA,2,NA,"Due to a cluster of cases in young people in Summerside, the Province is urging anyone between the ages of 14 and 29 in Summerside to get tested. (have not coded as a 3 because this is a temporary age target testing scheme).     https://archive.vn/wip/XKlOt  https://archive.vn/wip/tkVdD"
"367","British Columbia","CAN_BC","28-Feb-21","H3_Contact tracing",2,NA,2,NA,"British Columbia has a comprehensive contact tracing system that tracks all positive cases. However, only symptomatic people are tested as per the Province's testing policy. Still, contacts with no symptoms are asked to self-isolate and monitor for symptoms for 14 days after their last contact with the case.    https://web.archive.org/web/20210307213416/http://www.bccdc.ca/health-info/diseases-conditions/covid-19/self-isolation/contact-tracing    https://web.archive.org/save/https://bc.ctvnews.ca/covid-19-rapid-tests-here-s-when-b-c-health-authorities-will-seek-quicker-results-1.5336135"
"368","Alberta","CAN_AB","01-Mar-21","H3_Contact tracing",2,NA,2,NA,"As of March 1, contact tracing remains comprehensive in Alberta. AHS is also still using the close contacts tool for people to complete when they test positive for COVID-19.    https://web.archive.org/web/20210308062444/https://www.albertahealthservices.ca/topics/Page17199.aspx"
"369","Newfoundland and Labrador","CAN_NL","01-Mar-21","H3_Contact tracing",2,NA,2,NA,"On 1 march 2021, the government of Newfoundland and Labrador (NL) announced 2 new confirmed cases. “Contact tracing by Public Health officials is underway. Anyone considered a close contact will be advised to quarantine.” See government of NL website, archived:  https://web.archive.org/web/20210301190523/https://www.gov.nl.ca/releases/2021/health/0301n02/"
"370","Manitoba","CAN_MB","02-Mar-21","H3_Contact tracing",2,NA,2,NA,"No policy change identified: https://web.archive.org/web/20210308202625/https://manitoba.ca/covid19/media/index.html"
"371","Saskatchewan","CAN_SK","02-Mar-21","H3_Contact tracing",2,NA,2,NA,"No indication that there have been a dropoff in contact tracing.   https://web.archive.org/web/20210303215312/https://www.cbc.ca/news/canada/saskatchewan/sask-household-transmission-restrictions-1.5934721"
"372","Manitoba","CAN_MB","05-Mar-21","H3_Contact tracing",2,NA,2,NA,"No policy change identified: https://web.archive.org/web/20210308202625/https://manitoba.ca/covid19/media/index.html"
"373","New Brunswick","CAN_NB","08-Mar-21","H3_Contact tracing",2,NA,2,NA,"On 8 march 2021, New Brunswick (NB) Public Health continues to advise: “A person has COVID-19 symptoms, takes the online self-referral to book a test and then tests positive. Public Health staff interview the positive person to identify public areas they have visited and people they’ve spent time with. These people are contacts. Public Health maintains the privacy of the positive person. Anyone who tests positive can choose to tell others about their diagnosis, but Public Health will not. Public Health gets in touch with the close contacts and asks them about symptoms of COVID-19. Close contacts with no symptoms are asked to self-isolate and monitor for symptoms for 14 days after their last contact with the case. Contacts with symptoms are sent for testing. Non-close contacts will be asked to self-monitor. If a contact tests positive, Public Health will reach out to all their close contacts and restart the process.” See Province of NB website, archived:  https://web.archive.org/web/20210308200809/https://www2.gnb.ca/content/gnb/en/corporate/promo/covid-19/about-covid-19.html"
"374","Newfoundland and Labrador","CAN_NL","08-Mar-21","H3_Contact tracing",2,NA,2,NA,"On 8 march 2021, the government of Newfoundland and Labrador (NL) announced 3 new confirmed cases. “Contact tracing by Public Health officials is underway. Anyone considered a close contact will be advised to quarantine.” See government of NL website, archived:  https://web.archive.org/web/20210308184118/https://www.gov.nl.ca/releases/2021/health/0308n03/"
"375","Manitoba","CAN_MB","09-Mar-21","H3_Contact tracing",2,NA,2,NA,"No policy change: https://web.archive.org/web/20210315224139/https://manitoba.ca/covid19/media/index.html"
"376","Nunavut","CAN_NU","10-Mar-21","H3_Contact tracing",2,NA,2,NA,"Whenever there is a positive Covid-19 test in Nunavut, the Government of Nunavut always state that contact tracing is being undertaken.    Sources:   https://web.archive.org/web/20210320155226/https://www.gov.nu.ca/health/news/four-new-cases-covid-19-arviat-1    https://web.archive.org/web/20210320155520/https://www.gov.nu.ca/health/news/10-new-case-covid-19-arviat"
"377","Saskatchewan","CAN_SK","11-Mar-21","H3_Contact tracing",2,NA,2,NA,"Tracing continues.    https://web.archive.org/web/20210322163110/https://www.saskatchewan.ca/government/news-and-media/2021/march/11/covid19-update-for-march-11-95879-vaccines-administered-165-new-cases-153-recoveries-no-new-deaths"
"378","New Brunswick","CAN_NB","15-Mar-21","H3_Contact tracing",2,NA,2,NA,"On 15 march 2021, New Brunswick (NB) Public Health continues to advise: “A person has COVID-19 symptoms, takes the online self-referral to book a test and then tests positive. Public Health staff interview the positive person to identify public areas they have visited and people they’ve spent time with. These people are contacts. Public Health maintains the privacy of the positive person. Anyone who tests positive can choose to tell others about their diagnosis, but Public Health will not. Public Health gets in touch with the close contacts and asks them about symptoms of COVID-19. Close contacts with no symptoms are asked to self-isolate and monitor for symptoms for 14 days after their last contact with the case. Contacts with symptoms are sent for testing. Non-close contacts will be asked to self-monitor. If a contact tests positive, Public Health will reach out to all their close contacts and restart the process.” See Province of NB website, archived:  https://web.archive.org/web/20210315145533/https://www2.gnb.ca/content/gnb/en/corporate/promo/covid-19/about-covid-19/testing-tracing.html"
"379","Newfoundland and Labrador","CAN_NL","15-Mar-21","H3_Contact tracing",2,NA,2,NA,"On 15 march 2021, the government of Newfoundland and Labrador (NL) continues with comprehensive contact tracing after a positive covid test: “ family members, friends, work colleagues, health care providers, and anyone else who may have knowledge of the case’s contacts may also be interviewed.  When contacts are identified, Public Health Nurses contact them to offer counseling, screening, and if required, testing or treatment. Contacts may be isolated, if deemed necessary, for disease control...” See government of NL website, archived: https://web.archive.org/web/20210315171214/https://www.gov.nl.ca/covid-19/contact-tracing-for-covid-19/"
"380","Manitoba","CAN_MB","16-Mar-21","H3_Contact tracing",2,NA,2,NA,"No policy change: https://web.archive.org/web/20210321191927/https://manitoba.ca/covid19/media/index.html"
"381","Northwest Territories","CAN_NT","16-Mar-21","H3_Contact tracing",2,NA,2,NA,"Comprehensive contact tracing continues to be in place.    https://web.archive.org/web/20210322223153/https://www.gov.nt.ca/covid-19/en/services/about-covid-19/being-contact-covid-19"
"382","Prince Edward Island","CAN_PE","17-Mar-21","H3_Contact tracing",2,NA,2,NA,"Contact tracing of positive cases continues to be comprehensive- likely due to the size of the population.     https://archive.vn/yY5MG"
"383","Alberta","CAN_AB","22-Mar-21","H3_Contact tracing",2,NA,2,NA,"On March 22, tracing remained comprehensive. AHS also still has their voluntary tool for positive cases to enter their close contacts' contact information.    https://web.archive.org/web/20210322225946/https://www.albertahealthservices.ca/topics/Page17199.aspx"
"384","Manitoba","CAN_MB","22-Mar-21","H3_Contact tracing",2,NA,2,NA,"No policy change: https://web.archive.org/web/20210328171101/https://manitoba.ca/covid19/media/index.html"
"385","New Brunswick","CAN_NB","22-Mar-21","H3_Contact tracing",2,NA,2,NA,"On 22 march 2021, New Brunswick (NB) Public Health continues to advise: “A person has COVID-19 symptoms, takes the online self-referral to book a test and then tests positive. Public Health staff interview the positive person to identify public areas they have visited and people they’ve spent time with. These people are contacts. Public Health maintains the privacy of the positive person. Anyone who tests positive can choose to tell others about their diagnosis, but Public Health will not. Public Health gets in touch with the close contacts and asks them about symptoms of COVID-19. Close contacts with no symptoms are asked to self-isolate and monitor for symptoms for 14 days after their last contact with the case. Contacts with symptoms are sent for testing. Non-close contacts will be asked to self-monitor. If a contact tests positive, Public Health will reach out to all their close contacts and restart the process.” See Province of NB website, archived:  https://web.archive.org/web/20210322180353/https://www2.gnb.ca/content/gnb/en/corporate/promo/covid-19/about-covid-19/testing-tracing.html"
"386","Newfoundland and Labrador","CAN_NL","22-Mar-21","H3_Contact tracing",2,NA,2,NA,"On 22 march 2021, the government of Newfoundland and Labrador (NL) continues with comprehensive contact tracing after a positive covid test: “ family members, friends, work colleagues, health care providers, and anyone else who may have knowledge of the case’s contacts may also be interviewed. When contacts are identified, Public Health Nurses contact them to offer counseling, screening, and if required, testing or treatment. Contacts may be isolated, if deemed necessary, for disease control...” See government of NL website, archived:   https://web.archive.org/web/20210322194119/https://www.gov.nl.ca/covid-19/contact-tracing-for-covid-19/"
"387","Saskatchewan","CAN_SK","23-Mar-21","H3_Contact tracing",2,NA,2,NA,"Contact tracing continues.    https://web.archive.org/web/20210327204821/https://www.cbc.ca/news/canada/saskatchewan/covid-sask-march-27-2021-1.5967084"
"388","Yukon","CAN_YT","23-Mar-21","H3_Contact tracing",2,NA,2,NA,"The Government of Yukon contact tracing information page details the extensive contact tracing that is still undertaken for every confirmed Covid-19 case in the Yukon.    Source: https://web.archive.org/web/20210323204914/https://yukon.ca/en/contact-tracing-covid-19  "
"389","Alberta","CAN_AB","26-Mar-21","H3_Contact tracing",2,NA,2,NA,"While AHS contact tracing is still being reported as comprehensive, a news report from March 26 indicated that in some cases, AHS is advising businesses to conduct their own contact tracing, as evidenced by an outbreak situation at a Calgary restaurant.    https://web.archive.org/web/20210329220616/https://calgaryherald.com/news/local-news/joey-eau-claire-patrons-question-lack-of-transparency-contact-tracing-in-covid-19-outbreak  "
"390","New Brunswick","CAN_NB","29-Mar-21","H3_Contact tracing",2,NA,2,NA,"On 29 march 2021, New Brunswick (NB) Public Health continues to advise: “A person has COVID-19 symptoms, takes the online self-referral to book a test and then tests positive. Public Health staff interview the positive person to identify public areas they have visited and people they’ve spent time with. These people are contacts. Public Health maintains the privacy of the positive person. Anyone who tests positive can choose to tell others about their diagnosis, but Public Health will not. Public Health gets in touch with the close contacts and asks them about symptoms of COVID-19. Close contacts with no symptoms are asked to self-isolate and monitor for symptoms for 14 days after their last contact with the case. Contacts with symptoms are sent for testing. Non-close contacts will be asked to self-monitor. If a contact tests positive, Public Health will reach out to all their close contacts and restart the process.” See Province of NB website, archived:  https://web.archive.org/web/20210329175641/https://www2.gnb.ca/content/gnb/en/corporate/promo/covid-19/about-covid-19/testing-tracing.html"
"391","Newfoundland and Labrador","CAN_NL","29-Mar-21","H3_Contact tracing",2,NA,2,NA,"On 29 march 2021, the government of Newfoundland and Labrador (NL) continues with comprehensive contact tracing after a positive covid test: “ family members, friends, work colleagues, health care providers, and anyone else who may have knowledge of the case’s contacts may also be interviewed.  When contacts are identified, Public Health Nurses contact them to offer counseling, screening, and if required, testing or treatment. Contacts may be isolated, if deemed necessary, for disease control...” See government of NL website, archived:   https://web.archive.org/web/20210329131304/https://www.gov.nl.ca/covid-19/contact-tracing-for-covid-19/"
"392","British Columbia","CAN_BC","28-Feb-21","H4_Emergency investment in healthcare",0,NA,0,NA,"No new funding announced by the province of British Columbia.    https://web.archive.org/web/20210304015011/https://strongerbc.gov.bc.ca/    https://web.archive.org/web/20210307214155/https://covid.smallbusinessbc.ca/hc/en-us/articles/360055484933-StrongerBC-Recovery-Plan"
"393","Manitoba","CAN_MB","05-Mar-21","H4_Emergency investment in healthcare",0,NA,0,NA,"No policy change identified: https://web.archive.org/web/20210308202625/https://manitoba.ca/covid19/media/index.html"
