"","RegionName","RegionCode","Date","indicator_type","past_value","past_flag","present_value","present_flag","Notes"
"1","British Columbia","CAN_BC","28-Feb-21","C1_School closing",1,"G",1,"G","Students returned to in-class learning in September, 2020. As of Feb 27th, 2021 no closures have been made. On February 3rd, 2021 masks were made a requirement for middle and secondary students. The conditions in the classroom continue to be significantly different than normal with mask wearing and hygiene measures in place.    With COVID-19 variants in several B.C. schools, calls have been growing to see if the province will allow school districts to go above and beyond provincial guidelines for physical distancing and safety. People want more rapid testing once a variant is detected at a school, as well as improved ventilation, and a mask mandate for young kids. However, the suggestion of a school district wanting to go beyond what the province is recommending didn’t get support from the education minister.    https://web.archive.org/web/20210307193813/https://www2.gov.bc.ca/gov/content/education-training/k-12/covid-19-safe-schools"
"2","Prince Edward Island","CAN_PE","28-Feb-21","C1_School closing",1,"G",1,"G","Circuit Breaker restrictions in place - no change to schools. continue to operate with increased hygiene measures, masks and social distancing. Some university/college online.     https://archive.vn/wip/Gy1Pc"
"3","New Brunswick","CAN_NB","01-Mar-21","C1_School closing",1,"G",1,"G","As of 1 march 2021, New Brunswick (NB) Public Health advises: “All zones remain in the Orange level under the province’s mandatory order...schools are open under strict guidance. Virtual teaching is to be used for at-risk populations...Post-secondary educational institutions may operate.” Consistent with 1G code. See Province of New Brunswick website, archived:   https://web.archive.org/web/20210301184946/https://www2.gnb.ca/content/gnb/en/corporate/promo/covid-19/news/news_release.2021.03.0153.html  https://web.archive.org/web/20210226122321/https://www2.gnb.ca/content/gnb/en/corporate/promo/covid-19/recovery.html"
"4","Newfoundland and Labrador","CAN_NL","01-Mar-21","C1_School closing",3,"G",3,"G","As of 1 march 2021, in the province of Newfoundland and Labrador (NL) in-school classes remain suspended in favour of online learning. On 3 March, schools will reopen in all regions except the Avalon peninsula (St. John’s capital and most populous city-region). See NL English School District website, archived:  https://web.archive.org/web/20210228234626/https://www.nlesd.ca/about/news/index.jsp?NewsCategory=3"
"5","Nunavut","CAN_NU","01-Mar-21","C1_School closing",3,"T",3,"T","Measures remained unchanged in Arviat where schools are closed (3T). However, restrictions have eased elsewhere from 1st March in the Qikiqtani and Kitikmeot regions, and Kivalliq communities excluding Arviat. Schools can open at Stage 1 to full-time, in-classroom learning.     Source: https://archive.vn/KpWhJ  "
"6","Prince Edward Island","CAN_PE","01-Mar-21","C1_School closing",1,"G",3,"G","All schools and post-secondary institutions are required to be closed during a 72 hr lockdown.     https://archive.vn/acK0B"
"7","Manitoba","CAN_MB","02-Mar-21","C1_School closing",2,"T",2,"T","No policy change identified: https://web.archive.org/web/20210308202625/https://manitoba.ca/covid19/media/index.html"
"8","Saskatchewan","CAN_SK","02-Mar-21","C1_School closing",1,"G",2,"G","No change in protocols, so schools are still open.     https://web.archive.org/web/20210308162515/https://globalnews.ca/news/7404901/coronavirus-saskatchewan-school-exposures-outbreaks-covid-19/"
"9","Newfoundland and Labrador","CAN_NL","03-Mar-21","C1_School closing",3,"G",3,"T","On 3 March 2021, elementary and secondary schools opened for in-school classes in some areas of Newfoundland and Labrador (NL). However, the Avalon Peninsula (St. John’s capital region) remains at alert level 5: “up to and including Friday, March 12 ...Online Instruction”. See NL English School District website, archived:  https://web.archive.org/web/20210301194915/https://www.nlesd.ca/families/covid19-2021.jsp"
"10","Prince Edward Island","CAN_PE","04-Mar-21","C1_School closing",3,"G",1,"G","following the 72 hr 'lockdown', back to circuit breaker conditions- does not affect schools.     https://archive.ph/Gy1Pc"
"11","Manitoba","CAN_MB","05-Mar-21","C1_School closing",2,"T",2,"T","No policy change identified: https://web.archive.org/web/20210308202625/https://manitoba.ca/covid19/media/index.html"
"12","Alberta","CAN_AB","08-Mar-21","C1_School closing",1,"G",1,"G","Bowness High School in Calgary is operating remotely from March 8 to March 18 due to an outbreak of COVID-19 cases. This change will affect 1200 students.    https://web.archive.org/web/20210315063536/https://www.660citynews.com/2021/03/08/students-at-bowness-high-school-go-online-due-to-outbreak/ "
"13","British Columbia","CAN_BC","08-Mar-21","C1_School closing",1,"G",1,"G","On February 3rd, 2021 masks were made a requirement for middle and secondary students. This is being enhanced in April, as Dr. Henry has said: """"We are going to be updating our K-12 public health guidance to support masks for all students down to Grade 4 in schools across the province"""". The conditions in the classroom continue to be significantly different than normal with mask wearing and hygiene measures in place.    https://web.archive.org/web/20210401175223/https://www.cbc.ca/news/canada/british-columbia/bc-school-mask-covid-19-guidelines-1.5969165    https://web.archive.org/web/20210401175154/https://www2.gov.bc.ca/gov/content/education-training/k-12/covid-19-safe-schools"
"14","New Brunswick","CAN_NB","08-Mar-21","C1_School closing",1,"G",1,"G","8 march 2021 is the first full day in over 2 months for New Brunswick (NB) when “(a)ll zones are currently in the Yellow level.” Public Health advises: “Previously existing mask policies continue to apply in … public schools...Post-secondary educational institutions may operate.” Consistent with 1G code. See Province of New Brunswick website, archived:   https://web.archive.org/web/20210308191547/https://www2.gnb.ca/content/gnb/en/corporate/promo/covid-19/recovery.html  https://web.archive.org/web/20210301184946/https://www2.gnb.ca/content/gnb/en/corporate/promo/covid-19/news/news_release.2021.03.0153.html"
"15","Manitoba","CAN_MB","09-Mar-21","C1_School closing",2,"T",2,"T","No policy change: https://web.archive.org/web/20210315224139/https://manitoba.ca/covid19/media/index.html"
"16","Nunavut","CAN_NU","10-Mar-21","C1_School closing",3,"T",2,"T","From 10th March, restrictions eased in Arviat and schools were allowed to open at Stage 3 of the Opening Plan for Nunavut Schools. Stage 3 means that elementary school students can attend school three days per week. Middle and high-school students can attend school two days per week with staggered schedules to reduce physical interaction. Since students are not returning full-time to in-school lessons, this has been coded as a 2T. Also because Nunavut Arctic College are required to provide remote-learning at this time.     Schools in all other regions of Nunavut are at Stage 1 of the opening plan, where all lessons take place at school and there is no home-learning.    Sources:   https://web.archive.org/web/20210320134822/https://www.gov.nu.ca/health/news/easing-covid-19-restrictions-arviat    https://drive.google.com/file/d/1Rj4ZuarILsHD_isiX6NIpSab7wB3Unpc/view?usp=sharing  https://web.archive.org/web/20210320141649/https://gov.nu.ca/education/information/2020-21-opening-plan-nunavut-schools    https://web.archive.org/web/20210320142744/https://gov.nu.ca/sites/default/files/files/2020-21_opening_plan_for_nunavut_schools_-_eng.pdf"
"17","Quebec","CAN_QC","10-Mar-21","C1_School closing",1,"G",1,"G","No policy updates.    https://web.archive.org/web/20210309173315/https://www.quebec.ca/sante/problemes-de-sante/a-z/coronavirus-2019/systeme-alertes-regionales-et-intervention-graduelle/palier-4-alerte-maximale-zone-rouge/  https://web.archive.org/web/20210316060242/https://www.quebec.ca/sante/problemes-de-sante/a-z/coronavirus-2019/systeme-alertes-regionales-et-intervention-graduelle/palier-3-alerte-zone-orange/"
"18","Alberta","CAN_AB","11-Mar-21","C1_School closing",1,"G",1,"G","On March 11 it was announced that rapid COVID-19 antigen testing kits are going to be piloted at 2 Calgary schools in outbreak settings starting next week. The schools have not yet been announced, but one will be in the Calgary Board of Education, and the other school will be in Calgary Catholic School Division.     https://web.archive.org/web/20210315063023/https://calgary.ctvnews.ca/covid-19-rapid-testing-pilot-to-take-place-at-2-calgary-schools-1.5343775    https://web.archive.org/web/20210315065822/https://www.alberta.ca/release.cfm?xID=777036268E3E1-D992-31F1-E8CDCE25F0E73006    https://web.archive.org/web/20210315063448/https://www.alberta.ca/schools/covid-19-school-status-map.htm  "
"19","Alberta","CAN_AB","12-Mar-21","C1_School closing",1,"G",1,"G","On march 12, the province announced that it would fund a literary program to measure if the COVID-19 pandemic affected literacy levels in kindergarten to grade 3.    https://web.archive.org/web/20210315070106/https://www.alberta.ca/release.cfm?xID=7770987312573-A3D6-9C8C-1537318FF44D4BCF "
"20","Prince Edward Island","CAN_PE","13-Mar-21","C1_School closing",1,"G",1,"G","Schools remain open"
"21","New Brunswick","CAN_NB","15-Mar-21","C1_School closing",1,"G",1,"G","On 15 march 2021, in the province of New Brunswick (NB) “(a)ll zones are currently in the Yellow level.” Public Health advises: “Schools: All educational and camp facilities are open under appropriate public health guidance, virtual to be used for at-risk groups. Post-secondary educational institutions may operate.” Some post-secondary institutions are sticking with online learning until the new academic year starts in September. Consistent with 1G code. See Province of New Brunswick website, archived:   https://web.archive.org/web/20210315112303/https://www2.gnb.ca/content/gnb/en/corporate/promo/covid-19/alert-levels/yellow%20level.html  https://web.archive.org/web/20210315111406/https://theaquinian.net/stu-finalizes-approach-to-plan-for-2021-22-school-year/  https://web.archive.org/web/20210315112518/https://www2.gnb.ca/content/gnb/en/corporate/promo/covid-19/news/news_release.2021.03.0197.html"
"22","Newfoundland and Labrador","CAN_NL","15-Mar-21","C1_School closing",3,"T",3,"T","On 15 march 2021, elementary and some secondary schools are open in some areas of Newfoundland and Labrador (NL). However, “In Avalon Region [including St. John’s capital and largest city]: All K-9 students will begin full-time in-class instruction under Scenario 1 (near normal) on Thursday, March 18, with recently-updated health and safety protocols in place. These students will remain within their class cohorts throughout the school day. All high schools will continue to operate under Scenario 3 (full-time online instruction), with the exception of a small number of schools which can operate under Scenario 1, as students are able to cohort within a small school population.” See NL English School District website, archived:  https://web.archive.org/web/20210314174721/https://www.nlesd.ca/includes/files/news/doc/1615485546330.pdf"
"23","Nova Scotia","CAN_NS","15-Mar-21","C1_School closing",1,"G",1,"G","As of March 15, 2021, there have been no school closures announced. Source: https://archive.fo/B9r4n"
"24","Manitoba","CAN_MB","16-Mar-21","C1_School closing",2,"T",2,"T","No policy change: https://web.archive.org/web/20210321191927/https://manitoba.ca/covid19/media/index.html"
"25","Newfoundland and Labrador","CAN_NL","18-Mar-21","C1_School closing",3,"T",2,"T","On 18 march 2021, elementary schools are open throughout Newfoundland and Labrador (NL). While some secondary schools are open, many high schools are closed with students learning online. “In Avalon Region [including St. John’s capital and largest city]: All K-9 students will begin full-time in-class instruction under Scenario 1 (near normal) on Thursday, March 18, with recently-updated health and safety protocols in place. These students will remain within their class cohorts throughout the school day.” “In Labrador, Central and Western Regions, all K-9 students will continue in-class instruction within their schools.” “In Avalon Region [including St. John’s capital and largest city]: All high schools will continue to operate under Scenario 3 (full-time online instruction), with the exception of a small number of schools which can operate under Scenario 1, as students are able to cohort within a small school population.” In Labrador, Central and Western Regions, schools with high school grades which can operate in Scenario 1 will continue to do so.” See NL English School District websites, archived:  https://web.archive.org/web/20210314174721/https://www.nlesd.ca/includes/files/news/doc/1615485546330.pdf  https://web.archive.org/web/20210301194915/https://www.nlesd.ca/families/covid19-2021.jsp"
"26","Nova Scotia","CAN_NS","20-Mar-21","C1_School closing",1,"G",1,"G","Nova Scotia's public schools were on March break this past week. Source: https://archive.fo/N7eNt"
"27","Saskatchewan","CAN_SK","20-Mar-21","C1_School closing",2,"G",2,"G","Schools in Regina are preparing to move online due to rising covid levels incoming March 24th for high school and March 29th for all students, until April 12th.     """"REGINA -- Regina Public and Catholic Schools announced all Pre-Kindergarten, elementary and high school classrooms will move to online learning until April 12.    Regina Public Schools will move all high school students to remote learning on March 24, Pre-K to Grade 8 will begin online learning on March 29.""""      https://web.archive.org/web/20210320023546/https://regina.ctvnews.ca/regina-schools-move-to-remote-learning-1.5354591"
"28","Alberta","CAN_AB","22-Mar-21","C1_School closing",1,"G",1,"G","As of March 22, K-12 schools remained generally open for in-person learning throughout Alberta, with only a few that had switched to online learning due to COVID-19 outbreaks. On the other hand, universities remain mostly online, with only classes necessary to be held in person (like labs) on campus. A recent news article suggested that universities may switch to in-person learning in the fall, after encouragement from the Minister of Advanced Education.    https://web.archive.org/web/20210322223048/https://www.supportourstudents.ca/    https://web.archive.org/web/20210322223136/https://www.cbc.ca/news/canada/edmonton/province-expects-alberta-post-secondary-classes-to-resume-this-fall-1.5955717    https://web.archive.org/web/20210322230626/https://www.cbc.ca/news/canada/calgary/alberta-covid-coronavirus-march-22-1.5958781"
"29","Manitoba","CAN_MB","22-Mar-21","C1_School closing",2,"T",2,"T","No policy change: https://web.archive.org/web/20210328171101/https://manitoba.ca/covid19/media/index.html"
"30","New Brunswick","CAN_NB","22-Mar-21","C1_School closing",1,"G",1,"G","On 22 march 2021, in the province of New Brunswick (NB): “All zones are in the Yellow level under the province’s mandatory order.” Public Health advises: “Schools: All educational and camp facilities are open under appropriate public health guidance, virtual to be used for at-risk groups. Post-secondary educational institutions may operate.” High school classes for students in grades 9 to 12 alternate between in-person one day and online the next. Consistent with 1G code. See Province of New Brunswick and CBC news websites, archived:   https://web.archive.org/web/20210322184556/https://www2.gnb.ca/content/gnb/en/corporate/promo/covid-19/news/news_release.2021.03.0224.html  https://web.archive.org/web/20210322153132/https://www2.gnb.ca/content/gnb/en/corporate/promo/covid-19/alert-levels/yellow%20level.html  https://web.archive.org/web/20210322153827/https://www.cbc.ca/news/canada/new-brunswick/high-school-new-brunswick-1.5956658"
"31","Newfoundland and Labrador","CAN_NL","22-Mar-21","C1_School closing",2,"T",2,"T","See note 18 March."
"32","Yukon","CAN_YT","23-Mar-21","C1_School closing",1,"G",1,"G","No policy change. Schools remain open, with sanitary measures in place. Whitehorse Grade 10-12 students have half-day in-class lessons, and half-day learning away from school. Other students, from Kindergarten to Grade 12 have full-day in-class lessons, five days a week.    Sources:   https://web.archive.org/web/20210323205827/https://yukon.ca/en/health-safety-schools-covid-19    https://web.archive.org/web/20210323205914/https://yukon.ca/en/school-operations-covid-19  "
"33","Saskatchewan","CAN_SK","24-Mar-21","C1_School closing",2,"G",2,"T","High school students in Regina move online.   """"Regina Public Schools will move all high school students to remote learning on March 24, Pre-K to Grade 8 will begin online learning on March 29.""""    https://web.archive.org/web/20210320023546/https://regina.ctvnews.ca/regina-schools-move-to-remote-learning-1.5354591"
"34","Nova Scotia","CAN_NS","25-Mar-21","C1_School closing",1,"G",2,"T","On March 25, 2021 a case of COVID-19 was connected to Millwood High School. The school was thus closed for cleaning and contact tracing, and will reopen on March 31, 2021. Source: https://archive.fo/WFBH6"
"35","New Brunswick","CAN_NB","26-Mar-21","C1_School closing",1,"G",2,"T","On 26 march 2021, most of the province of New Brunswick (NB) is at the Yellow level and the city of Edmundston and upper Madawaska region are at the Red level. At the Red level, “schools remain open with enhanced health and safety measures … Post-secondary: Closed to students except to operate in-person for all practical programs and maintain essential laboratory activities.” Throughout NB, high school classes for students in grades 9 to 12 alternate between in-person one day and online the next. Consistent with 1G code. See Province of New Brunswick and CBC news websites, archived:   https://web.archive.org/web/20210329160503/https://www.cbc.ca/news/canada/new-brunswick/high-school-new-brunswick-1.5956658  https://web.archive.org/web/20210329161909/https://www2.gnb.ca/content/gnb/en/corporate/promo/covid-19/alert-levels/red%20level.html  https://web.archive.org/web/20210329015423/https://www2.gnb.ca/content/gnb/en/corporate/promo/covid-19/news/news_release.2021.03.0241.html"
"36","Newfoundland and Labrador","CAN_NL","29-Mar-21","C1_School closing",2,"T",2,"T","As of 29 march 2021, in Newfoundland and Labrador (NL), the 11 March directive of the NL English School District (NLESD) remains in effect. “full-time in-class instruction (Scenario 1) for K[indergarten]-[grade] 9 schools … In Avalon Region [St. John’s provincial capital and surrounding area]: All high schools will continue to operate under Scenario 3 (full-time online instruction), with the exception of a small number of schools which can operate under Scenario 1, as students are able to cohort within a small school population... In Labrador, Western and Central Regions: Schools with high school grades which can operate in Scenario 1 will continue to do so.” See NLESD website, archived:  https://web.archive.org/web/20210329143330/https://www.nlesd.ca/includes/files/news/doc/1615485546330.pdf"
"37","Saskatchewan","CAN_SK","29-Mar-21","C1_School closing",2,"T",3,"T","As per previous plans, and in line with the the increase in Regina restrictions (although oddly not mentioned in the regina specific public health order from March 23rd) all regina schools are online until at least April 5th.   https://web.archive.org/web/20210330015740/https://www.cjme.com/2021/03/29/covid-cases-identified-at-17-regina-schools-over-weekend/  https://web.archive.org/web/20210320023546/https://regina.ctvnews.ca/regina-schools-move-to-remote-learning-1.5354591  "
"38","Newfoundland and Labrador","CAN_NL","27-Feb-21","C2_Workplace closing",3,"G",3,"T","Effective 27 February, the province of Newfoundland and Labrador (NL) continues to set Alert Level 5 for the the Avalon peninsula (St. John’s capital and most populous city-region). “Gym and fitness facilities are closed, including yoga studios, tennis and squash facilities, and arenas. Dance studios and performance spaces are closed. Cinemas are closed. Bingo halls are closed...Retail stores that do not provide services essential to life, health or personal safety of individuals and animals are closed to in-person service... Restaurants are closed for in-person dining... Businesses that hold a license under the Liquor Control Act whose primary purpose is the consumption of beer, wine, or spirits are closed. Personal service establishments, including spas, esthetic services, hair salons, body piercing, tattooing and tanning salons, are closed.” However, the rest of the province moved to Alert Level 4. “Retail stores, including those in shopping malls, can open at 50 per cent capacity. Personal service establishments can open in accordance with guidelines...Private health care clinics can reopen in accordance with guidelines.” See Government of Newfoundland websites, archived:  https://web.archive.org/web/20210227165133/https://www.gov.nl.ca/releases/2021/health/0226n04/  https://web.archive.org/web/20210227165820/https://www.gov.nl.ca/covid-19/files/Summary-Table-of-COVID-19-Alert-Level-System-graphic.pdf"
"39","Nova Scotia","CAN_NS","27-Feb-21","C2_Workplace closing",0,NA,0,NA,"In response to rising CoVID levels, the government announced new public health restrictions to take effect on February 27, 2021. Under the new guidelines, restaurants and licensed establishments in Halifax, Hants and Lunenburg counties remain open but must stop service by 9 p.m. and close by 10 p.m. Libraries, museums, casinos and the Nova Scotia Art Gallery remain open following their respective plans. Since there is no specific policy closing businesses or asking workers to stay home, C2 continues to be coded at 0.     1. Source: https://archive.fo/Hsnfr  2. Source: https://archive.fo/PNFkZ  3. Source: https://archive.fo/V3Do9"
"40","British Columbia","CAN_BC","28-Feb-21","C2_Workplace closing",1,"G",1,"G","Province-wide restrictions have been extended indefinitely. By order and direction of the PHO, individuals and businesses in B.C. must significantly reduce social interactions and travel. Employers must review and redouble their efforts on their COVID-19 Safety Plan, remind employees to monitor themselves daily and to always stay home if they have symptoms. Employers must make every effort to provide work from home options.     https://web.archive.org/web/20210307190653/https://www2.gov.bc.ca/gov/content/safety/emergency-preparedness-response-recovery/covid-19-provincial-support/restrictions"
"41","Prince Edward Island","CAN_PE","28-Feb-21","C2_Workplace closing",1,"G",2,"G","Circuit breaker restrictions in place:   Supervised gyms and fitness facilities may operate at up to 50% of standard operating capacity with additional cleaning;  Museums and libraries may operate at up to 50% capacity;  Individual and team practices are permitted in accordance with gathering limits; games, tournaments and competitions are not permitted;  Retail stores, markets and craft fairs may operate at 50% of standard operating capacity, provided entrances and exits are monitored;  In room dining is not permitted; take-out and delivery of food is permitted;  Personal services may operate on an appointment basis, provided a non-medical mask is worn at all times by staff and patrons;  Child care centres can continue to operate at full capacity;     https://archive.vn/wip/Gy1Pc"
"42","Alberta","CAN_AB","01-Mar-21","C2_Workplace closing",2,"G",2,"G","It was announced on March 1 that effective immediately, libraries are allowed to re-open to 15% of capacity as part of Step 2 in the """"path forward"""". In addition to libraries re-opening, gyms are now allowed to re-open for """"unsupervised low intensity individual and group exercises"""", although by appointment only. """"Low-intensity exercises include weightlifting, low-intensity dance classes, yoga, barre and indoor climbing, as well as the low-intensity use of treadmills, ellipticals and related equipment.High-intensity activities, including running, spin and high-intensity interval training, continue to be allowed only on a one-on-one with a trainer basis, or training with a household and one trainer.""""    https://web.archive.org/web/20210308055445/https://www.alberta.ca/release.cfm?xID=7762761C1F414-B90D-C3A1-08618E415DCB5B5B"
