"","RegionName","RegionCode","Date","indicator_type","past_value","past_flag","present_value","present_flag","Notes"
"616","Alaska","US_AK","14-Oct","C5_Close.public.transport",0,NA,0,NA,"No changes detected in this indicator after searching executive orders, news articles and press releases.  "
"617","Vermont","US_VT","14-Oct","C5_Close.public.transport",0,NA,0,NA,"No changes detected in this indicator after searching news articles, press releases and executive orders."
"618","New Hampshire","US_NH","15-Oct","C5_Close.public.transport",0,NA,0,NA,"Measures include social distancing and masks.     Ex: Nashua Public Transit ""Phase 3"" - reduced capacity, safety barriers, masks required, physical distancing required.  https://web.archive.org/web/20200924185443/https://www.nashuanh.gov/1341/NTSs-Response-to-COVID-19"
"619","Wisconsin","US_WI","15-Oct","C5_Close.public.transport",1,"T",1,"T","As of October 15th, the city of Madison still limited the number of passengers to 20 per bus.   https://web.archive.org/web/20201015051419/https://www.cityofmadison.com/metro/contact/covid-19-updates "
"620","Louisiana","US_LA","16-Oct","C5_Close.public.transport",1,"T",1,"T","As an extension of previous measures, the New Orleans Regional Transit Authority website was checked on August 12 and says that all bus and streetcar routes are still operating on the Saturday schedule, Monday through Saturday. On Sunday, bus and streetcar routes will operate on the Sunday schedule. Fares are being collected.     See NORTA link: https://web.archive.org/web/20200813071802/https://www.norta.com/COVID19"
"621","Maine","US_ME","16-Oct","C5_Close.public.transport",1,"G",1,"G","There has been no update to Maine's public transport policy as of 22nd October 2020."
"622","Mississippi","US_MS","16-Oct","C5_Close.public.transport",0,NA,0,NA,"There continues to be no official policy on public transit operations nor evidence of closures or restrictions. "
"623","North Carolina","US_NC","16-Oct","C5_Close.public.transport",1,"G",1,"G","October 22, 2020: Gov. Roy Cooper announces that North Carolina will remain in Phase 3 for an extended period of 3 weeks. Phase 3 was initially scheduled to end on October 23, 2020. Cooper also sent letters to 33 counties urging them to adopt ordinances that imposed fines for violating COVID-19 restrictions and to consider issuing more strict restrictions that those outlines in Phase 3.     Reference: https://web.archive.org/save/https://abc11.com/health/cooper-extends-phase-3-as-covid-19-metrics-surge/7219027/"
"624","North Dakota","US_ND","16-Oct","C5_Close.public.transport",0,NA,0,NA,"No changes after checking relevant sources. "
"625","New Jersey","US_NJ","16-Oct","C5_Close.public.transport",0,NA,0,NA,"""Executive Order 165 requires all staff & customers to wear face coverings on board all transit vehicles and inside all stations & facilities. Masks are also required on train platforms & bus stops when distancing is not possible. Eating & drinking are strictly prohibited aboard all transit vehicles.""    https://web.archive.org/web/20201001185036/https://www.njtransit.com/covid19"
"626","New York","US_NY","16-Oct","C5_Close.public.transport",1,"G",1,"G","There was no update to New York's public transport policy between 16th and 22nd October 2020, therefore this indicator remains at 1G. "
"627","Washington DC","US_DC","17-Oct","C5_Close.public.transport",0,NA,0,NA,"No policy change"
"628","Maryland","US_MD","17-Oct","C5_Close.public.transport",0,NA,0,NA,"No policy change"
"629","Arizona","US_AZ","19-Oct","C5_Close.public.transport",0,NA,0,NA,"No policy change noted. Local media reports that bus routes have been reinstated.  https://web.archive.org/web/20201025225934if_/https://patch.com/arizona/phoenix/phoenix-public-transit-department-restore-pre-coronavirus-bus-services"
"630","Florida","US_FL","19-Oct","C5_Close.public.transport",1,"T",1,"T","Miami-Dade Transit reminds riders that wearing a face mask is mandatory while waiting on platforms and while riding public transportation.     Link:  https://web.archive.org/web/20201019164526/https://twitter.com/GoMiamiDade/status/1318231646865395718"
"631","Massachusetts","US_MA","19-Oct","C5_Close.public.transport",1,"T",1,"T","Effective October 19, 2020 the following changes to service and operations have been made to protect the health and safety of essential workers who rely on public transit, as well as our frontline staff:  Service levels prioritize certain routes to meet ridership demand, avoid crowding on vehicles, and to allow for physical distancing in keeping with health and safety protocol guidance. Shared trips on The RIDE have been eliminated. RIDE customers can still bring a personal care attendant or guest on their trip. Riders are still recommended/urged to stay home if sick.    Coded 1T as the MBTA refers to public transportation in the Bay area of MA.     Website: https://web.archive.org/web/20201021183637if_/https://www.mbta.com/covid19  "
"632","Minnesota","US_MN","19-Oct","C5_Close.public.transport",0,NA,0,NA,"No policy changes noted."
"633","Alaska","US_AK","21-Oct","C5_Close.public.transport",0,NA,0,NA,"No changes detected in this indicator after searching executive orders, news articles and press releases."
"634","Florida","US_FL","21-Oct","C5_Close.public.transport",1,"T",1,"T","Hillsborough Area Regional Transit (HART) authority continues to operate under Covid-19 measures, including: practice CDC recommended good hygiene and social distancing, buses follow a modified Sunday schedule, on-board seat signage have been installed to encourage staggered seating among riders.    Link:  https://web.archive.org/web/20201021191435/https://twitter.com/GoHART/status/1318993959272783878"
"635","Kansas","US_KS","21-Oct","C5_Close.public.transport",1,"T",1,"T","Kansas City buses continue to operate with reduced frequency and, due to social distancing measures, reduced capacity. Fares have also been eliminated.    https://web.archive.org/web/20201030013644/https://ridekc.org/bulletins/covid"
"636","Vermont","US_VT","21-Oct","C5_Close.public.transport",0,NA,0,NA,"No changes detected in this indicator after searching news articles, press releases and executive orders."
"637","Maryland","US_MD","22-Oct","C5_Close.public.transport",0,NA,0,NA,"No policy change"
"638","New Hampshire","US_NH","22-Oct","C5_Close.public.transport",0,NA,0,NA,"Measures include social distancing and masks.     Ex: Nashua Public Transit ""Phase 3"" - reduced capacity, safety barriers, masks required, physical distancing required.  https://web.archive.org/web/20200924185443/https://www.nashuanh.gov/1341/NTSs-Response-to-COVID-19"
"639","Colorado","US_CO","23-Oct","C5_Close.public.transport",1,"T",1,"T","Previous policy in place."
"640","Delaware","US_DE","23-Oct","C5_Close.public.transport",0,NA,0,NA,"No new measures or restrictions"
"641","Maine","US_ME","23-Oct","C5_Close.public.transport",1,"G",1,"G","There has been no update to Maine's public transport policy as of 29th October 2020."
"642","Mississippi","US_MS","23-Oct","C5_Close.public.transport",0,NA,0,NA,"No change in policy found."
"643","North Carolina","US_NC","23-Oct","C5_Close.public.transport",1,"G",1,"G","All relevant sources have been checked. No changes to the policy have been made. "
"644","New Jersey","US_NJ","23-Oct","C5_Close.public.transport",0,NA,0,NA,"""Executive Order 165 requires all staff & customers to wear face coverings on board all transit vehicles and inside all stations & facilities. Masks are also required on train platforms & bus stops when distancing is not possible. Eating & drinking are strictly prohibited aboard all transit vehicles.""    https://web.archive.org/web/20201001185036/https://www.njtransit.com/covid19"
"645","New York","US_NY","23-Oct","C5_Close.public.transport",1,"G",1,"G","There was no update to New York's public transport policy between 23rd and 26th October 2020, therefore this indicator remains at 1G. "
"646","Rhode Island","US_RI","23-Oct","C5_Close.public.transport",0,NA,0,NA,"No update found."
"647","Virgin Islands","US_VI","23-Oct","C5_Close.public.transport",0,NA,0,NA,"No update."
"648","Massachusetts","US_MA","26-Oct","C5_Close.public.transport",1,"T",1,"T","The MBTA Commuter Rail announced schedule changes starting Monday, Nov. 2.    The changes will reflect changing ridership patterns amid the coronavirus pandemic, said MBTA General Manager Steve Poftak in a September press release. As workplaces experiment with staggered work times, the MBTA will distribute service more evenly throughout the day.    There will be 39 more trains in service than last fall. Most of the new trains will serve Dorchester, Mattapan, and Hyde Park on the Fairmount Line, Brockton on the Middleborough/Lakeville Line, and Lynn on the Newbury/Rockport Line.    https://web.archive.org/web/20201029204320/https://www.boston.com/news/local-news/2020/10/26/mbta-commuter-rail-fall-schedule-changes"
"649","Alaska","US_AK","27-Oct","C5_Close.public.transport",0,NA,0,NA,"No detected change in this indicator after searching press releases, executive orders and news articles."
"650","Maryland","US_MD","27-Oct","C5_Close.public.transport",0,NA,0,NA,"No policy change"
"651","New York","US_NY","27-Oct","C5_Close.public.transport",1,"G",1,"G","Governor Andrew M. Cuomo announced on 27th October that the MTA will begin a voluntary COVID-19 screening program for frontline employees. This shows that public transport is running, at least in New York City. (Perhaps a redundant update, but useful evidence nonetheless.)     Source: http://web.archive.org/web/20201029204705/https://www.governor.ny.gov/news/governor-cuomo-announces-mta-launch-voluntary-covid-19-screening-program-frontline-employees"
"652","Vermont","US_VT","28-Oct","C5_Close.public.transport",0,NA,0,NA,"No changes detected in this indicator after searching press releases, news articles and executive orders."
"653","Florida","US_FL","24-Sep","C6_Stay.at.home.requirements",2,"T",2,"T","On September 24, the mayor of Miami-Dade County enacts an Emergency Order extending the Declaration of State of Local Emergency for another 7 days. No new changes have been introduced for closure/containment measures.  Link: https://web.archive.org/web/20200924195828/https://www.miamidade.gov/information/library/09.23.20-state-of-emergency-declaration-extension-29.pdf"
"654","Maine","US_ME","24-Sep","C6_Stay.at.home.requirements",1,"G",1,"G","Governor Mills' Executive Order of 31st May urging the over-60s and those with pre-existing medical conditions to stay at home as much as possible is still in effect as of 1st October."
"655","New York","US_NY","24-Sep","C6_Stay.at.home.requirements",1,"G",1,"G","As of 1st October, there has been no update regarding New York's stay at home recommendations, so 1G remains in effect. "
"656","South Carolina","US_SC","24-Sep","C6_Stay.at.home.requirements",1,"G",1,"G","Effective September 24, Governor McMaster's Executive Order No. 2020-62 extends the State of Emergency by an additional 15 days. No additional closure/containment measures have been issued per this Executive Order.    Link:  https://web.archive.org/web/20201001031959/https://governor.sc.gov/sites/default/files/Documents/Executive-Orders/2020-09-24%20FILED%20Executive%20Order%20No.%202020-62%20-%20State%20of%20Emergency.pdf"
"657","Arizona","US_AZ","25-Sep","C6_Stay.at.home.requirements",1,"G",0,NA,"No mention of stay-at-home recommendations remains on the Arizona Department of Health Services website. They now only recommend staying at home only when sick or exposed.  https://web.archive.org/web/20200927045755/https://www.azdhs.gov/preparedness/epidemiology-disease-control/infectious-disease-epidemiology/index.php"
"658","Florida","US_FL","25-Sep","C6_Stay.at.home.requirements",2,"T",2,"T","On September 25, Palm Beach County extends the Declaration of Continuing a State of Emergency for an additional 7 days, or until October 2. No changes to containment or closure measures have been issued per this extension.    https://web.archive.org/web/20200927222533/https://discover.pbcgov.org/PDF/COVID19/Declaration-of-Continuing-State-of-Emergency.pdf"
"659","North Dakota","US_ND","25-Sep","C6_Stay.at.home.requirements",0,NA,0,NA,"No changes after checking relevant sources."
"660","New Hampshire","US_NH","25-Sep","C6_Stay.at.home.requirements",1,"G",1,"G","""Safer at Home"" campaign: https://web.archive.org/web/20200924190438/https://www.covidguidance.nh.gov/"
"661","New Jersey","US_NJ","25-Sep","C6_Stay.at.home.requirements",1,"G",1,"G","""Precautions that apply across all stages include:    Work that can be done from home should continue to be done from home.  Clinically high-risk individuals who can stay at home should continue to do so.  All residents and businesses should follow state and federal safeguarding guidelines: wash hands; wear masks in public; respect social distancing; minimize gatherings; disinfect workplace and businesses; and no mass gatherings""    https://web.archive.org/web/20200911085110/https://covid19.nj.gov/faqs/nj-information/reopening-guidance-and-restrictions/when-and-how-is-new-jersey-lifting-restrictions-what-does-a-responsible-and-strategic-restart-of-new-jerseys-economy-look-like"
"662","Rhode Island","US_RI","25-Sep","C6_Stay.at.home.requirements",1,"G",1,"G","No change: ""Stay At Home Advisory:All vulnerable populations identified by the Centers for Disease Control and Prevention (CDC), which include those who are 65 years of age and older, are still strongly advised to stay at home unless they must go to work, travel for medical treatment or obtain other necessities such as groceries, gas or medication. The CDC identifies conditions that make people at higher risk for severe illness from COVID-19. This Executive Order has been extended to September 28, 2020.""    https://web.archive.org/web/20200920094730/https://health.ri.gov/covid/"
"663","Montana","US_MT","28-Sep","C6_Stay.at.home.requirements",2,"T",2,"T","On September 28 the Blackfeet Reservation announced a lockdown until October 25. During the lockdown Blackfeet Tribal offices are closed, the residents are under  a stay at home order  unless engaged in essential activities. There is also a prohibition on indoor gathering, a social distancing order, a mask requirement in all areas of the Blackfeet Reservation. In addition, there is a curfew from 9:00 p.m. to 6:00 a.m, and court enforcement for isolation/quarantine public health orders.    See Blackfeet Reservation announcement: https://web.archive.org/web/20201015062924/https://blackfeetnation.com/2020/10/14/extended-stay-at-home-quarantine-orders-for-blackfeet-reservation-sept-28-oct-25-2020/"
"664","Alaska","US_AK","29-Sep","C6_Stay.at.home.requirements",1,"T",1,"T","Anchorage's Emergency Order EO-14 v2 remains in effect. "
"665","Alabama","US_AL","29-Sep","C6_Stay.at.home.requirements",1,"G",1,"G","On Sept. 29, the Governor extended the “Safer at Home” order until November 8. No major changes were introduced. The state government continues to recommend individuals stay at home.    https://web.archive.org/web/20201001090822/https://governor.alabama.gov/assets/2020/09/Safer-at-Home-Order-Final-9.29.2020.pdf    https://web.archive.org/web/20201001091147/https://governor.alabama.gov/assets/2020/09/GKI-0040-2020-Health-Order-Update-Nov-8-Horizontal-2.pdf"
"666","California","US_CA","29-Sep","C6_Stay.at.home.requirements",1,"G",1,"G","The state of California updated their COVID-19 FAQ's on September 29. The state continues to recommend staying at home for all but essential reasons.    See FAQ's: http://web.archive.org/web/20201001044554/https://covid19.ca.gov/stay-home-except-for-essential-needs/  "
"667","Washington","US_WA","29-Sep","C6_Stay.at.home.requirements",1,"T",1,"T","At-risk populations are ""strongly encouraged, but not required, to stay home unless engaging in Modifed Phase 1, Phase 2 or Phase 3 permissible activities."" https://web.archive.org/web/20201001162104/https://coronavirus.wa.gov/sites/default/files/2020-09/PhasedChart_9-11.pdf"
"668","Mississippi","US_MS","30-Sep","C6_Stay.at.home.requirements",1,"G",1,"G","Governor Tate Reeves signed the Safe Recovery order on 30 September, effective until 11 November. As of this new Safe Recovery order, the state continues to recommend people stay at home.    https://web.archive.org/web/20201001191254/https://www.msema.org/wp-content/uploads/2020/09/Executive_Order_1525.pdf"
"669","Nevada","US_NV","30-Sep","C6_Stay.at.home.requirements",1,"G",0,NA,"The latest EO reopens all businesses and increases gathering sizes. There is no evidence of an active stay at home order or recommendation in Nevada. Minutes from the latest guidance uses 'stay-at-home' only in the context of anyone suspected of being infected. Thus the code is changed to a 0.    https://web.archive.org/web/20201001212734/https://nvhealthresponse.nv.gov/wp-content/uploads/2020/10/Declaration-of-Emergency-Directive-033.pdf    Minutes from latest guidance -   https://web.archive.org/web/20201001215525/https://nvhealthresponse.nv.gov/wp-content/uploads/2020/09/Nevada-Guidance-for-Safe-Gatherings-Celebrations-Ceremonies-and-Events.pdf"
"670","Arizona","US_AZ","01-Oct","C6_Stay.at.home.requirements",0,NA,0,NA,"No policy change noted."
"671","Florida","US_FL","01-Oct","C6_Stay.at.home.requirements",2,"T",2,"T","The Mayor of Miami-Dade County extends the Declaration of a State of Emergency for an additional 7 days commencing October 1. No changes have been implemented per this extension.    Link:   https://web.archive.org/web/20201001213029/https://www.miamidade.gov/information/library/09.30.20-state-of-emergency-declaration-extension-30.pdf"
"672","Georgia","US_GA","01-Oct","C6_Stay.at.home.requirements",1,"G",1,"G","Gov. Kemp extends state of public health emergency till November 9. All restrictions under this order remain unchanged.     ""There are two minor changes made in his latest order, which include allowing workers at restaurants and bars to return to work once they have been symptom-free for 24 following a confirmed positive or suspected COVID-19 case.""    https://archive.fo/julbz"
"673","Florida","US_FL","02-Oct","C6_Stay.at.home.requirements",2,"T",2,"T","On October 2, Palm Beach County extends the Declaration of Continuing State of Emergency for an additional 7 days or until October 9. The prolonged state of emergency does not include additional changes to containment/closure measures.    Link:   https://web.archive.org/web/20201004181222/https://discover.pbcgov.org/PDF/COVID19/Declaration-of-Continuing-State-of-Emergency.pdf"
"674","Louisiana","US_LA","02-Oct","C6_Stay.at.home.requirements",1,"G",1,"G","Aug 26 Gov extends phase two restrictions including closure of bars for two weeks in light of Hurricanes Marco and Laura  http://web.archive.org/web/20200903102439/https://www.wsj.com/articles/coronavirus-latest-news-08-26-2020-11598427633    The Governor moves Louisiana to Phase 3 of Resilient Louisiana with effect from September 18th 2020:    https://web.archive.org/web/20200917234431/https://gov.louisiana.gov/assets/Proclamations/2020/123-JBE-2020-COVID-19-Public-Health-Emergency-Phase3-of-Resilient-LA.pdf"
"675","Maine","US_ME","02-Oct","C6_Stay.at.home.requirements",1,"G",1,"G","Governor Mills' Executive Order of 31st May urging the over-60s and those with pre-existing medical conditions to stay at home as much as possible is still in effect as of 8th October."
"676","New Hampshire","US_NH","02-Oct","C6_Stay.at.home.requirements",1,"G",1,"G","""Safer at Home"" campaign: https://web.archive.org/web/20200924190438/https://www.covidguidance.nh.gov/"
"677","New Jersey","US_NJ","02-Oct","C6_Stay.at.home.requirements",1,"G",1,"G","""Precautions that apply across all stages include:    Work that can be done from home should continue to be done from home.  Clinically high-risk individuals who can stay at home should continue to do so.  All residents and businesses should follow state and federal safeguarding guidelines: wash hands; wear masks in public; respect social distancing; minimize gatherings; disinfect workplace and businesses; and no mass gatherings""    https://web.archive.org/web/20200911085110/https://covid19.nj.gov/faqs/nj-information/reopening-guidance-and-restrictions/when-and-how-is-new-jersey-lifting-restrictions-what-does-a-responsible-and-strategic-restart-of-new-jerseys-economy-look-like"
"678","New York","US_NY","02-Oct","C6_Stay.at.home.requirements",1,"G",1,"G","There were no updates to New York's policy on staying home between 2nd and 7th October 2020. "
"679","Texas","US_TX","02-Oct","C6_Stay.at.home.requirements",1,"T",1,"T","While Executive Order GA -30 (effective Sept 21) only recommends that people over the age of 65 stay at home, many counties continue to recommend staying home.     Houston/ Harris County:   https://archive.fo/tOOqp    Austin/ Travis County:   https://archive.fo/HF8DM    El Paso County:   https://archive.fo/ZGlqP"
"680","Virginia","US_VA","02-Oct","C6_Stay.at.home.requirements",1,"G",1,"G","With Executive Order 61, Governor Ralph Northam announced the easing of temporary restrictions due to COVID-19 pandemic. People may leave the house with strict social distancing guidelines.    Executive Order 61:  https://web.archive.org/web/20200803092929/https://www.governor.virginia.gov/media/governorvirginiagov/executive-actions/EO-61-and-Order-of-Public-Health-Emergency-Three---Phase-One-Easing-Of-Certain-Temporary-Restrictions-Due-To-Novel-Coronavirus-%28COVID-19%29.pdf"
"681","Minnesota","US_MN","03-Oct","C6_Stay.at.home.requirements",1,"G",1,"G","The Minnesota web page on Covid-19 continues to recommend staying home when possible.  https://web.archive.org/web/20201002022834/https://mn.gov/covid19/"
"682","Colorado","US_CO","05-Oct","C6_Stay.at.home.requirements",1,"T",1,"T","The Governor extended the Protect Our Neighbors Executive Order.    Link: http://web.archive.org/web/20201008103629/https://drive.google.com/file/d/1FdNPNVfCLRAaKVqCDgaUi6h0PsDCe1Nb/view"
"683","Montana","US_MT","05-Oct","C6_Stay.at.home.requirements",2,"T",2,"T","On Oct. 5 President Rynalea Whiteman Pena of the Northern Cheyenne tribe issued an executive order extending the full lockdown of the reservation.    Residents are advised to continue avoiding nonessential daytime travel during the week. Nonessential travel remains completely prohibited under the order during a weeknight curfew, from 6 P.M. to 6 A.M., and during the weekend at all hours.    The complete weekend lockdown begins 6 A.M. on Oct. 10 and ends 6 A.M., Oct. 12. The lockdown and curfew were put in place Sept. 23.    Tribal leadership said the current Stay At Home order will remain in place until there are 50 or fewer confirmed active coronavirus cases on the reservation for a full 30 days. The curfew and weekend lockdowns may also be extended until this goal is achieved. The order said the curfew will remain in place until public health officials recommend ending it.    See Montana Free Press article: https://web.archive.org/web/20201008050924/https://www.mtpr.org/post/northern-cheyenne-president-declares-continued-state-emergency-extends-restrictions"
"684","South Dakota","US_SD","06-Oct","C6_Stay.at.home.requirements",0,NA,1,"G","Under South Dakota's ""Back to Normal Plan"" individuals should ""continue to stay home when sick"". Additionally, all populations are recommended to ""consider staying home whenever possible""    Website: https://web.archive.org/web/20201010013831/https://covid.sd.gov/docs/COVID_SDPlan_BackToNormal.pdf"
"685","Alaska","US_AK","07-Oct","C6_Stay.at.home.requirements",1,"T",1,"T","Anchorage's Emergency Order EO-14 v2 remains in effect. "
"686","Florida","US_FL","08-Oct","C6_Stay.at.home.requirements",2,"T",2,"T","The County Mayor of Miami-Dade County declares extending the local State of Emergency for an additional 7 days and renews existing local amendments. No changes to containment or closure measurements have been made.    Link:  https://web.archive.org/web/20201008211122/http://www.miamidade.gov/information/library/10.08.20-state-of-emergency-declaration-extension-31.pdf"
"687","New York","US_NY","08-Oct","C6_Stay.at.home.requirements",1,"G",1,"G","On 6th October, Governor Cuomo announced a new cluster action initiative, which introduces more stringent restrictions to try and tackle clusters of cases in Brooklyn, Queens, and Broome, Orange and Rockland Counties. These measures come into effect on 8th October.     Given the restrictions on visiting all but non-essential businesses in Red Zones, we can presume that in these areas, people are also being encouraged to stay at home where possible. However, given that there has been no official stay-at-home order for these districts, this indicator remains at 1G.     Source: http://web.archive.org/web/20201008212525/https://www.governor.ny.gov/news/governor-cuomo-announces-new-cluster-action-initiative"
"688","Arizona","US_AZ","09-Oct","C6_Stay.at.home.requirements",0,NA,0,NA,"No policy change noted."
"689","Florida","US_FL","09-Oct","C6_Stay.at.home.requirements",2,"T",2,"T","On October 9, Palm Beach County (PBC) County Mayor extends the locally declared State of Emergency for an additional 7 days. No new containment or closure measures have been introduced.    Link:  https://web.archive.org/web/20201011155516/https://discover.pbcgov.org/PDF/COVID19/Declaration-of-Continuing-State-of-Emergency.pdf"
