"","RegionName","RegionCode","Date","indicator_type","past_value","past_flag","present_value","present_flag","Notes"
"754","New Jersey","US_NJ","25-Sep","E1_Income.support",1,"T",1,"T","""Unemployment, Temporary Disability and Family Leave benefits require an application to the State of NJ...    If an individual has tested positive for COVID-19, or has symptoms of COVID-19 and is unable to work, he/she:    Can use up to 80 hours of Federal Emergency Paid Sick Leave. Your employer pays you for this. This will expire at the end of the year and not roll over. It is at your regular rate of pay, capped at $511 a day and a total of $5,110. Learn more from the U.S. Department of Labor.    Can use accrued Earned Sick Leave: As of October 2018, NJ employers of all sizes must provide full-time, part-time, and temporary employees with up to 40 hours of earned sick leave per year so they can care for themselves or a loved one.  If an employee uses up their sick leave and still cannot return to work, they may apply for one of the following programs, depending on their situation and eligibility:    Can apply for up to 39 weeks of Unemployment Insurance: Under the CARES Act, this worker is likely eligible for help from NJ Unemployment Insurance. Unemployment benefits provide 60% of average wages, with a maximum of $713/week (+ additional $600/week through July).  After exhausting Unemployment Insurance benefits, or instead of Unemployment Insurance benefits, can apply for Temporary Disability Insurance (TDI): A claim would need to be filed online at myleavebeneits.nj.gov; the health care provider would give the diagnosis and the duration the individual is expected to be out of work. Available wage records on file would determine the amount of TDI benefits. It is against the law for employers to retaliate against employees for taking or seeking to take TDI benefits. In addition, some NJ workers are eligible for job-protected medical leave under the Federal Family and Medical Leave Act (FMLA).   May be eligible for Workers’ Compensation: If a person contracts the virus because he/she waited on or worked with someone who had the virus, or contracted the virus for any other work related reason, that person could be eligible for workers’ compensation and would file through their employer.""    Other scenarios listed for being exposed to someone with COVID, employer temporarily closed, etc.     https://web.archive.org/web/20200924195812/https://myunemployment.nj.gov/labor/myunemployment/covid.shtml"
"755","Rhode Island","US_RI","25-Sep","E1_Income.support",1,"T",1,"T","""For all weeks since July 26, 2020 that supplemental payments authorized under  the Memorandum are available to eligible Rhode Islanders, the minimum  weekly base rate for unemployment insurance benefits, including regular State  Unemployment Compensation, Unemployment Compensation for Federal  Employees (UCFE), Unemployment Compensation for Ex-Service members  (UCX), Pandemic Emergency Unemployment Compensation (PEUC), Extended  Benefits (EB) Short-Time Compensation (STC), Trade Readjustment Allowance  (TRA), Payments under the Self-Employment Assistance (SEA) program, shall be  one hundred dollars ($100).    http://web.archive.org/web/20200907072256/https://governor.ri.gov/documents/orders/Executive-Order-20-68.pdf"""
"756","Utah","US_UT","25-Sep","E1_Income.support",0,NA,0,NA,"Although the state has not offered extra income support, it has recently started two initiatives.  Utah is providing rent relief (not clear, but probably CARES ACT funds) to people affected by the virus.  It applies to anyone making median or less of regional income level—even if undocumented.  https://rentrelief.utah.gov/  https://archive.fo/tZI21    Also launched a plan to help small businesses continue to pay employees who are quarantining because of exposure to Covid.  Uses CARES act funds.    https://coronavirus.utah.gov/utah-labor-commission-announces-2-million-small-business-quarantined-employee-grant-to-assist-utah-employers/  https://archive.fo/bXKMS  "
"757","Arizona","US_AZ","26-Sep","E1_Income.support",2,"T",2,"T","As of 9/25, benefits listed on the Arizona government website still appear to be extendable to non-traditional applicants due to Covid-19.    https://web.archive.org/web/20200926110836/https://des.az.gov/services/employment/unemployment-individual"
"758","Minnesota","US_MN","27-Sep","E1_Income.support",1,"T",1,"T","Published Minnesota guidance still seems to indicate expanded eligibility pool.    https://web.archive.org/web/20200927105004/https://www.dli.mn.gov/sites/default/files/pdf/Employer_and_employee_questions_related_to_COVID_19.pdf"
"759","Connecticut","US_CT","30-Sep","E1_Income.support",1,"G",1,"G","On 30 September, Connecticut allocates a further $108,170 to their partnership with the nonprofit 4-CT, contributing to the cash card program that covers the basic expenses of those who need to miss work due to self-isolation or for COVID-19.    See the announcement:  https://archive.fo/Mhvjz"
"760","Iowa","US_IA","01-Oct","E1_Income.support",2,"T",2,"T","As of October 1st, the State Extended Benefits program was still active. Self-employed, contract, and gig workers weren't eligible to enroll in this program.   http://web.archive.org/web/20201001045132/https://www.iowaworkforcedevelopment.gov/state-extended-benefits "
"761","Nebraska","US_NE","01-Oct","E1_Income.support",1,"G",1,"G","On October 1, The Department of Health and Human Services (DHHS) Division of Medicaid and Long-Term Care announce that healthcare benefits for Medicaid Expansion/Heritage Health Adult (HHA) will begin October 1, 2020, for Nebraskans who have been determined eligible for Medicaid Expansion. Applications will be accepted year-round at AccessNebraska.ne.gov or at any DHHS office.    See the Nebraska Department of Health and Human Services website, archived: https://web.archive.org/web/20201005135606/http://dhhs.ne.gov/Pages/Medicaid-Expansion-Benefits-Begin.aspx"
"762","California","US_CA","31-Aug","E2_Debt.contract.relief",2,NA,2,NA,"On August 31, Governor Gavin Newsom announced that he has signed legislation to protect millions of tenants from eviction and property owners from foreclosure due to the economic impacts of COVID-19. These protections apply to tenants who declare an inability to pay all or part of the rent due to a COVID-related reason.    Under the legislation, no tenant can be evicted before February 1, 2021 as a result of rent owed due to a COVID-19 related hardship accrued between March 4 – August 31, 2020, if the tenant provides a declaration of hardship according to the legislation’s timelines. For a COVID-19 related hardship that accrues between September 1, 2020 – January 31, 2021, tenants must also pay at least 25 percent of the rent due to avoid eviction.    See California government link: https://web.archive.org/web/20200903044219/https://www.gov.ca.gov/2020/08/31/governor-newsom-signs-statewide-covid-19-tenant-and-landlord-protection-legislation/"
"763","Delaware","US_DE","31-Aug","E2_Debt.contract.relief",1,NA,2,NA,"Emergency benefits will be issued to participants of Delaware’s Supplemental Nutrition Assistance Program (SNAP) for August as part of the federal Families First Coronavirus Response Act of 2020.    Under this federal act signed into law in March, the Delaware Department of Health and Social Services (DHSS) issues emergency benefits each month to any household not already receiving the maximum monthly SNAP benefit. SNAP households that already receive the maximum monthly benefit will not receive additional funds.    https://web.archive.org/web/20200911022510/https://news.delaware.gov/2020/08/27/delawares-snap-program-will-issue-additional-emergency-benefits-for-use-starting-aug-31/    Note - since this is an additional stipulation beyond the general utility payment provisions, it is coded as a 2. Review needed."
"764","Florida","US_FL","31-Aug","E2_Debt.contract.relief",2,NA,2,NA,"Gov. DeSantis extends Executive Order 20-180 until 12:01 a.m. on October 1, 2020 by issuing a new Exeuctive Order No. 20- 211. This extends the mortgage foreclosure and eviction relief in the state.    Link:  https://web.archive.org/web/20200902145653/https://www.flgov.com/wp-content/uploads/orders/2020/EO_20-211.pdf"
"765","Georgia","US_GA","31-Aug","E2_Debt.contract.relief",2,NA,2,NA,"While the Judicial State of Emergency ends on September 10, on August 31, the City of Toccoa and North Georgia EMC ended their suspension on disconnections of services.     http://web.archive.org/web/20200903214436/https://gema.georgia.gov/document/document/georgia-postponed-services8-31-20/download"
"766","Maryland","US_MD","31-Aug","E2_Debt.contract.relief",2,NA,2,NA,"Considering the expiration of the order “Prohibiting Termination of Residential Services and Late Fees” on September 1, the Maryland Public Service Commission prohibited on August 31 utility service terminations through November 15. It is being said on the press release that “a subsequent order in the near future will include more details.” See Press Release, archived: https://web.archive.org/web/20200909224304/https://www.psc.state.md.us/wp-content/uploads/MD-PSC-Prohibits-Residential-Utility-Terminations-through-11152020.pdf"
"767","Oregon","US_OR","31-Aug","E2_Debt.contract.relief",2,NA,2,NA,"On August 31 Governor Brown extended protections from foreclosure for Oregon homeowners and business owners through executive action, until December 31. Executive Order 20-37 will extend House Bill 4204’s current moratorium on foreclosures, as allowed by that legislation. https://web.archive.org/web/20200903003421/https://www.oregon.gov/newsroom/Pages/NewsDetail.aspx?newsid=37221  "
"768","Pennsylvania","US_PA","31-Aug","E2_Debt.contract.relief",2,NA,2,NA,"On August 31, the statewide moratorium on evictions and foreclosures expired.     On July 9, Gov. Wolf issued an extension on the previously implemented moratorium. According to this, effective July 10 through August 31, all homeowners and renters would be protected from evictions and foreclosures.    Links:  http://web.archive.org/web/20200730184803/https://www.governor.pa.gov/newsroom/gov-wolf-announces-protections-from-foreclosures-and-evictions-through-aug-31/  http://web.archive.org/web/20200828075601/https://www.governor.pa.gov/wp-content/uploads/2020/07/20200709-TWW-eviction-order.pdf"
"769","Missouri","US_MO","01-Sep","E2_Debt.contract.relief",1,NA,1,NA,"St. Louis extends suspension of evictions until Oct. 2, starting Sept. 1.    https://archive.fo/yMyaI"
"770","Pennsylvania","US_PA","01-Sep","E2_Debt.contract.relief",2,NA,1,NA,"Previously, the Public Utilities Commission (PUC) issued an Emergency Order prohibiting utilities from terminating service for as long as the Disaster Emergency is in effect, which Governor Wolf renewed a second-time (for 90-days) on September 1.     As of September 1, the previously issued statewide moratorium on evictions and foreclosures had also expired and no further statewide extension or relief has been issued as yet.     Additionally, CDC also issued an order banning all evictions through December 31, 2020.  The order states ""You are still required to pay rent and follow all the other terms of your lease and rules of the place where you live. You may also still be evicted for reasons other than not paying rent or making a housing payment""    *Since CDC's order is a federal order and there is no evidence as yet of a renewed moratorium or state evictions being banned, the code has been changed from 2 to 1, since the ban on utility shutdowns is still in place.     Links:  http://web.archive.org/web/20200909191553/https://www.nrdc.org/experts/mark-szybist/will-pa-get-it-right-utility-bill-assistance  http://web.archive.org/web/20200730184803/https://www.governor.pa.gov/newsroom/gov-wolf-announces-protections-from-foreclosures-and-evictions-through-aug-31/  http://web.archive.org/web/20200828075601/https://www.governor.pa.gov/wp-content/uploads/2020/07/20200709-TWW-eviction-order.pdf  http://web.archive.org/web/20200905201052/https://s3.amazonaws.com/public-inspection.federalregister.gov/2020-19654.pdf  http://web.archive.org/web/20200903134828/https://www.governor.pa.gov/newsroom/gov-wolf-signs-second-renewal-of-covid-19-disaster-declaration-for-state-response-and-recovery/"
"771","South Dakota","US_SD","01-Sep","E2_Debt.contract.relief",1,NA,0,NA,"In a news release, recorded on August 25, it was announced that city officials had stated earlier this month (date not specified) that the temporary suspension of penalties on past-due utility accounts will end on September 1.    http://archive.today/TjDG7"
"772","Pennsylvania","US_PA","02-Sep","E2_Debt.contract.relief",1,NA,1,NA,"Pennsylvania Housing Fianance Agency (PHFA) is accepting appliations from renters and land lords/homeowners for mortgage and rent relief until September 30. Funding is provided by the federal Coronavirus Aid, Relief and Economic Security (CARES) Act rather than state funding, and thus coding remains as 1.     Link:  https://web.archive.org/web/20200902170811/https://twitter.com/DuquesneLight/status/1301205184144642048"
"773","Washington","US_WA","02-Sep","E2_Debt.contract.relief",2,NA,2,NA,"On September 2nd, the governor of Washington extended several Coronavirus executive orders including those that offered debt relief and preservation of essential utilities. See archive: https://web.archive.org/web/20200904060948/https://www.governor.wa.gov/news-media/inslee-extends-26-covid-19-related-proclamations"
"774","Louisiana","US_LA","03-Sep","E2_Debt.contract.relief",0,NA,1,NA,"Eviction hearings for tenants accused of failing to pay rent were shut down across the board in New Orleans on Sept. 3. Judges acted one day in advance of the federal moratorium on evictions directed by the CDC.    https://web.archive.org/web/20200904041344/https://www.nola.com/news/business/article_cb9a45fc-edff-11ea-a83a-13977aa65d14.html"
"775","Mississippi","US_MS","03-Sep","E2_Debt.contract.relief",2,NA,2,NA,"Trent Kelly's official website consists of resources for economic impact payments, employment resources and small business resources. Loan forgiveness and  payment deferral services are also available. See website, archived: http://web.archive.org/web/20200817003542/https://trentkelly.house.gov/homepage-2019/coronavirus-relief-resources.htm"
"776","Nevada","US_NV","03-Sep","E2_Debt.contract.relief",1,NA,1,NA,"Nevada Governor Steve Sisolak signed  Emergency Directive 031 extending the moratorium on certain residential  evictions for 45 days, through October 14, 2020 at 11:59 p.m..  This directive extends the moratorium on residential evictions based on  nonpayment of rent in the State of Nevada to provide for greater housing  stability so that people can remain in their homes as the State continues to  fight and recover from both the health and economic ramifications brought  on by the COVID-19 pandemic.    https://web.archive.org/web/20200903183824/https://nvhealthresponse.nv.gov/wp-content/uploads/2020/09/Directive-031-Comprehensive-Packet.pdf"
"777","Alabama","US_AL","04-Sep","E2_Debt.contract.relief",1,NA,1,NA,"The State Government continues to work with utility providers to prevent shut-off for non-payment.     https://altogetheralabama.org/state-individual-resources/#1d27150ab9d0dda77 (archive link broken)"
"778","Massachusetts","US_MA","04-Sep","E2_Debt.contract.relief",1,NA,1,NA,"Moratoriums on evictions and foreclosures remain effective till October 17.    https://web.archive.org/web/20200910204836/https://www.mass.gov/info-details/massachusetts-law-about-tenants-in-foreclosed-buildings "
"779","Maine","US_ME","04-Sep","E2_Debt.contract.relief",1,NA,1,NA,"As of 11th September 2020, there is still no evidence that the moratorium on utility shut-off has ended, therefore this indicator remains coded at 1."
"780","New Mexico","US_NM","04-Sep","E2_Debt.contract.relief",1,NA,1,NA,"No updates on evictions or debt collection on the New Mexico Courts site.     Link to NM Courts Site:   https://archive.fo/apyS7"
"781","New York","US_NY","04-Sep","E2_Debt.contract.relief",1,NA,1,NA,"Governor Cuomo's extension of the moratorium on COVID-related commercial evictions lasts until 20th September 2020, therefore this indicator is still coded at 1.     https://www.governor.ny.gov/news/governor-cuomo-signs-executive-order-extending-moratorium-covid-related-commercial-evictions (Wayback Machine unavailable)"
"782","Wyoming","US_WY","04-Sep","E2_Debt.contract.relief",2,NA,1,NA,"Wyoming is subject to the CDC's ban on eviction issued September 4.  It prohibits evictions in situations where the tenants might be made homeless or would have to move into substantially more crowded living accommodations under a public health rationale.  https://web.archive.org/web/20200924125325/https://oilcity.news/community/health/covid-19/2020/09/04/cdc-issues-eviction-ban-through-end-of-2020-applies-in-wyoming/"
"783","Minnesota","US_MN","06-Sep","E2_Debt.contract.relief",1,NA,1,NA,"Executive order 20-79 remains in effect.  https://web.archive.org/web/20200919202811/https://mn.gov/covid19/for-minnesotans/get-help/housing.jsp "
"784","Colorado","US_CO","08-Sep","E2_Debt.contract.relief",2,NA,2,NA,"Gov. Polis extended an Executive Order providing relief to public utility customers to mitigate, respond to, and recover from the current economic disruption due to the presence of COVID-19.    Link: http://web.archive.org/web/20200908185653/https://drive.google.com/file/d/1errrjOovYnJc2NgqLkRrcmNrVLZSv4t6/view     Gov. Polis extended executive order providing assistance to residential and commercial tenants at risk for eviction.    Link: https://archive.fo/kRYNe"
"785","Hawaii","US_HI","08-Sep","E2_Debt.contract.relief",1,NA,1,NA,"""Gov. Ige announced the launch of the State of Hawai‘i Rent Relief and Housing Assistance Program (RRHAP). This program provides assistance for Hawai‘i renters who have experienced a reduction in income because of unemployment or a reduction in work hours due to the COVID-19 pandemic and are at risk of eviction. Funded by Federal Coronavirus Aid, Relief, and Economic Security (CARES) Act appropriations, the program provides at-risk renters with assistance in making monthly rent as well as financial counseling....Applications are currently being accepted for housing payments due between August 1, 2020 and December 28, 2020. The program is administered by non-profit partners Catholic Charities Hawai‘i and Aloha United Way....Full-time Hawai‘i residents with proof of valid and current tenancy for their primary residence housing unit in Hawai‘i must show a loss of income due to the COVID-19 pandemic and have a gross household income that does not exceed 100% of the HUD Area Median Income for 2020. You can apply for the Rent Relief and Housing Assistance Program if you:    Are a full-time Hawai‘i resident.  Have proof of valid and current tenancy for primary residence in the state of Hawai‘i.  Are 18 years of age or older.  Can demonstrate a loss of income directly resulting from the COVID-19 pandemic.  Can demonstrate that your current household income does not exceed 100% Area Median Income.  Monthly payments will be $2,000 per household for residents in the City and County of Honolulu, or $1,500 per household for residents in the counties of Hawai‘i, Maui and Kaua‘i. The payments will also be made directly to the landlord.""    https://web.archive.org/web/20200910090040/https://health.hawaii.gov/news/covid-19/hawaii-covid-19-daily-news-digest-september-8-2020/"
"786","Maryland","US_MD","09-Sep","E2_Debt.contract.relief",2,NA,2,NA,"As of September 9, the Executive Order 20-04-03-01 is still in place. See Governor’s website (Orders Currently in Effect, Evictions and Mortgages), archived: https://web.archive.org/web/20200909224414/https://governor.maryland.gov/covid-19-pandemic-orders-and-guidance/"
"787","Oregon","US_OR","09-Sep","E2_Debt.contract.relief",2,NA,2,NA,"On Tuesday, September 8th Portland Mayor Ted Wheeler announced that Portland Housing Bureau will allocate $500,000 toward housing aid for East Portland residents who pay more than half their monthly income on rent. Additionally, the Portland City Council ""will consider requiring landlords to pay tenants relocation money if they raise the rent by any amount. Current rules require them to pay fees if they increase rent at least 10%."" This proposal will be discussed next week.     https://web.archive.org/web/20200910203056/https://www.oregonlive.com/portland/2020/09/portland-may-require-landlords-to-pay-tenant-relocation-fees-for-any-rent-increase-extend-eviction-moratorium-to-end-of-2020.html"
"788","Georgia","US_GA","10-Sep","E2_Debt.contract.relief",2,NA,1,NA,"On September 10, Chief Justice Harold Melton extended the Judicial state of emergency until October 10 but he also directed “each county to establish a local committee of judicial system participants to develop detailed guidelines for the resumption of jury trials in the county utilizing the safe jury trial guidelines being developed by the Task Force.”    Based on this order, he allowed the resumption of grand jury proceedings at the discretion of each superior court’s chief judge.    Links:  http://web.archive.org/web/20200917202428/https://www.gasupreme.us/wp-content/uploads/2020/09/FINAL_Sixth-SJEO.pdf  https://archive.vn/5WLwy"
"789","Colorado","US_CO","11-Sep","E2_Debt.contract.relief",2,NA,2,NA,"Previous policy remains in effect."
"790","Louisiana","US_LA","11-Sep","E2_Debt.contract.relief",1,NA,1,NA,"Eviction hearings for tenants accused of failing to pay rent were shut down across the board in New Orleans on Sept. 3. Judges acted one day in advance of the federal moratorium on evictions directed by the CDC.    https://web.archive.org/web/20200904041344/https://www.nola.com/news/business/article_cb9a45fc-edff-11ea-a83a-13977aa65d14.html"
"791","North Carolina","US_NC","11-Sep","E2_Debt.contract.relief",2,NA,2,NA,"No changes found after checking relevant resources. "
"792","Virginia","US_VA","11-Sep","E2_Debt.contract.relief",1,NA,1,NA,"On June 29th, the moratorium on evictions expired. However, under law H340, tenants affected by COVID-19 could delay eviction for 60 days if they were able to provide written evidence to the court. Because evictions were reviewed on case-per-case basis while homeowners could still receive a 30-day stay of foreclosure, this relief was considered narrow (coded as ""1"").     Moratorium: http://archive.fo/daSOn     H340: http://web.archive.org/web/20200803181147/https://lis.virginia.gov/cgi-bin/legp604.exe?201+ful+HB340ER2"
"793","Arizona","US_AZ","12-Sep","E2_Debt.contract.relief",1,NA,1,NA,"No new measures have been introduced. Previously noted policies remain valid."
"794","Maine","US_ME","12-Sep","E2_Debt.contract.relief",1,NA,1,NA,"On 15th September, the Maine Public Utilities Commission voted to end the moratorium on utility shut-offs on 1st November 2020; therefore 1 remains in effect until at least this date.     Source: http://web.archive.org/web/20200917174508/https://www.maine.gov/tools/whatsnew/index.php?topic=puc-pressreleases&id=3290718&v=article08"
"795","Kansas","US_KS","15-Sep","E2_Debt.contract.relief",1,NA,0,NA,"Governor Kelly's moratorium on evictions lapsed on September 15. The CDC instated a hold on evictions related to COVID-19 through the end of the year. However, the code is downgraded to a 0 because this is a federal policy and there is no additional policy at the state level.    https://web.archive.org/web/20200918010619/https://www.kwch.com/2020/09/03/cdc-puts-hold-on-covid-19-related-evictions/"
"796","Alaska","US_AK","16-Sep","E2_Debt.contract.relief",2,NA,2,NA,"No changes detected in this indicator after searching news articles, press releases and executive orders."
"797","New York","US_NY","17-Sep","E2_Debt.contract.relief",1,NA,1,NA,"There was no change in policy in this area between 17th and 20th September 2020. "
"798","Wisconsin","US_WI","17-Sep","E2_Debt.contract.relief",1,NA,1,NA,"On September 17th, Public Service Commission of Wisconsin extended the moratorium on utility disconnections until November 1st.   http://web.archive.org/web/20201001052347/https://apps.psc.wi.gov/APPS/NewsReleases/content/PDF_download.aspx?id=663 "
"799","Alaska","US_AK","18-Sep","E2_Debt.contract.relief",2,NA,2,NA,"No changes detected in this indicator after searching news articles, press releases and executive orders.  "
"800","Arizona","US_AZ","18-Sep","E2_Debt.contract.relief",1,NA,1,NA,"No policy change noted."
"801","Illinois","US_IL","18-Sep","E2_Debt.contract.relief",1,NA,1,NA,"On 18 September, in Executive Order 2020-55, the Governor reissued most executive orders, extending a majority of the provisions through 17 October 2020.     This includes the previous restrictions such as in-person meeting requirements and public assistance requirements. The Phase 4 Community Revitalization Order (executive order 2020-42) still applies with new exemptions for “free exercise of religion, emergency functions, governmental functions, and election-related functions.”     https://web.archive.org/web/20200922144918/https://www2.illinois.gov/Pages/Executive-Orders/ExecutiveOrder2020-55.aspx"
"802","Louisiana","US_LA","18-Sep","E2_Debt.contract.relief",1,NA,1,NA,"Eviction hearings for tenants accused of failing to pay rent were shut down across the board in New Orleans on Sept. 3. Judges acted one day in advance of the federal moratorium on evictions directed by the CDC.    https://web.archive.org/web/20200904041344/https://www.nola.com/news/business/article_cb9a45fc-edff-11ea-a83a-13977aa65d14.html"
