"","RegionName","RegionCode","Date","indicator_type","past_value","past_flag","present_value","present_flag","Notes"
"272","Iowa","US_IA","16-Oct","C2_Workplace.closing",0,NA,0,NA,"On October 16th, Iowa Governor Kim Reynolds issued a new proclamation that extended business re-openings until November 15th. All businesses have to take reasonable social distancing and hygiene measures.     https://web.archive.org/web/20201021021859/https://governor.iowa.gov/sites/default/files/documents/Public%20Health%20Proclamation%20-%202020.10.16.pdf "
"273","Illinois","US_IL","16-Oct","C2_Workplace.closing",1,"T",1,"G","In Executive Order (EO) 2020-59, Governor Pritzker declared all counties in Illinois as a disaster area and reissued several former EOs effective 16 October 2020. This included recommending telework and remote work when available.     The EO specified that retail stores must provide masks to all employees unable to maintain a six-foot social distance and cap occupancy at 50%.     This is in effect until 14 November 2020.  https://web.archive.org/web/20201021222835/https://www2.illinois.gov/Pages/Executive-Orders/ExecutiveOrder2020-59.aspx   "
"274","Louisiana","US_LA","16-Oct","C2_Workplace.closing",2,"G",2,"G","Aug 26 Gov extends phase two restrictions including closure of bars for two weeks in light of Hurricanes Marco and Laura  http://web.archive.org/web/20200903102439/https://www.wsj.com/articles/coronavirus-latest-news-08-26-2020-11598427633    The Governor moves Louisiana to Phase 3 of Resilient Louisiana with effect from September 18th 2020:    https://web.archive.org/web/20200917234431/https://gov.louisiana.gov/assets/Proclamations/2020/123-JBE-2020-COVID-19-Public-Health-Emergency-Phase3-of-Resilient-LA.pdf"
"275","Maine","US_ME","16-Oct","C2_Workplace.closing",2,"G",2,"G","According to Governor Mills’ Executive Order of 6th October 2020, the anticipated opening date for bars and tasting rooms is 2nd November 2020. Therefore 2G will most likely remain in effect until at least this date.     Sources: http://web.archive.org/web/20201008184520/https://www.maine.gov/governor/mills/news/mills-administration-announces-maine-enter-stage-4-reopening-2020-10-06    http://web.archive.org/web/20201008195508/https://www.maine.gov/governor/mills/sites/maine.gov.governor.mills/files/inline-files/An%20Order%20to%20Implement%20Phase%20Four%20of%20the%20Restarting%20Maines%20Economy%20Plan.pdf"
"276","North Carolina","US_NC","16-Oct","C2_Workplace.closing",2,"G",2,"G","October 22, 2020: Gov. Roy Cooper announces that North Carolina will remain in Phase 3 for an extended period of 3 weeks. Phase 3 was initially scheduled to end on October 23, 2020. Cooper also sent letters to 33 counties urging them to adopt ordinances that imposed fines for violating COVID-19 restrictions and to consider issuing more strict restrictions that those outlines in Phase 3.     Reference: https://web.archive.org/save/https://abc11.com/health/cooper-extends-phase-3-as-covid-19-metrics-surge/7219027/"
"277","North Dakota","US_ND","16-Oct","C2_Workplace.closing",1,"T",1,"T","No changes after checking relevant sources. "
"278","Nebraska","US_NE","16-Oct","C2_Workplace.closing",0,NA,0,NA,"On October 16, Governor Pete Ricketts announced changes to the State’s directed health measures (DHMs) that will take effect statewide on October 21, 2020.  The Governor also launched a campaign to encourage Nebraskans to avoid the “Three C’s” to help slow the spread of the virus: 1) crowded places, 2) close contact, and 3) confined spaces.     Elective Procedures/Surgeries  o  In order to continue elective procedures, hospitals must maintain at least 10% of their staffed general and ICU beds as reserve capacity to treat COVID-19 patients.  o  Hospitals must continue to accept and treat COVID-19 patients and must not transfer COVID-19 patients to create capacity for elective procedures.    ·       Bars & Restaurants  o  Patrons will be required to be seated while on premise unless they are placing an order, using the restroom, or playing games.  o  100% of rated occupancy continues.  o  Maximum of eight (8) individuals in a party (groups larger than eight (8) will need to split into multiple tables).    Wedding & Funeral Reception Venues  o  Maximum of eight (8) individuals in a party (groups larger than eight (8) will need to split into multiple tables).  o  100% of rated occupancy continues.  o  Limited dances or other social events requiring guests to gather outside of their respective tables in guidance.    See the Nebraska Governement Website, archived: https://web.archive.org/web/20201023155730/https://governor.nebraska.gov/press/gov-ricketts-announces-changes-directed-health-measures-encourages-nebraskans-avoid-%E2%80%9Cthree-c%E2%80%99s"
"279","New Jersey","US_NJ","16-Oct","C2_Workplace.closing",1,"G",1,"G","""Most businesses can reopen, while following appropriate mitigation requirements."" (Requirements include masks, social distancing, sanitation, etc. Specific guidelines are industry-specific)    https://web.archive.org/web/20200922214614/https://covid19.nj.gov/faqs/nj-information/reopening-guidance-and-restrictions/what-rules-or-safety-guidelines-are-in-place-for-reopened-businesses"
"280","New Mexico","US_NM","16-Oct","C2_Workplace.closing",2,"G",2,"T","The Public Health Order signed on Oct 16 updates business openings to the following:   - Essential businesses may open. Essential businesses identified as ""retail space"" may not exceed 25% of the maximum occupancy of any enclosed space..""   - ""close contact businesses"" may operate at up to 25% of the maximum occupancy of any enclosed space  - ""close contact recreational facilities"" must remain closed   - ""food and drink establishments"" may provide dine-in services, but they may not exceed more than 25% occupancy of the maximum occupancy in any enclosed space on the premise   - ""houses of worship"" may not exceed 40% of the maximum occupancy of any enclosed building   - ""outdoor recreational facilities"" may operate provided they comply with the pertinent ""All Together New Mexico"" COVID-Safe Practices for Individuals and Businesses"".   -State parks are only open to New Mexico residents. Visitors centers and large enclosed indoor spaces at state parks shall remain closed.   - Public swimming pools are limited to the concurrent use of not more than ten (10) persons. Play and splash areas shall be closed.""   - Horse tracks may not allow spectators.   -""Places of lodging"" which have completed the NM Safe Certified training... may operate at 60% of maximum occupancy. All other ""places of lodging"" shall not operate at more than 25% of maximum capacity.""   - Any business that is not identified as ""essential business"", ""close contact business"", ""food and drink establishment"", ""house of worship"", ""close-contact recreational facility"", ""outdoor recreational facility"" or ""place of lodging"" may open provided that the total number of persons situated within the business does not exceed 25% of the maximum occupancy of any enclosed space...     Link to Public Health Order on Oct 16:   http://web.archive.org/web/20201021111301/https://cv.nmhealth.org/wp-content/uploads/2020/10/101620-PHO-1.pdf"
"281","New York","US_NY","16-Oct","C2_Workplace.closing",3,"T",3,"T","The cluster zone initiatives, outlined below, were announced to last 2 weeks beginning from 8th October, therefore they should come to an end on 22nd October. However, there has been no sign of their alleviation; therefore 3T remains in place for now.     On 6th October, Governor Cuomo announced a new cluster action initiative, which introduces more stringent restrictions to try and tackle clusters of cases in Brooklyn, Queens, and Broome, Orange and Rockland Counties. These measures take effect from 8th October.    In Red Zones, only essential businesses are open. In Orange Zones, high-risk non-essential businesses, like gyms and personal care, are closed. Therefore this indicator rises to 3T, in light of the most stringent measures in Red Zones.     Sources: http://web.archive.org/web/20201008212525/https://www.governor.ny.gov/news/governor-cuomo-announces-new-cluster-action-initiative    http://web.archive.org/web/20201008214420/https://newyork.cbslocal.com/2020/10/08/nyc-second-coronavirus-shutdown/"
"282","Oregon","US_OR","16-Oct","C2_Workplace.closing",2,"T",2,"T","Governor Brown announced on October 16 that Lane County has been added to the County Watch List, bringing the total number of counties on the Watch List to five. Counties are placed on the Watch List when COVID-19 is spreading quickly and public health officials cannot trace that spread to specific sources. Benton, Clatsop, Lane, Malheur, and Umatilla are all on the watch list. Some are in Phase 1 and some in Phase 2 of reopening. https://web.archive.org/web/20201020212024/https://www.oregon.gov/newsroom/Pages/NewsDetail.aspx?newsid=37575"
"283","Pennsylvania","US_PA","16-Oct","C2_Workplace.closing",2,"G",2,"G","On October 16, Governor Wolf vetoed House Bill 2513 (HB 2513) that was previously passed by the House and Senate in the General Assembly.     HB 2513 was passed ""in an attempt to restore the hospitality and private event industry and it addresses the following items:  1. Allows restaurant operations and private events to be restored to a minimum of 50% capacity with continued social distancing and barriers in use.  2. Eliminates the requirement that meal must be purchased to get an alcoholic beverage.   3. Allows for bar seating, again, with social distancing/barriers.""    However, Governor Wolf vetoed it on the grounds that this Bill would jeopardize public health and safety, and hence, could increase the outbreaks of COVID-19    Links:  http://web.archive.org/web/20200925154607/https://www.legis.state.pa.us/cfdocs/legis/PN/Public/btCheck.cfm?txtType=PDF&sessYr=2019&sessInd=0&billBody=H&billTyp=B&billNbr=2513&pn=4340  http://web.archive.org/web/20201022144744/https://www.governor.pa.gov/wp-content/uploads/2020/10/20201016-TWW-HB-2513-Veto-Message.pdf"
"284","Virginia","US_VA","16-Oct","C2_Workplace.closing",1,"G",1,"G","In Executive Order 68, the Governor ordered new restrictions on the Eastern Region. However, Executive Order 67 is still in force.    ‘All restaurants, dining establishments, food courts, breweries, microbreweries,  distilleries, wineries, and tasting rooms must close no later than 12:00 a.m.    Indoor dining in restaurants, dining establishments, food courts, breweries, microbreweries, distilleries, wineries, and tasting rooms may not exceed 50% of the lowest occupancy load on the certificate of occupancy.’    Code: 1T      EO 68: https://web.archive.org/web/20200730233349/https://www.governor.virginia.gov/media/governorvirginiagov/executive-actions/EO-68-and-Order-of-Public-Health-Emergency-Eight---Additional-Restrictions-on-the-Eastern-Region-due-to-Novel-Coronavirus-(COVID-19).pdf"
"285","Washington DC","US_DC","17-Oct","C2_Workplace.closing",2,"G",2,"G","No policy change"
"286","Maryland","US_MD","17-Oct","C2_Workplace.closing",1,"G",1,"G","No policy change"
"287","Ohio","US_OH","17-Oct","C2_Workplace.closing",1,"G",1,"G","The Department of Health Director issued an amended Director's Order to reopen adult day care services and senior centers by utilizing a phased approach starting from October 17th, 2020    https://web.archive.org/web/20201029031414/https://coronavirus.ohio.gov/static/publicorders/Amended-Opening-Adult-Day-Care-Services-Senior-Centers.pdf"
"288","Idaho","US_ID","18-Oct","C2_Workplace.closing",2,"T",2,"T","As of October 18, Idaho remains in Stage 4 with the exception of State 3 which applies to Ada county, home to Boise.  This means that generally all businesses can operate in the state except in Ada county which still restricts large venues and night clubs.  Bars were allowed to reopen in Ada county in september.  https://www.idahostatesman.com/news/coronavirus/article246090100.html  https://web.archive.org/web/20201018154125/https://rebound.idaho.gov/stage-4-stay-healthy-guidelines/    "
"289","Arizona","US_AZ","19-Oct","C2_Workplace.closing",2,"T",2,"T","High-risk establishments remain closed in parts of the state where positive tests are over 3% of the total.  https://web.archive.org/web/20201016184406/https://azdhs.gov/documents/preparedness/epidemiology-disease-control/infectious-disease-epidemiology/novel-coronavirus/community/bars-nightclubs.pdf"
"290","Minnesota","US_MN","19-Oct","C2_Workplace.closing",1,"G",1,"G","Businesses that can telework are asked to do so. All businesses are required to have a COVID-19 preparedness plan to facilitate appropriate social distancing.  https://web.archive.org/web/20201025231101/https://staysafe.mn.gov/"
"291","Wisconsin","US_WI","19-Oct","C2_Workplace.closing",1,"T",1,"G","On October 19th, Barron County Judge, James Babbler, reinstated Governor Evers' restrictions on indoor public gatherings. Now, restaurants and bars could only operate at 25% of their capacity.     https://web.archive.org/web/20201021031851/https://www.jsonline.com/story/news/politics/2020/10/19/tony-evers-order-limiting-gatherings-bar-capacity-revived-judge/3711676001/ "
"292","Alaska","US_AK","21-Oct","C2_Workplace.closing",1,"T",1,"T","Anchorage's Emergency Order EO-14 v2 remains in effect.   "
"293","Florida","US_FL","22-Oct","C2_Workplace.closing",0,NA,0,NA,"Commencing on October 22, Miami-Dade County extends the State of Emergency for an additional 7 days. No changes to containment/closure measurements have been issued.   Link: https://web.archive.org/web/20201022152901/https://www.miamidade.gov/information/library/10.21.20-state-of-Emergency-Declaration-Extension-33.pdf"
"294","Idaho","US_ID","22-Oct","C2_Workplace.closing",2,"T",1,"G","The governor's recent order moving the state back into Stage 3 reopening limits group gathering sizes indoors to 50 and requires all businesses to implement appropriate social distancing and hygiene measures.    Governor's order:  http://web.archive.org/web/20201029133802/https://coronavirus.idaho.gov/wp-content/uploads/2020/10/stay-healthy-order-stage3_2020oct27.pdf"
"295","Illinois","US_IL","22-Oct","C2_Workplace.closing",1,"G",1,"G","Governor Pritzker issued two executive orders (EO) in targeted regions to slow the spread of covid-19. This included measures such as closing all restaurants and bars from 11 p.m. to 6 a.m., suspending indoor consumption (outdoor only now), and every group needs to make a reservation, even if onsite, so the restaurant could pass along contact info for contact tracing.     As for other businesses, they are encouraged to work remotely “for as many workers as possible.”     Since businesses are still open, albeit under more limited restriction, I’m leaving as a 1G for now.    EO 2020-60 for Region 5 effective 22 October https://web.archive.org/web/20201029142137/https://www2.illinois.gov/Pages/Executive-Orders/ExecutiveOrder2020-60.aspx      EO 2020-61 for Region 7 effective 23 October: https://web.archive.org/web/20201029142250/https://www2.illinois.gov/Pages/Executive-Orders/ExecutiveOrder2020-61.aspx     "
"296","Maryland","US_MD","22-Oct","C2_Workplace.closing",1,"G",1,"G","No policy change"
"297","New Hampshire","US_NH","22-Oct","C2_Workplace.closing",1,"G",1,"G","Includes recommendations for screening, workplace modification, cleaning, etc.     ""These Universal Guidelines apply to all businesses, organizations, and individual business  operators for the operation of their business and must be complied with in conjunction  with any applicable industry-specific guidelines issued by the State of New Hampshire. ""    https://web.archive.org/web/20201014222908/https://www.covidguidance.nh.gov/sites/g/files/ehbemt381/files/files/inline-documents/guidance-universal.pdf"
"298","Colorado","US_CO","23-Oct","C2_Workplace.closing",2,"T",2,"T","Previous policy in place."
"299","Connecticut","US_CT","23-Oct","C2_Workplace.closing",2,"G",2,"G","No change in restrictions    See Phase 3 reopening guidelines:  http://web.archive.org/web/20201008215316/https://portal.ct.gov/DECD/Content/Coronavirus-Business-Recovery/Sector-Rules-and-Certification-for-Reopen"
"300","Delaware","US_DE","23-Oct","C2_Workplace.closing",1,"G",1,"G","No change in restrictions      https://web.archive.org/web/20200904125722/https://news.delaware.gov/2020/09/03/governor-carney-issues-omnibus-executive-order-on-covid-19-restrictions/"
"301","Florida","US_FL","23-Oct","C2_Workplace.closing",0,NA,0,NA,"Palm Beach County extends the local Declaration of a State of Emergency for an additional 7 days, until October 30. No new measures have been implemented for closure/containment.   Link:  https://web.archive.org/web/20201025194200/https://discover.pbcgov.org/PDF/COVID19/Declaration-of-Continuing-State-of-Emergency.pdf"
"302","Massachusetts","US_MA","23-Oct","C2_Workplace.closing",2,"T",2,"T","Currently, MA remains in Phase III, Step 2 (as of October 5, 2020) for lower-risk communities. Lower risk communities will be permitted to move into Step II of Phase III of the Commonwealth’s reopening plan. (Details)        Due to rising cases of COVID-19 connected to indoor ice hockey, the Massachusetts Department of Public Health issued a new public health order today prohibiting indoor ice rinks and ice skating facilities from operating from October 23, 2020 to November 7, 2020.    This order is in response to multiple COVID-19 clusters occurring at rinks throughout the state following games, practices and tournaments. Neighboring states including New Hampshire have enacted similar temporary restrictions regarding indoor ice hockey.    There have been at least 30 clusters of COVID-19 associated with organized ice hockey activities involving residents from more than 60 municipalities in Massachusetts. Each of these includes two or more confirmed or probable COVID-19 cases, totaling 108 confirmed cases.  This pause will allow for the development of enhanced COVID-19 protocols to further protect players, families, and coaches    https://web.archive.org/web/20201029204513/https://www.mass.gov/news/massachusetts-to-temporarily-pause-all-indoor-ice-rink-and-ice-skating-facilities-operations  "
"303","Mississippi","US_MS","23-Oct","C2_Workplace.closing",1,"G",1,"G","No change in policy found."
"304","North Carolina","US_NC","23-Oct","C2_Workplace.closing",2,"G",2,"G","All relevant sources have been checked. No changes to the policy have been made. "
"305","New Jersey","US_NJ","23-Oct","C2_Workplace.closing",1,"G",1,"G","""Most businesses can reopen, while following appropriate mitigation requirements."" (Requirements include masks, social distancing, sanitation, etc. Specific guidelines are industry-specific)    https://web.archive.org/web/20200922214614/https://covid19.nj.gov/faqs/nj-information/reopening-guidance-and-restrictions/what-rules-or-safety-guidelines-are-in-place-for-reopened-businesses"
"306","New York","US_NY","23-Oct","C2_Workplace.closing",3,"T",3,"T","Governor Cuomo announces that the Orange County micro-cluster focus area has met the metrics to pass out of the Red Zone and into the Orange Zone. However, given that none of the other micro-clusters have moved (and the stated two-week period that they would remain in the zones has not yet elapsed), the previous indicator stays in place.     Source:    http://web.archive.org/web/20201029203905/https://www.governor.ny.gov/news/governor-cuomo-announces-orange-county-micro-cluster-focus-area-meets-metrics-exit-red-zone"
"307","Oregon","US_OR","23-Oct","C2_Workplace.closing",2,"T",2,"T","On Friday, Oct 23 Governor Brown stated that Multnomah County is again on the ""County Watch List"".   ""This addition comes after Multnomah County was removed from the Watch List on Aug. 28. The county remains in Phase 1 of reopening, and it remains grouped with Clackamas and Washington Counties for future reopening decisions. Of these three counties, only Multnomah is on the Watch List at this time. In addition, the Governor announced that two counties — Benton and Clatsop — have succeeded in reducing the spread of COVID-19 sufficiently enough to be removed from the County Watch List."" https://web.archive.org/web/20201029005302/https://govstatus.egov.com/reopening-oregon"
"308","South Dakota","US_SD","23-Oct","C2_Workplace.closing",0,NA,3,"T","A (tribal) lockdown imposed in Pine Ridge, SD. The Oglala Sioux Tribe is locking down the Pine Ridge Indian Reservation on Friday, in response to a surging number of COVID-19 cases in the state.    The lockdown begins at 10 p.m. Friday and lasts until 6 a.m. Oct. 30. During that time, all non-critical travel is barred. The tribe said non-essential businesses should close to the public, and travel to non-essential work to or from the reservation should stop.    The tribe posted on its Twitter page that there were 391 active COVID-19 cases as of Thursday on the reservation, which has about 20,000 residents.    https://web.archive.org/web/20201029214927/https://rapidcityjournal.com/news/local/pine-ridge-reservation-going-into-lockdown-due-to-covid-19/article_34dc0eee-2e8c-5bb9-a241-20be153ce427.html"
"309","Utah","US_UT","23-Oct","C2_Workplace.closing",1,"G",1,"G","Governor has stated the time for action has come but has made no changes to the guidance or regulations.  https://web.archive.org/web/20201030102302/https://www.sltrib.com/news/2020/10/29/utah-reports-new-covid/"
"310","Virgin Islands","US_VI","23-Oct","C2_Workplace.closing",1,"G",1,"G","Virgin Islands continues to remain in the ""Yellow Phase"".     Non-essential businesses open, bars closed,    Restaurants open for indoor dining of 6 persons per table; no bar seating    Indoor/Outdoor recreation facilities open, no food or drink, facial covering required    Beaches closed at 4pm on weekends and holidays    No gathering greater than 50, facial coverings and social distancing required    Facial covering in all commercial entities    Public school and daycare campuses closed; Virtual learning implemented    Nursing homes closed to visitation    https://archive.fo/6xQbb  "
"311","Florida","US_FL","24-Oct","C2_Workplace.closing",0,NA,0,NA,"Effective October 24, Miami-Dade County issues a third amendment to Emergency Order 29-20 to remove limitations on park opening hours and to clarify requirements related to public and private golf courses.  Link:  https://web.archive.org/web/20201025194920/https://www.miamidade.gov/information/library/10.23.20-emergency-order-29-20-amendment-3.pdf    Effective October 24, Miami-Dade County enacts Emergency Order 31-20 stating that the latest version of the ""The New Normal: A Guide for Residents and Commercial Establishments"" to supersede all prior iterations. Included in the updated version is clarification of ""...the decibel level beyond which music can’t be played at a business or establishment. The order also states that the County Code authorizes the County Mayor to order the closure of any commercial establishment and to limit the movement of persons inside Miami-Dade County in order to safeguard life and health.""  Link:  https://web.archive.org/web/20201025195703/https://www.miamidade.gov/information/library/10.23.20-emergency-order-31-20.pdf"
"312","South Carolina","US_SC","24-Oct","C2_Workplace.closing",0,NA,0,NA,"On October 24, Gov. McMaster extends the State of Emergency by an additional 15 days. First responders and 911 operators are still allowed to ask individuals requesting assistance whether they have been exposed to COVID-19. All transportation waivers for commercial vehicles and operators of commercial vehicles are still in effect. No new closures/containment measures have been implemented.  Link:   https://web.archive.org/web/20201027190355/https://governor.sc.gov/sites/default/files/Documents/Executive-Orders/2020-10-24%20FILED%20Executive%20Order%20No.%202020-67%20-%20State%20of%20Emergency.pdf"
"313","Virginia","US_VA","24-Oct","C2_Workplace.closing",1,"G",1,"G","In Executive Order 68, the Governor ordered new restrictions on the Eastern Region. However, Executive Order 67 is still in force.    ‘All restaurants, dining establishments, food courts, breweries, microbreweries,  distilleries, wineries, and tasting rooms must close no later than 12:00 a.m.    Indoor dining in restaurants, dining establishments, food courts, breweries, microbreweries, distilleries, wineries, and tasting rooms may not exceed 50% of the lowest occupancy load on the certificate of occupancy.’    Code: 1T      EO 68: https://web.archive.org/web/20200730233349/https://www.governor.virginia.gov/media/governorvirginiagov/executive-actions/EO-68-and-Order-of-Public-Health-Emergency-Eight---Additional-Restrictions-on-the-Eastern-Region-due-to-Novel-Coronavirus-(COVID-19).pdf"
"314","Illinois","US_IL","25-Oct","C2_Workplace.closing",1,"G",1,"G"," Governor Pritzker issued executive order (EO) 2020-62 which placed the most stringent measures yet on a region, Region 1, because it currently has the highest positivity rate in the State with 12%. The EO is effective October 25, 2020.    This included measures such as closing all restaurants and bars from 11 p.m. to 6 a.m., suspending indoor consumption (outdoor only now), customers waiting to be seated must wait off premises, and every group needs to make a reservation, even if onsite, so the restaurant could pass along contact info for contact tracing.     As for other businesses, they are encouraged to work remotely “for as many workers as possible.”     Since businesses are still open, albeit under more limited restriction, I’m leaving as a 1G.    EO 2020-62 for Region 1: https://web.archive.org/web/20201029144653/https://www2.illinois.gov/Pages/Executive-Orders/ExecutiveOrder2020-62.aspx "
