"","RegionName","RegionCode","Date","indicator_type","past_value","past_flag","present_value","present_flag","Notes"
"201","Maryland","US_MD","04-Sep","C2_Workplace.closing",1,"G",1,"G","On September 4, Governor Hogan initiated the start of Phase Three of reopening which allowed for a 75% capacity in retail shops and religious facilities. It also allowed for movie theaters and live entertainment venues to reopen with 50% capacity or a maximum of 100 people if it is indoors, and of 250 people maximum if it is outdoors. There seems to be no restriction on the capacity of manufacturing facilities. Personal services, food and recreational establishments, fitness centers, and gaming facilities remain at 50% capacity.    Montgomery Country and Prince George’s County announced though that they will remain in Phase Two, maintaining the capacity at 50% for all retail establishments, restaurants, manufacturing facilities, fitness centers, and personal services.     Since there are still some state-level notable restrictions on capacity corresponding to a level 1, this indicator was coded as a 1G and not a 1T, even though some targeted areas have more restrictive measures.    See Press Release, Executive Order, and Prince George’s County’s and Montgomery County’s websites, archived:    (Maryland Press Release) https://web.archive.org/web/20200904081721/https://governor.maryland.gov/2020/09/01/governor-hogan-announces-beginning-of-stage-three-of-marylands-covid-19-recovery-additional-safe-and-gradual-reopenings/    (Maryland Executive Order) https://web.archive.org/web/20200904081626/https://governor.maryland.gov/wp-content/uploads/2020/09/Gatherings-12th-AMENDED-9.1.20.pdf    (Prince George’s) https://web.archive.org/web/20200904081831/https://www.princegeorgescountymd.gov/ArchiveCenter/ViewFile/Item/3278 and https://web.archive.org/web/20200904081921/https://www.princegeorgescountymd.gov/3504/County-Phased-Reopening     (Montgomery) https://web.archive.org/web/20200904082230/https://www.montgomerycountymd.gov/covid19/reopening/ "
"202","Maine","US_ME","04-Sep","C2_Workplace.closing",2,"G",2,"G","According to Governor Mills’ reopening plan, spas, massage facilities, barbers, laser hair removal services, and similar personal care and treatment facilities and services were permitted to reopen for business between July and August. It still remains unclear (as of 11th September) whether this has happened yet.     Judging by the Restarting Maine’s Economy webpage, Stage 4 (all businesses open and operating with appropriate safety modifications) has not yet been reached in any regions of the state. However, it is possible that Stage 4 has indeed been reached, and the Restarting Maine website has simply not been updated to reflect this.     Nevertheless, as the reopening of bars for dine-in service has been postponed until further notice (which has not yet been given on 11th September), 2G remains in place.    Source: http://web.archive.org/web/20200909055704/https://www.maine.gov/covid19/restartingmaine"
"203","North Carolina","US_NC","04-Sep","C2_Workplace.closing",2,"G",2,"G","Effective at 5 PM on September 4, North Carolina enters Safer at Home Phase 2.5 per Executive Order No. 163. Businesses including bars, nightclubs, movie theaters, and amusement parks remain closed. Gyms may reopen at 30% capacity, museums may resume operations at 50% capacity, and playgrounds may reopen.     Link:   https://web.archive.org/web/20200905012744/https://twitter.com/NC_Governor/status/1301891531138310145  Executive Order:  https://web.archive.org/web/20200901232718/https://files.nc.gov/governor/documents/files/EO163-New-Phase-2.5.pdf"
"204","North Dakota","US_ND","04-Sep","C2_Workplace.closing",1,"G",1,"T","Gov. Doug Burgum announced changes to the COVID-19 risk levels for 21 of North Dakota’s 53 counties under the ND Smart Restart plan, stressing the need to reverse the state’s upward trend of active coronavirus cases and positive test rate.     Some counties are moving to low risk level (green) to moderate risk level (yellow), others to the ""new normal"" (blue): https://archive.fo/xjrff    ND Smart Restart Plan: https://archive.vn/DgGe3"
"205","New Jersey","US_NJ","04-Sep","C2_Workplace.closing",2,"G",1,"G","""Effective at 6:00 a.m. on September 4, 2020, entertainment  centers where performances are viewed or given, including movie theaters,  performing arts centers, and other concert venues, may open their indoor  spaces to the public""    https://web.archive.org/web/20200904184932/https://nj.gov/infobank/eo/056murphy/pdf/EO-183.pdf"
"206","New York","US_NY","04-Sep","C2_Workplace.closing",2,"G",2,"G","4th September: As of 16th September 2020, all regions of New York are still in Phase IV of reopening, but there has been no further update to the policy on concerts and sports events with fans, therefore 2G remains in place.     Source: http://web.archive.org/web/20200916150233/https://forward.ny.gov/new-york-city-phase-four-industries"
"207","Rhode Island","US_RI","04-Sep","C2_Workplace.closing",2,"G",2,"G","Executive Order still in place. The 60-day renewal period for all existing and new executive orders is suspended till the 2nd of October, 2020. See Executive Order, archived: http://web.archive.org/web/20200910183118/https://governor.ri.gov/documents/orders/Executive-Order-20-72.pdf    ""Working from home is still strongly encouraged when possible. For office-based  businesses, up to 66% of workers may work on site at the same time as long as  physical distancing standards, regulations and other guidance required in Phase III guidelines can be maintained. This guidance also applies to offices that were closed or  operated with a minimal workforce on-site through Phase II within non-office-based  businesses. For any workplace where more than 66% of employees have been  working on site during Phase II, the employer is not required to reduce the number of  staff on site.  14. All office-based businesses must follow state requirements on cleaning, screening  employees, wearing masks, collecting contact tracing information, posting appropriate  signs and notices and other health and safety protocols. Such businesses with  employees returning to work must develop a COVID-19 Control Plan which shall be  available for inspection by the Task Force created by Executive Order 20-32. Officebased businesses must review the guidance applicable to them available at  https://ReopeningRl.com and must also complete a template for COVID-19 Control  Plans available on that website.  Expansion of Retail Businesses  15. All retail businesses with a physical location in Rhode Island may continue to conduct  in-store pickup and limited browsing. All retail businesses may now allow up to one  customer per 100 square feet of store area open to customers generally. A list of  critical and non-critical retail businesses can be found at  https://dbr.ri.gov/documents/DBRCriticalRetailBusinessesList 04032020.pdf.  16. Retail businesses and multi-tenant retail complexes or operations are required to  review the applicable guidance available at https://ReopeningRl.com, regulations set  forth by RIDOH, relevant executive orders and any other law applicable to retail  businesses. All retail businesses must also develop a COVID-19 Control Plan which  shall be available for inspection by the Task Force created by Executive Order 20-32.  A template for COVID-19 Control Plans can be found at https://ReopeningRI.com.""    See executive order 20-67, archived: http://web.archive.org/web/20200829144224/https://governor.ri.gov/documents/orders/Executive-Order-20-67.pdf"
"208","Texas","US_TX","04-Sep","C2_Workplace.closing",2,"G",2,"G","ABC News updates on potential reopening plan announcement: http://web.archive.org/web/*/https://abc13.com/reopening-texas-gov-greg-abbott-coronavirus-bars-in/6406234/"
"209","Utah","US_UT","04-Sep","C2_Workplace.closing",2,"T",1,"G","The governor moved the last orange level counties to yellow on September 4.  All businesses can be open with appropriate hygiene and social distancing measures.  https://web.archive.org/web/20200903211623/https://coronavirus-download.utah.gov/business/Yellow/Utahs_Low_Risk_Phase_Flyer_English.pdf    https://web.archive.org/web/20200910081537/https://coronavirus.utah.gov/governor-issues-executive-order-lowering-restrictions-in-salt-lake-city-and-sevier-county/  "
"210","Colorado","US_CO","05-Sep","C2_Workplace.closing",2,"G",2,"G","The Governor extended the Protect Our Neighbors Executive Order.    Link: https://archive.fo/8MEkD"
"211","Missouri","US_MO","06-Sep","C2_Workplace.closing",1,"T",1,"T","According to a White House Coronavirus Task Force report released Sept. 6, it is recommended that “bars must be closed, and indoor dining must be restricted to 50% of normal capacity in yellow zone and 25% of normal capacity in red zone counties and metro areas.”  https://web.archive.org/web/20200917154000/https://media-cdn.wehco.com//news/documents/2020/09/11/missouri96206060426076.pdf"
"212","Alabama","US_AL","08-Sep","C2_Workplace.closing",2,"T",1,"G","The Mayor of Tuscaloosa partially lifted the order closing bars and lounges, allowing them to reopen at 50% maximum capacity, up to 100 persons. Restaurants that sell alcohol must continue to serve drinks to seated customers only. Because bars were previously required to close and may now reopen, the coding has been downgraded to 1G.    https://web.archive.org/web/20200910195241/https://assets.caboosecms.com/media/7916688_eo-09042020.pdf    https://web.archive.org/web/20200910195914/https://www.tuscaloosa.com/posts/2020/09/05/mayor-maddox-issues-updates-to-executive-order-regarding-bars-and-restaurants"
"213","Florida","US_FL","08-Sep","C2_Workplace.closing",2,"T",2,"T","Palm Beach County (PBC) enacted Emergency Order No. 24 effective on September 8, 2020. This order shall expire upon the expiration of the existing State of Local Emergency. The following establishments are allowed to reopen: bowling alleys, escape rooms, movie theaters, playhouses, restaurants and food establishments including ballrooms and clubhouses; other recreational indoor entertainment venues in an enclosed building. Each establishment is assigned specific reopening criteria including limited patron capacity. Mueseums, libraries, in-store retail, tanning and tattoo salons, massage parlors, and gym and fitness centers are allowed to operate at full capacity.     Bars, auditoriums, concert halls, nightclubs, and arcades remain closed.     Link:  https://web.archive.org/web/20200910180159/https://discover.pbcgov.org/PDF/COVID19/PBC-EO-24.pdf    Code remains as 2T due to continued stringent local policies in other counties and a handful of businesses in PBC remain closed. "
"214","Missouri","US_MO","08-Sep","C2_Workplace.closing",1,"T",1,"T","St. Louis Health Commissioner Order No. 14, in effect Sept. 8, extends the restrictions of the previous Order No. 13. Bars, restaurants, and nightclubs must limit occupancy to 50% and close by 11:00pm. Large venues must also remain at 50% occupancy. The order remains in effect until modified.  https://web.archive.org/web/20200909073629/https://www.stlouis-mo.gov/government/departments/health/communicable-disease/covid-19/orders/health-commissioner-order-14.cfm https://web.archive.org/web/20200819124713/https://www.stlouis-mo.gov/government/departments/health/communicable-disease/covid-19/orders/health-commissioner-order-13.cfm"
"215","Pennsylvania","US_PA","08-Sep","C2_Workplace.closing",2,"G",2,"G","On September 8, Governor Wolf announced that restaurants could increase indoor occupancy to 50 percent, starting September 21. However, to do this, they had to continue complying with the safety protocols and reopening guidance.   Additionally,  restaurants were also expected to self -certify that they are in compliance with official orders.     Link:  http://web.archive.org/web/20200909100149/https://www.governor.pa.gov/newsroom/governor-wolf-announces-restaurants-may-increase-indoor-occupancy-to-50-percent-starting-september-21/ "
"216","South Carolina","US_SC","08-Sep","C2_Workplace.closing",0,NA,0,NA,"On September 8, the SC DHEC launched a new pledge project to further engage the business community in the fight against COVID-19. Business leaders that sign the “Stay SC Strong” pledge will receive a social media graphic announcing their commitment to fight COVID-19, as well as a printable poster reiterating the four major workplace safety measures prescribed by DHEC.     Link:  https://web.archive.org/web/20200910190858/https://www.scdhec.gov/news-releases/dhec-launches-covid-19-pledge-project-south-carolinas-business-community-south"
"217","Missouri","US_MO","09-Sep","C2_Workplace.closing",1,"T",1,"T","On Sept. 9, the City of St. Louis announced that youth sports could resume under some guidelines. They had previously been cancelled out of an abundance of caution. Under the guidelines, no spectators or non-essential visitors are permitted, including parents/guardians.  https://web.archive.org/web/20200910090213/https://www.stlouis-mo.gov/government/departments/health/news/youth-sports-guidelines-announced-september-9-2020.cfm"
"218","New York","US_NY","09-Sep","C2_Workplace.closing",2,"G",2,"G","Governor Cuomo’s announcement of 9th September 2020, stating that dine-in restaurant service will begin again in New York City on 30th September, confirms that dine-in service is still not operational yet in this region at least. As nothing has changed on the ground, 2G remains in place.     Source (Wayback Machine unavailable): https://www.governor.ny.gov/news/governor-cuomo-announces-indoor-dining-new-york-city-allowed-resume-beginning-september-30-25"
"219","Oklahoma","US_OK","09-Sep","C2_Workplace.closing",0,NA,0,NA,"Oklahoma State Department of Health released a revised guidance to support long term care facilities efforts to balance the need to protect residents from COVID-19 and ensure healthy social and emotional connections with family and friends during the pandemic. The revised guidance helps clarify variations between phases two and three for visitations and communal activities.    https://web.archive.org/web/20200916233648/https://www.ok.gov/triton/modules/newsroom/newsroom_article.php?id=150&article_id=61801"
"220","Oregon","US_OR","09-Sep","C2_Workplace.closing",2,"T",2,"T","Due to extensive wildfires in Oregon, thousands of people are evacuating their homes and large swathes of the state are encouraged to stay indoors due to poor air quality, with many businesses are closed. While not a direct policy related to Covid-19, these wildfires may heighten the potential for community spread (ie in evacuation centers) in some areas and dampen it in others as people remain at home due to smoke. https://web.archive.org/web/20200910201902/https://www.oregonlive.com/politics/2020/09/as-oregon-wildfires-burn-gov-kate-brown-holds-briefing-to-update-public-on-fire-damage-firefighting-plans-watch-live-at-1-pm.html"
"221","Alaska","US_AK","10-Sep","C2_Workplace.closing",1,"T",1,"T","Anchorage's Emergency Order EO-14 v2 remains in effect. "
"222","Florida","US_FL","10-Sep","C2_Workplace.closing",2,"T",2,"T","The Coutny Mayor of Miami-Dade County extends the Declaration of a State of Local Emergency for an additional seven days. The extension commences September 10. No change to closure and containment measures is introduced thus the code remains the same.     Link:  https://web.archive.org/web/20200910181215/https://www.miamidade.gov/information/library/09.09.20-state-of-emergency-declaration-extension-27.pdf"
"223","Colorado","US_CO","11-Sep","C2_Workplace.closing",2,"G",2,"G","""Protect Our Neighbors"" policy remains in place. Some sectors, such as bars, are not permitted to reopen."
"224","Louisiana","US_LA","11-Sep","C2_Workplace.closing",2,"G",2,"G","Aug 26 Gov extends phase two restrictions including closure of bars for two weeks in light of Hurricanes Marco and Laura  http://web.archive.org/web/20200903102439/https://www.wsj.com/articles/coronavirus-latest-news-08-26-2020-11598427633    The Governor moves Louisiana to Phase 3 of Resilient Louisiana with effect from September 18th 2020:    https://web.archive.org/web/20200917234431/https://gov.louisiana.gov/assets/Proclamations/2020/123-JBE-2020-COVID-19-Public-Health-Emergency-Phase3-of-Resilient-LA.pdf"
"225","Michigan","US_MI","11-Sep","C2_Workplace.closing",2,"G",2,"G","The governor's executive order on the closure of some sectors is still in place."
"226","North Carolina","US_NC","11-Sep","C2_Workplace.closing",2,"G",2,"G","No changes found after checking relevant resources. "
"227","Rhode Island","US_RI","11-Sep","C2_Workplace.closing",2,"G",2,"G","Previous EO still in place (until 2nd October) and code is retained since retail businesses are still only allowed one customer per 100 sq ft, which is a severe restriction on business.    https://web.archive.org/web/20200918014835/https://reopeningri.com/offices-and-other-business-types "
"228","Virginia","US_VA","11-Sep","C2_Workplace.closing",1,"G",1,"G","In Executive Order 68, the Governor ordered new restrictions on the Eastern Region. However, Executive Order 67 is still in force.    ‘All restaurants, dining establishments, food courts, breweries, microbreweries,  distilleries, wineries, and tasting rooms must close no later than 12:00 a.m.    Indoor dining in restaurants, dining establishments, food courts, breweries, microbreweries, distilleries, wineries, and tasting rooms may not exceed 50% of the lowest occupancy load on the certificate of occupancy.’    Code: 1T      EO 68: https://web.archive.org/web/20200730233349/https://www.governor.virginia.gov/media/governorvirginiagov/executive-actions/EO-68-and-Order-of-Public-Health-Emergency-Eight---Additional-Restrictions-on-the-Eastern-Region-due-to-Novel-Coronavirus-(COVID-19).pdf"
"229","Vermont","US_VT","11-Sep","C2_Workplace.closing",1,"G",1,"G","In Addendum 5 to Amended and Restated Executive Order 01-20, Governor Phil Scott ordered that the State of Emergency for the State of Vermont shall be extended through midnight on October 15, 2020.     The Amended and Restated Executive Order issued June 15, 2020, and all Directives issued thereunder shall continue in full force and effect until then.    All businesses and not-for profit and government entities are therefore encouraged to continue business strategies, procedures and practices to maximize use of online presence, telephone and web-based service delivery and phone or online orders for curb-side pick-up and delivery.    https://web.archive.org/web/20200915145747/https://governor.vermont.gov/sites/scott/files/documents/ADDENDUM%205%20TO%20AMENDED%20AND%20RESTATED%20EXECUTIVE%20ORDER%2001-20_0.pdf"
"230","Washington","US_WA","11-Sep","C2_Workplace.closing",2,"T",2,"T","On September 11 Gov. Jay Inslee announced updated guidance for indoor fitness and training facilities as part of Washington's Safe Start phased reopening plan. ""Indoor fitness and training facilities are allowed to operate in Modified Phase 1 counties under Phase 2 guidance. This means that facilities like gyms, yoga studios, and indoor sports facilities can open for personal fitness and training, group fitness classes, and practice for certain low- and medium-contact sports. Occupancy is limited to ensure proper physical distancing, and masks are required."" (https://web.archive.org/web/20200914212336/https://www.governor.wa.gov/news-media/inslee-updates-indoor-fitness-and-training-facility-guidance)"
"231","Maine","US_ME","12-Sep","C2_Workplace.closing",2,"G",2,"G","As of 17th September, there has been no further update to the Restarting Maine webpage, and no sign of what Stage 4 looks like with regard to workplaces, nor whether any regions have yet entered it. Therefore 2G remains in effect.     Restarting Maine plan: http://web.archive.org/web/20200911115357/https://www.maine.gov/covid19/restartingmaine"
"232","Missouri","US_MO","13-Sep","C2_Workplace.closing",1,"T",1,"T","The Harry S. Truman State Office Building in Jefferson City was temporarily closed starting Sept. 13, as employees have tested positive for Covid-19. Since this is one particular incidence in one office building, coding remains at a 1T.  https://web.archive.org/web/20200917155006/https://abc17news.com/news/2020/09/13/sunday-updates-missouri-passes-102000-covid-19-cases/"
"233","Florida","US_FL","14-Sep","C2_Workplace.closing",2,"T",2,"T","Effective on September 16, Miami-Dade County Emergency Order 29-20 cancels EO 05-20 and EO 21-20. 05-20 and 21-20 were enacted March 18 and April 27 respectively. Emergency Order 29-20 amends restrictions for golf courses, parks, boat ramps, and other outer spaces allowing outer operation of outer amusement and recreational facilities. Private and public golf courses may operate under specified restrictions.    Link:  https://web.archive.org/web/20200921214752/http://www.miamidade.gov/information/library/coronavirus-emergency-order-29-20.pdf"
"234","Mississippi","US_MS","14-Sep","C2_Workplace.closing",1,"G",1,"G","Governor Tate Reeves has extended the Safe Return order till 30th of September. As of this new Safe Return order, businesses may open up to 75% of maximum capacity, with social distancing requirements in place. Gyms may open 24 hours a day. See Executive Order, archived:     https://web.archive.org/web/20200917131018/https://mcusercontent.com/08cb3e52aa1308600f84d49ea/files/749d3f71-0804-4048-b1fe-22064fb9a931/Executive_Order_1522_Safe_Return.pdf"
"235","Georgia","US_GA","15-Sep","C2_Workplace.closing",0,NA,0,NA,"On September 15, Gov Kemp issued Executive Order 09.15.20.01, as an extension of the previous order 08.15.20.01.   ""No business, establishment, corporation, organization or local government shall allow gatherings of 50+ people in a single location if to be present, persons are required to stand or be seated within 6 feet of any other person.""  Hence, workplaces could reopen if they had appropriate safety measures in place.    Links:  http://web.archive.org/web/20200917200045/https://gov.georgia.gov/document/2020-executive-order/09152001/download  http://web.archive.org/web/20200820070830/https://gov.georgia.gov/document/2020-executive-order/08152001/download"
"236","Iowa","US_IA","15-Sep","C2_Workplace.closing",2,"T",2,"T","On September 15th, Governor Kim Reynolds allowed bars and restaurants in Black Hawk, Dallas, Linn, and Polk Counties to reopen, reversing the mandatory closures of bars imposed on August 27th. However, bars in Johnson and Story Counties were still required to close. This proclamation was in effect from today until September 20th.  https://web.archive.org/web/20200916020138/https://governor.iowa.gov/sites/default/files/documents/Public%20Health%20Proclamation%20-%202020.09.15.pdf "
"237","Kentucky","US_KY","15-Sep","C2_Workplace.closing",1,"G",1,"G","Bars are now required to close by midnight with last call at 11pm. They are required to operate at 25% capacity in high-risk counties.    https://web.archive.org/web/20200916041500/https://www.whas11.com/article/news/health/coronavirus/kentucky-coronavirus-covid-19-updates-september-14-week/417-bd89dad0-215f-4b83-9441-1533b49cb16a"
"238","Oregon","US_OR","16-Sep","C2_Workplace.closing",2,"T",2,"T","Oregon's Occupational Safety and Health Division (OSHA) announced on Tuesday, Sept 16 that they ""issued more than $23,000 in fines to two different businesses for engaging in the same hazardous behavior: refusing to carry out proven steps to help protect workers from the coronavirus disease. In separate enforcement actions, the division issued citations to Café 22 West in Salem and Howard’s Pharmacy in Lakeview. The citations resulted from complaint-based inspections. After attempting unsuccessfully to resolve the issues raised in multiple complaints without an enforcement visit, Oregon OSHA initiated worksite inspections. The inspections found both employers willfully failing to implement health hazard control measures – such as face coverings and physical distancing – and continuing to operate in hazardous conditions, despite having been put on notice well before the inspection itself began."" https://web.archive.org/web/20200916224700/https://osha.oregon.gov/news/2020/Pages/nr2020-36.aspx"
"239","Florida","US_FL","17-Sep","C2_Workplace.closing",2,"T",2,"T","Miami-Dade County extends its State of Emergency on September 17 for another 7 days. No changes have been made to closure/containment measures.    Link:  https://web.archive.org/web/20200922162011/https://www.miamidade.gov/information/library/09.16.20-state-of-emergency-declaration-extension-28.pdf"
"240","Massachusetts","US_MA","17-Sep","C2_Workplace.closing",2,"G",2,"G","Arcades in Massachusetts were given a go-ahead to reopen starting Thursday, Sept 17.    Earlier, arcade owners have expressed their concerns with the restrictions. On Aug. 27, Pintz Entertainment in Milford said it was “deeply disappointed” with Baker’s restrictions on arcades, claiming the state was basing who could reopen on potential tax revenue.  “Picking winners and losers based on potential tax revenue to the state is hugely unfair to small business,” the company wrote. “To this day our arcade remains closed but casinos, which offer essentially the same kind of gaming experience are open.”    https://web.archive.org/web/20200924190706/https://www.masslive.com/business/2020/09/massachusetts-to-let-arcades-reopen-next-week-gov-charlie-baker-says.html"
