"","RegionName","RegionCode","Date","indicator_type","past_value","past_flag","present_value","present_flag","Notes"
"1","Alaska","US_AK","31-Aug","C1_School.closing",3,"T",3,"T","The Fairbanks North Star Borough School District announced that it is moving to the “red zone,” or high-risk level, of its coronavirus mitigation plan. That means it will have distance learning classes only, school buildings are closed to students and all sports events are canceled.    The change was effective as of 4 p.m. 31 August 2020.    http://web.archive.org/web/20200903203000/https://www.adn.com/alaska-news/2020/08/31/after-hitting-covid-19-red-zone-fairbanks-schools-move-to-all-distance-learning-and-halt-sports-events/"
"2","Connecticut","US_CT","31-Aug","C1_School.closing",2,"G",2,"T","With the first K-12 schools reopening on 31 August at the discretion of school boards, and with universities having already reopened, code moves down to 2T.    http://web.archive.org/web/20200911141614/https://www.courant.com/coronavirus/hc-news-coronavirus-back-to-school-20200831-q3exgcl3a5hudn5u7il7f4ssym-story.html"
"3","Florida","US_FL","31-Aug","C1_School.closing",1,"G",0,NA,"Hillsborough County Public Schools reopening: eLearning beginning August 24th, in-person classes begin August 31st for those who decided to start in-person classes/traditional learning.  Link:  https://web.archive.org/web/20200817030100/https://hillsboroughschools.org/docs/00/00/27/19/fa_hcps_reopening_plan_r.pdf    Gov. DeSantis administration's emergency order (DOE ORDER NO. 2020-E0-06, issued July 6) requires most school districts in Florida ""to open their campuses five days a week by Aug. 31 or face a significant loss in state aid"". Miami-Dade, Broward County, and Palm Beach County school districts are permitted to remian closed as coronavirus cases continue to rise these areas and to begin virtual instruction only.   Link:   https://web.archive.org/web/20200902135505/https://blogs.edweek.org/edweek/school_law/2020/08/florida_school_reopening_date_.html    Coded as 0 as school districts are required to resume face-to-face instruction and reopen schools aside from a few exceptions. "
"4","Louisiana","US_LA","31-Aug","C1_School.closing",2,"T",2,"T","Jefferson Parish Schools, the largest school district in Louisiana, held its first day of classes under a hybrid system on August 31.  https://web.archive.org/web/20200909074739/https://www.jpschools.org/Page/4048 https://web.archive.org/web/20200909075030/https://www.jpschools.org/cms/lib/LA50000440/Centricity/Domain/1164/Start%20Strong%20Jefferson%20One-Pager%207.20.20.pdf"
"5","Maryland","US_MD","31-Aug","C1_School.closing",3,"T",2,"G","""On August 24, the President of the University of Maryland, College Park, Darryll J. Pine announced that classes will be held in person and that the campus and residence halls will be open during the 2020-2021 academic year. COVID-19 safety measures will be in place (physical distancing, face-covering indoors and outdoors when others are nearby) and the occupancy of residence halls will be reduced. Metrics will be tracked on campus and the “decision to continue to offer on-campus social opportunities will rest on a number of key factors” detailed in the President’s message. See President’s message, archived: https://web.archive.org/web/20200827235848/https://umd.edu/virusinfo/emails/082420""    The University of Maryland opened August 31, as did several other public colleges and universities, warranting the change from a 2T. However, all identified school districts remain closed (the state's largest district began on August 31 with online courses), coded as a 2G.    https://web.archive.org/web/20200902002847/https://www.baltimoresun.com/coronavirus/bs-md-college-reopenings-20200618-khsfbvay7vbijhgx7mf7regeda-story.html    https://web.archive.org/web/20200902003647/http://www.marylandpublicschools.org/about/Pages/School-Systems/OpenClosingDates.aspx      "
"6","Michigan","US_MI","31-Aug","C1_School.closing",3,"G",2,"G","By August 31, several major public universities including the University of Michigan, Central Michigan University, and Eastern Michigan University had all reopened for in person courses.    https://web.archive.org/web/20200902222349/https://www.michiganradio.org/post/heres-how-michigan-universities-plan-reopen-fall    Since public universities reopened and K-12 previously indicated as closed until September, coded as a 2G. "
"7","Minnesota","US_MN","31-Aug","C1_School.closing",3,"T",3,"T","On August 31st, University of Minnesota Duluth started the Fall 2020 semester with remote learning until September 14th. On September 14th, the university would switch to a hybrid model. Each university department would determine whether the classes would be conducted in-person, online, or a combination of the two. Students, faculty members, and staffs were required to wear a mask in any campus building.   https://web.archive.org/web/20200920103643/https://safe-campus.d.umn.edu/ https://web.archive.org/web/20200904075543/https://safe-campus.d.umn.edu/covid-faqs  "
"8","Missouri","US_MO","31-Aug","C1_School.closing",2,"T",2,"T","St. Louis City Public Schools began classes on Aug. 31. Options for students include virtual at home instruction, instructional support centers with limited numbers of students per site, and an online self-guided course.  https://archive.fo/m1ACi  Missouri schools & universities report more Covid-19 cases on Aug. 31.  https://archive.fo/I1tlR  A staff member at a Jefferson County high school has tested positive for the coronavirus, reported on Aug. 31.  https://archive.fo/QfSoO"
"9","New York","US_NY","31-Aug","C1_School.closing",3,"T",2,"G","By August 31, the majority of 64 CUNY campuses (NY's public university and college system) opened for some in-person instruction. This includes the largest CUNY campuses, including University of Buffalo. Code thus downgrades to 2G, as all k-12 school districts identified remain closed.    https://www.democratandchronicle.com/story/news/politics/albany/2020/08/10/suny-opening-schedule-new-york-colleges/3329235001/    https://archive.fo/5Sx4U    https://web.archive.org/web/20200904174123/https://www.buffalo.edu/coronavirus/return-to-campus-updates/previewing-the-fall-semester.html    "
"10","Pennsylvania","US_PA","31-Aug","C1_School.closing",2,"T",2,"T","On August 31, Bloomsburg University announced a shift towards online learning.   The official announcement stated: ""Effective immediately, all clubs and organizations have to suspend all in-person activities. They may continue to hold meetings 100% virtually. ""    Meanwhile, the Student Health Centre would remain open and students on-campus will not be required to leave their residence halls while BU Residence Life staff members and community assistants will be providing them with all guidance and support.     Link to official release:  http://web.archive.org/web/20200902032041/https://archive.bloomu.edu/news-releases/20-08-27"
"11","Tennessee","US_TN","31-Aug","C1_School.closing",2,"T",2,"T","8/31/2020  Shelby County (Memphis) schools began conducting online/virtual classes.     SC PS source:  https://web.archive.org/web/20200903181106/http://www.scsk12.org/backtoschool/"
"12","Virginia","US_VA","31-Aug","C1_School.closing",2,"G",2,"G","Major public universities are reopening:    James Madison University begins on August 26.   https://web.archive.org/web/20200830025140/https://www.jmu.edu/registrar/_files/academic-calendar.pdf    University of Richmond reopened on August 24 with a phased approach that offers guidance on distancing, cleaning, travel restrictions, and more. Face coverings are required and will be handed out to students  https://web.archive.org/web/20200830023711/https://www.richmond.edu/coronavirus/  Phases:  https://web.archive.org/web/20200830024325/https://www.richmond.edu/coronavirus/_common/physical-distancing-framework.pdf    George Mason reopened with a hybrid model of in-person and online learning August 24.     https://web.archive.org/web/20200828223500/https://www2.gmu.edu/Safe-Return-Campus      UVA had previously delayed the start of in person classes until September 8 (from August 25.    https://web.archive.org/web/20200830023453/https://news.virginia.edu/content/uva-delays-person-instruction-move-undergraduates-two-weeks)  "
"13","Wisconsin","US_WI","31-Aug","C1_School.closing",3,"T",3,"T","On August 31st, Madison Area Technical College started the Fall 2020 semester with a hybrid style learning.   https://web.archive.org/web/20200903085745/https://madisoncollege.edu/covid "
"14","Louisiana","US_LA","01-Sep","C1_School.closing",2,"T",2,"T","On Sept. 1, the Louisiana State Health Officer signed an emergency order effective immediately requiring all Louisiana schools, whether public or private, to report all known or suspected cases of Covid-19 among students and staff to the Louisiana Department of Health’s electronic reporting system.  https://web.archive.org/web/20200910095056/https://ldh.la.gov/assets/oph/Coronavirus/resources/k-12/EmergencyOrder-SchoolReporting-Data-SharingOrder2020.pdf  On Sept. 1, East Baton Rouge Public School District announced that students could choose to return to school under a hybrid learning model starting Sept. 14. Learning has been all-online since Aug. 10, the first day of classes.  https://web.archive.org/web/20200909075456/https://ebrschools.org/wp-content/uploads/2020/09/Hybrid-Transition-Announcement-PreK-5-1.pdf"
"15","Massachusetts","US_MA","01-Sep","C1_School.closing",3,"T",2,"T","Under current guidelines in Phase 3 of Massachusetts' reopening plan, higher education institutions may allow individuals to return to campus in line with strict protocols for certain activities. While UMass Amherst opened on Aug 24, others started reopening for (limited) face-to-face learning options on Sept 1. (Tufts and Northeastern are scheduled to open on Sept 8 with protocols to minimize density, test incoming students, and ensure stringent safety measures)    (At this point, K-12 schools/school districts were requested to submit their reopening plans to the government. Details follow in note for Sept 9)    *Harvard*  Harvard opened up with the academic year commencing on Sept 1, with reduced capacity, and mandatory mask requirements. Students are requested to comply with protocol detailing observed testing and unobserved self-administered testing.    https://web.archive.org/web/20200907150903/https://www.harvard.edu/coronavirus/testing-tracing    *UMass Dartmouth*  Academic year commences on Sept 1.   All students who visit campus are required to complete a COVID-19 test. Faculty who are teaching face to face or conducting research on campus are being offered tests weekly. It is also recommended that staff who regularly work on campus be tested on a weekly basis.  Although some campus facilities will be available to non-residential students, these facilities will operate at very limited capacity, and in certain cases, access may be restricted. The campus requires the use of face coverings on campus. Simply put, if you are around other people indoors or outdoors, you need to cover your nose and mouth.  https://web.archive.org/web/20200911081812/https://www.umassd.edu/media/umassdartmouth/news/2020/UMassD-Fall-2020-Re-Opening-Plan.pdf    *UMass Lowell*  UMass Lowell plans to resume on-campus teaching, learning, research and campus life operations for the Fall 2020 semester. Tentatively, classes begin on Sept 1.    All residential students will live on East Campus in single rooms and will still be tested weekly for COVID-19. Select cohorts of commuter students and faculty and staff who frequently interact with others on campus also will be tested weekly.     Facilities which need to accommodate classes will be open and limited transportation services will be available. Library resources and most student support services will be offered virtually.   https://web.archive.org/web/20200911082254/https://www.uml.edu/alert/coronavirus/returning/default.aspx    *MIT*  Classes begin on Sept 1. From August 29 through September 7, all students arriving to live on campus will have to self-quarantine while taking their classes online. During Quarantine Week, resident's bedroom doors must remain closed. They can leave the building for about an hour to exercise each day, wearing your face covering the entire time.  https://web.archive.org/web/20200911082948/https://now.mit.edu/undergraduate-students/      *Boston College*  Classes began on August 31 with a mix of in-class, online, and hybrid courses during the fall semester. Their reopening efforts range from extensive cleaning and sanitization efforts to mandatory testing, daily symptoms monitoring, and contact tracing. Mandatory testing is required for all members of the community who plan to be on campus. BC contracted with The Broad Institute for COVID-19 testing, and the firm CoVerified for an app to schedule testing appointments and provide daily self-health checks.  https://web.archive.org/web/20200911085612/https://www.bc.edu/content/bc-web/sites/reopening-boston-college/bc-updates/updates/fall-update-aug-11.html  "
"16","Michigan","US_MI","01-Sep","C1_School.closing",2,"G",2,"T","District schools are planning school re-openings based on the Safe Schools Roadmap, taking effect starting in September. http://web.archive.org/web/20200829132829/https://www.michigan.gov/documents/whitmer/MI_Safe_Schools_Roadmap_FINAL_695392_7.pdf  Most re-openings are planned for September, 2020.  https://web.archive.org/web/20200820213401/https://www.bridgemi.com/talent-education/michigan-school-reopening-tracker-find-out-if-your-district-starting-person-or    Michigan is on its fourth stage of safe school reopening. They have adopted in person instruction and commencement of school sports with strict adherence to the use of face covering. However, there has been a move to suspend in person opening due to covid 19 outbreak in colleges and high schools.    https://web.archive.org/web/20200911200249/https://www.clickondetroit.com/news/local/2020/09/10/gov-whitmer-warns-michigan-will-have-to-take-steps-backward-if-covid-19-numbers-spike/    https://www.michigan.gov/documents/whitmer/MI_Safe_Schools_Roadmap_FINAL_695392_7.pdf "
"17","New Jersey","US_NJ","01-Sep","C1_School.closing",3,"T",3,"T","The universities beginning on Sept 1, began remote instruction. Kean, e.g. has stated that on Monday, September 21, the University will enter a face-to-face and hybrid phase, adding on-campus instruction to approximately 22 percent of courses (https://archive.today/wWPMz).    Montclair state university begins August 25  https://web.archive.org/web/20200905191420/https://www.montclair.edu/student-services/important-dates/    Rutgers New Brunswick begins Sept. 1    https://web.archive.org/web/20200905191333/https://scheduling.rutgers.edu/scheduling/academic-calendar    Kean begins Sept. 1  https://web.archive.org/web/20200905191320/https://www.kean.edu/return-campus/frequently-asked-questions    The College of New Jersey plans for a fully remote fall semester  https://web.archive.org/web/20200905191508/https://fall2020.tcnj.edu/academics/        ""School begins in September and many school districts are planning to begin the school year online.     ""Schools may reopen for in-person instruction this fall.  Every school must reopen in accordance with the health and safety guidelines outlined in the State's reopening guidance, but this is a challenge for many school districts.  If a district can't meet the standards currently, these districts can begin the school year via remote-only instruction until they can meet health and safety standards. They must also submit a plan and timeline for when they can meet these standards.""    https://web.archive.org/web/20200828035312/https://covid19.nj.gov/faqs/nj-information/reopening-guidance-and-restrictions/will-schools-open-next-year-is-summer-school-open"""
"18","New York","US_NY","01-Sep","C1_School.closing",2,"G",2,"G","Syracuse school district, New York City school district, Brentwood Free School district all described as opening Sept 1 or later for in person instruction. Because this is in line with typical New York State school years (generally beginning after Labor Day), coded as a 2G (though note to future coder, would expect a very quick shift to a 2T).    http://www.syracusecityschools.com/reopening    https://web.archive.org/web/20200904175335/https://www.newsday.com/long-island/education/li-schools-coronavirus-reopening-plans-1.48215633    ""The reopening of New York City’s public schools for in-person teaching will be delayed until 21st September, Mayor Bill de Blasio announced on 1st September. Therefore 3T remains in place. Source (Wayback Machine unavailable): https://www1.nyc.gov/office-of-the-mayor/news/627-20/mayor-de-blasio-chancellor-carranza-labor-reach-agreement-reopen-new-york-city-schools#/0"""
"19","Oregon","US_OR","01-Sep","C1_School.closing",3,"T",3,"T","On September 1 all public universities and colleges were required to submit reopening plans to the state (Higher Education Coordinating Commission). A lisst of all Oregon university and college resumption plans can be found here: https://web.archive.org/web/20200902020221/https://www.oregon.gov/highered/about/Pages/COVID-19-institution-websites.aspx  https://web.archive.org/web/20200902011133/https://www.statesmanjournal.com/story/news/2020/08/31/icymi-university-oregon-covid-return-to-campus-fall-announcements/5665337002/"
"20","Pennsylvania","US_PA","01-Sep","C1_School.closing",2,"T",2,"T","On September 1, University of Pennsylvania is starting the Fall Semester with in-person instruction offered until the beginning of Thanksgiving Break in November, after which the semester will transition to virtual instruction.     To prevent crowding, student arrivals will be staggered.   Further, Undergraduate students will not be accomodated in University housing, with a few on-campus housing exceptions for international students and students facing financial hardship.     Links:   https://web.archive.org/web/20200829161302/https://fall-2020-planning.upenn.edu/content/fall-semester-calendar  https://web.archive.org/web/20200812155143/https://fall-2020-planning.upenn.edu/announcement/revision-fall-semester-plans-regarding-campus-housing-tuition-and-fees  "
"21","South Carolina","US_SC","01-Sep","C1_School.closing",2,"T",2,"T","South Carolina DHEC announces the department will begin rolling out twice-weekly reports on the number of COVID-19 cases associated with staff and students at public and private schools in the state. Specifically, kindergarten through 12th grade students are included. Only students and staff who physically attend school on a regular basis will be included in the counts.     Link:  https://web.archive.org/web/20200901204905/https://www.scdhec.gov/news-releases/dhec-begins-providing-k-12-cases-covid-19-school-south-carolina-announces-latest"
"22","Texas","US_TX","01-Sep","C1_School.closing",2,"T",2,"T","K -12 schools are mostly still closed to in- person learning at this time, with plans to continue virtual learning or welcome students back in person within the next few weeks.     Houston school plans:   https://archive.fo/QogiZ    San Antonio school plans:   http://web.archive.org/web/20200905115235/https://www.ksat.com/news/local/2020/08/11/what-we-know-about-reopening-schools-in-san-antonio-right-now/    Austin school reopening:   http://web.archive.org/web/20200905115619/https://www.fox7austin.com/news/austin-isd-releases-reopening-plans-for-the-new-school-year"
"23","Wisconsin","US_WI","01-Sep","C1_School.closing",3,"T",3,"T","On September 1st, Waukesha School District began its first day of school with hybrid-style learning. Elementary school students would receive in-person instruction, while secondary school students would receive both in-person and virtual instruction. Students over the age of 5 and staffs were required to wear a face covering.  School calendar: http://web.archive.org/web/20200918034107/https://sdw.waukesha.k12.wi.us/Page/2   Learning method: http://web.archive.org/web/20200918034457/https://www.jsonline.com/story/communities/lake-country/news/2020/07/07/coronavirus-mps-and-other-milwaukee-waukesha-schools-announce-plans/5363867002/   COVID-19 measures: http://web.archive.org/web/20200918034856/https://www.waukeshacounty.gov/HealthAndHumanServices/PublicHealth/public-health-preparedness/COVID19/safeschools/safeschoolsguidelines/ "
"24","Illinois","US_IL","02-Sep","C1_School.closing",3,"T",3,"T","No code change, but making a note -- The University of Illinois Urbana-Champaign is still open in-person but Chancellor Jones asked undergraduate students to “significantly restrict in-person activities” from 2 September though 16 September after experts recently noticed “a concerning upward trend of positive COVID-19 cases among undergraduate students.”     https://web.archive.org/web/20200916170912/https://covid19.illinois.edu/updates/massmail-increased-undergraduate-enforcement-of-covid-19-safety-guidelines/ "
"25","Indiana","US_IN","02-Sep","C1_School.closing",2,"T",2,"T","9/2/2020  Notre Dame University began to reintroduce in-person classes after a two week closure that began on Aug. 18th due to spikes in COVID-19 cases.    ND source: https://web.archive.org/web/20200910215926/https://news.nd.edu/news/notre-dame-enacts-two-weeks-of-remote-instruction/"
"26","Missouri","US_MO","02-Sep","C1_School.closing",2,"T",2,"T","On Sept. 2, it was reported that University of Missouri Columbia’s administration is “threatening to discipline students for violations such as refusing to wear masks, gathering in large groups and other actions that could hasten the spread of the virus...Violators face punishments ranging from a verbal reprimand to suspension or expulsion.”  https://archive.fo/O8XCo"
"27","Wisconsin","US_WI","02-Sep","C1_School.closing",3,"T",2,"T","UW-Madison, UW-Milwaukee, and UW-Whitewater started the 2020 Fall semester on September 2nd. While UW-Milwaukee and UW-Whitewater implemented a hybrid learning method, the majority of the courses at UW-Madison was delivered in-person.   Because four out of five largest colleges (UW-Madison, UW-Milwaukee, Madison Area Technical College, and Milwaukee Area Technical College) in Wisconsin had reopen, the school closure policy was coded as 2T.  UW-Madison: http://web.archive.org/web/20200803043817/https://smartrestart.wisc.edu/plan/ UW-Milwaukee: http://web.archive.org/web/20200817184721/https://uwm.edu/coronavirus/reopening/ UW-Whitewater: https://web.archive.org/web/20200903080342/https://www.uww.edu/warhawks-return     Public Health Officer of Madison and Dane County Janel Heinrich issued an amendement to Emergency Order #9. The amendment allowed students with a disability or students enrolled in the Individualized Education Program (IEP) to attend classes in-person. The new amendment became effective on September 2, 2020.   https://web.archive.org/web/20200910025939/https://publichealthmdc.com/documents/2020-09-01_Order_9amendment.pdf "
"28","Idaho","US_ID","03-Sep","C1_School.closing",2,"T",2,"T","Boise school district is preparing for a phased in person opening beginning September 21.  https://web.archive.org/web/20200908134554/https://www.boiseschools.org/news/what_s_new/phased_reopening_draft_plan_announced"
"29","Missouri","US_MO","03-Sep","C1_School.closing",2,"T",2,"T","On Sept. 3, Gov. Mike Parson announced that over 7,000 college-age people in Missouri have tested positive for the coronavirus since classes began in mid-August.  https://web.archive.org/web/20200909073451/https://www.ky3.com/2020/09/03/7000-plus-missouri-college-students-have-tested-positive-for-covid-19-parson-says/"
"30","Mississippi","US_MS","03-Sep","C1_School.closing",2,"T",2,"T","Some schools had to be closed due to a spike in COVID19 cases within. However, most schools are allowed to commence as planned.    See News Article, archived: http://web.archive.org/web/20200910132813/https://mississippitoday.org/2020/08/19/covid-19-outbreak-closes-mississippi-elementary-school-just-one-week-after-it-reopened/"
"31","Montana","US_MT","03-Sep","C1_School.closing",0,NA,0,NA,"In support of previous coding,  EdWeek's school tracker recorded the following MT districts as being open for in person instruction at the given start dates. As EdWeek's tracker covers the largest districts, this supports that schools are widely reopened in Montana.    Billings Elem	MT	11,453 Full in-person reopening available for all students	08/24/2020	    Billings H S	MT	5,505 Full in-person reopening available for all students	08/24/2020    Bozeman Elementary	MT	4,763	Hybrid/Partial	09/08/2020		    Bozeman High School	MT	2,204 Hybrid/Partial	09/08/2020    Glasgow K-12 Schools	MT	Full in-person reopening available for all students	08/26/2020    Baker K-12 Schools	MT	Full in-person reopening available for all students	08/20/2020    https://www.edweek.org/ew/section/multimedia/school-districts-reopening-plans-a-snapshot.html    https://web.archive.org/web/20200906014803/https://www.bsd7.org/district_news/re-entry_plan    https://web.archive.org/web/20200906015004/https://www.baker.k12.mt.us/districtNewsArticles.aspx"
