"","RegionName","RegionCode","Date","indicator_type","past_value","past_flag","present_value","present_flag","Notes"
"1102","Nebraska","US_NE","01-Oct","H1_Public.information.campaigns",1,"G",1,"G","On October 1, the Nebraska of Health and Human Services published the ollowing 7 tips are adapted from The American Psychological Association (“Check Out the Stress Tip Sheet,” 2018) to support individuals with a stress management plan:  Understand your stress: How do you stress? It can be different for everybody. By understanding what stress looks like for you, you can be better prepared, and reach for your stress management toolbox when needed.  Identify your stress sources: What causes you to be stressed? Be it work, family, change or any of the other potential thousand triggers.  Learn to recognize stress signals: We all process stress differently so it’s important to be aware of your individual stress symptoms. What are your internal alarm bells? Low tolerance, headaches, stomach pains or a combination?  Recognize your stress strategies: What is your go-to tactic for calming down? These can be behaviors learned over years and sometimes aren’t the healthy option. For example, some people cope with stress by self-medicating with alcohol or overeating.  Implement healthy stress management strategies: It’s good to be mindful of any current unhealthy coping behaviors so you can switch them out for a healthy option. For example, if overeating is your current go to, you could practice meditation instead, or make a decision to phone a friend to chat through your situation. The American Psychological Association suggest that switching out one behavior at a time is most effective in creating positive change.  Make self-care a priority: When we make time for ourselves, we put our well-being before others. This can feel selfish to start, but it is like the airplane analogy—we must put our own oxygen mask on before we can assist others. The simplest things that promote well-being, such as enough sleep, food, downtime, and exercise are often the ones overlooked.Self-care is group-care.   Ask for support when needed: If you’re feeling overwhelmed, reach out to a friend or family member you can talk to. Speaking with a healthcare professional can also reduce stress, and help us learn healthier coping strategies.    See the Nebraska Department of Health and Human Services website, archived: https://web.archive.org/web/20201005135100/http://dhhs.ne.gov/Pages/Kindness-and-Support-to-Counter-Frustration-and-Stress-During-the-COVID-19-Pandemic.aspx"
"1103","Oregon","US_OR","01-Oct","H1_Public.information.campaigns",2,"G",2,"G","The state has a collection of public health social media templates available online: https://web.archive.org/web/20201006183514/https://govstatus.egov.com/or-covid-19-social-media-toolkits"
"1104","Wisconsin","US_WI","01-Oct","H1_Public.information.campaigns",2,"G",2,"G","As of October 1st, Wisconsin Department of Health Services still coordinated public information campaign across traditional and social media.  PBS, Wisconsin Public Radio: https://web.archive.org/web/20201021043018/https://www.wiscontext.org/wisconsins-urgent-imperfect-transparent-confusing-essential-covid-19-data  Twitter: https://archive.fo/m65W6 "
"1105","Arizona","US_AZ","02-Oct","H1_Public.information.campaigns",2,"G",2,"G","No policy change noted."
"1106","Colorado","US_CO","02-Oct","H1_Public.information.campaigns",2,"G",2,"G","Previous policy still in place."
"1107","Delaware","US_DE","02-Oct","H1_Public.information.campaigns",2,"G",1,"G","Effective October 2, 2020 Delaware DPH issued recommendations and guidance for Halloween.     https://web.archive.org/web/20201027211315/https://coronavirus.delaware.gov/wp-content/uploads/sites/177/2020/10/COVID-19-Halloween-Guidance_DPH_100120.pdf    "
"1108","Louisiana","US_LA","02-Oct","H1_Public.information.campaigns",2,"G",2,"G","The Office of the Governor's website and Louisiana Department of Health websites include a COVID19 resource section with news reports, executive orders, contacts and additional resources regarding COVID-19. The Governor's Twitter account also has COVID-19 information. See Official website, archived: https://web.archive.org/web/20200813074341/https://coronavirus.la.gov/  See LDH link: https://web.archive.org/web/20200813074244/https://ldh.la.gov/Coronavirus/  See Twitter link: https://web.archive.org/web/20200813074151/https://twitter.com/LouisianaGov"
"1109","Maine","US_ME","02-Oct","H1_Public.information.campaigns",2,"G",2,"G","It appears that Maine Department of Health and Human Services' ‘Keep It Maine’ public health campaign is ongoing as of 8th October, therefore 2G remains the most appropriate level for this indicator.    Sources:  http://web.archive.org/web/20200716173700/https://www.wagmtv.com/content/news/Maine-DHHS-Launches-Keep-It-Maine-Campaign-to-Promote-Public-Health-Measures-That-Limit-the-Spread-of-COVID-19-570956981.html    http://web.archive.org/web/20200728104943/https://www.maine.gov/dhhs/documents/KeepItMaine.pdf"
"1110","New Hampshire","US_NH","02-Oct","H1_Public.information.campaigns",2,"G",2,"G","New Hampshire mobilizes 211NH to handle all coronavirus-related calls from NH residents.     '""211NH will serve as a coordinated and streamlined process for any Granite Stater concerned about the coronavirus,"" said Governor Chris Sununu. ""Now that it is up and running, any New Hampshire residents can call with questions or concerns. I would like to thank the folks at Granite United Way and Public Health for working around the clock to stay on top of this evolving public health situation by making this critical resource available 24/7.""'    https://web.archive.org/web/20200716211316/https://www.governor.nh.gov/news-and-media/state-launches-2-1-1-covid-19-hotline"
"1111","New Jersey","US_NJ","02-Oct","H1_Public.information.campaigns",2,"G",2,"G","No change: ""Mask Up, New Jersey!""    https://web.archive.org/save/https://www.nj.gov/dep/maskup/"
"1112","New York","US_NY","02-Oct","H1_Public.information.campaigns",2,"G",2,"G","Again, New York's continuing public health campaign about COVID-19 can be seen in the state's Twitter page's profile picture and header image (linked below).     http://web.archive.org/web/20201008223300/https://twitter.com/NYGov?ref_src=twsrc%5Egoogle%7Ctwcamp%5Eserp%7Ctwgr%5Eauthor"
"1113","Virginia","US_VA","02-Oct","H1_Public.information.campaigns",2,"G",2,"G","On April 27th, Virginia Department of Health launched a new COVID-19 informational website, followed by ""COVID-19 Virginia Resources"" app on the next day. The website provided the latest COVID-19 data, symptom checker, recommendations, and other useful information.    Website announcement: http://web.archive.org/web/20200803035753/https://www.vdh.virginia.gov/news/2020-news-releases/virginia-department-of-health-launches-new-covid-19-you-web-page-tool/     App announcement: http://web.archive.org/web/20200803041056/https://twitter.com/VDSS/status/1255154067791364096     Website: http://web.archive.org/web/20200803041748/https://www.vdh.virginia.gov/coronavirus/ "
"1114","Washington","US_WA","02-Oct","H1_Public.information.campaigns",2,"G",2,"G","Public health toolkit is available from the Washington State Coronavirus Response website https://web.archive.org/web/20201006231225/https://www.coronavirus.wa.gov/partner-toolkit"
"1115","Minnesota","US_MN","03-Oct","H1_Public.information.campaigns",2,"G",2,"G","No policy change noted."
"1116","Nebraska","US_NE","03-Oct","H1_Public.information.campaigns",1,"G",1,"G","On October 2, the Department of Health and Human Services continue to take preventive action to limit the spread.     Wear a mask – The Centers for Disease Control and Prevention (CDC) offers tips on how to select, wear and clean a reusable mask - https://www.cdc.gov/coronavirus/2019-ncov/prevent-getting-sick/about-face-coverings.html   Watch your distance and avoid crowded places - https://www.cdc.gov/coronavirus/2019-ncov/prevent-getting-sick/social-distancing.html    Wash your hands - https://www.cdc.gov/handwashing/when-how-handwashing.html   Know your risk - https://www.nebraskamed.com/COVID/7-steps-to-identify-risky-covid-19-situations   Stay home - if sick or if you've been exposed to COVID-19 to help protect others and prevent larger outbreaks - https://www.cdc.gov/coronavirus/2019-ncov/if-you-are-sick/index.html  and https://www.cdc.gov/coronavirus/2019-ncov/if-you-are-sick/quarantine.html   Get tested - if you've been exposed or have symptoms via TestNebraska.com  or TestNebraska.com/es  for Spanish, or another testing site in your community.     See the Department of Health and Human Services website, archived: https://web.archive.org/web/20201005133149/http://dhhs.ne.gov/Pages/DHHS-Friday-COVID-19-Update-10022020.aspx  "
"1117","Nebraska","US_NE","06-Oct","H1_Public.information.campaigns",1,"G",2,"T","On October 6, As Mental Health Awareness Week – October 4-10 – is observed, the Nebraska Department of Health and Human Services (DHHS) urges Nebraskans to check in on their mental health    See the Department of Health and Human Services website, archived: https://web.archive.org/web/20201009011825/http://dhhs.ne.gov/Pages/Mental-Health-Awareness-Week-Highlights-Help-and-Hope.aspx"
"1118","South Dakota","US_SD","06-Oct","H1_Public.information.campaigns",1,"G",1,"G","No major changes/efforts have been made to strengthen public campaigns for prevention/mitigation of COVID-19. "
"1119","Alaska","US_AK","07-Oct","H1_Public.information.campaigns",2,"G",2,"G","No changes detected in this indicator - Alaska's COVID-19 website remains live.    https://web.archive.org/web/20201007210525/https://covid19.alaska.gov/"
"1120","Massachusetts","US_MA","07-Oct","H1_Public.information.campaigns",2,"G",2,"G","With Halloween around the corner, the Commonwealth has initiated efforts to contain the virus during gatherings.     For residents planning to celebrate Halloween, the Massachusetts Department of Public Health (DPH) today provided safety tips to help limit the risk of exposure to COVID-19. DPH is also reminding residents and communities to be aware that Halloween activities are subject to the current state gathering size limits as well as applicable sector-specific workplace safety standards.    https://web.archive.org/web/20201008185406/https://www.mass.gov/news/state-public-health-officials-offer-tips-for-a-safe-and-healthy-halloween    A COVID-19 Vaccine Advisory Group to advance its efforts to prepare to distribute a safe and effective COVID-19 vaccine once it becomes available. Comprised of medical professionals, public health experts, elected officials, community leaders and infectious disease specialists, the COVID-19 Vaccine Advisory Group will advise the Administration, including the Massachusetts Department of Public Health (DPH) and the COVID-19 Command Center, on communication, distribution, and equity issues relating to a COVID-19 vaccine.    https://web.archive.org/web/20201008185750/https://www.mass.gov/news/baker-polito-administration-announces-covid-19-vaccine-advisory-group"
"1121","Vermont","US_VT","07-Oct","H1_Public.information.campaigns",2,"G",2,"G","No changes detected in this indicator. Vermont COVID-19 website remains live.    https://web.archive.org/web/20201007214136/https://www.healthvermont.gov/response/coronavirus-covid-19"
"1122","Alabama","US_AL","09-Oct","H1_Public.information.campaigns",2,"G",2,"G","The State Health Department continues to maintain a coordinated information campaign on its website. The altogetheralabama.com website created by the Governor's office continues to be updated and provide resources to individuals and businesses."
"1123","Arizona","US_AZ","09-Oct","H1_Public.information.campaigns",2,"G",2,"G","No policy change noted."
"1124","Massachusetts","US_MA","09-Oct","H1_Public.information.campaigns",2,"G",2,"G","No change to the halloween guidance from the MA Dept. of Health.    https://web.archive.org/web/20201008185406/https://www.mass.gov/news/state-public-health-officials-offer-tips-for-a-safe-and-healthy-halloween"
"1125","Maine","US_ME","09-Oct","H1_Public.information.campaigns",2,"G",2,"G","It appears that Maine Department of Health and Human Services' ‘Keep It Maine’ public health campaign is ongoing as of 15th October, therefore 2G remains the most appropriate level for this indicator.    Sources:  http://web.archive.org/web/20200716173700/https://www.wagmtv.com/content/news/Maine-DHHS-Launches-Keep-It-Maine-Campaign-to-Promote-Public-Health-Measures-That-Limit-the-Spread-of-COVID-19-570956981.html    http://web.archive.org/web/20200728104943/https://www.maine.gov/dhhs/documents/KeepItMaine.pdf"
"1126","Minnesota","US_MN","09-Oct","H1_Public.information.campaigns",2,"G",2,"G","No policy change noted. Minnesota continues to have a strong public information campaign online.  https://web.archive.org/web/20201002022834/https://mn.gov/covid19/"
"1127","Mississippi","US_MS","09-Oct","H1_Public.information.campaigns",2,"G",2,"G","The state Department of Health continues to provide accurate and up-to-date information at its website here:   https://web.archive.org/web/20201015174526/https://msdh.ms.gov/msdhsite/_static/14,0,420.html    The governor's office also continues to provide public information at https://web.archive.org/web/20201015174758/https://governorreeves.ms.gov/covid-19/."
"1128","North Carolina","US_NC","09-Oct","H1_Public.information.campaigns",2,"G",2,"G","No changes after checking relevant sources."
"1129","North Dakota","US_ND","09-Oct","H1_Public.information.campaigns",2,"G",2,"G","No changes after checking relevant sources."
"1130","Nebraska","US_NE","09-Oct","H1_Public.information.campaigns",2,"T",2,"T","On October 9, With COVID-19 continuing to spread in Nebraska, getting a flu vaccine is an essential part of protecting your health and your family’s health this season. The Nebraska Department of Health and Human Services (DHHS) recommends doing so before the end of October.    See the Department of Health and Human Services website, archived: http://web.archive.org/web/20201016185406/http://dhhs.ne.gov/Pages/This-Season-Flu-Vaccine-More-Important-Than-Ever.aspx  "
"1131","New Hampshire","US_NH","09-Oct","H1_Public.information.campaigns",2,"G",2,"G","New Hampshire mobilizes 211NH to handle all coronavirus-related calls from NH residents.     '""211NH will serve as a coordinated and streamlined process for any Granite Stater concerned about the coronavirus,"" said Governor Chris Sununu. ""Now that it is up and running, any New Hampshire residents can call with questions or concerns. I would like to thank the folks at Granite United Way and Public Health for working around the clock to stay on top of this evolving public health situation by making this critical resource available 24/7.""'    https://web.archive.org/web/20200716211316/https://www.governor.nh.gov/news-and-media/state-launches-2-1-1-covid-19-hotline"
"1132","New Jersey","US_NJ","09-Oct","H1_Public.information.campaigns",2,"G",2,"G","No change: ""Mask Up, New Jersey!""    https://web.archive.org/save/https://www.nj.gov/dep/maskup/"
"1133","New York","US_NY","09-Oct","H1_Public.information.campaigns",2,"G",2,"G","One facet of New York's continuing public information campaign is the series of ""Mask Up"" ads, which features celebrities like Billy Crystal, Robert DeNiro, and Ellen Pompeo.     Source: http://web.archive.org/web/20201015160240if_/https://www.youtube.com/playlist?list=PLfadY7H_ED1pKNyBCqsX6s8weAG5p7lM9"
"1134","West Virginia","US_WV","12-Oct","H1_Public.information.campaigns",1,"G",2,"G","On October 12, Gov. Justice took time out of his remarks on COVID-19 to remind and encourage all West Virginians to get their flu vaccine.According to health officials, everyone 6 months and older should receive this vaccine.    See the governor website, archived: http://web.archive.org/web/20201016180003/https://governor.wv.gov/News/press-releases/2020/Pages/COVID-19-UPDATE-Gov.-Justice-reports-West-Virginia-transmission-rate-remains-among-nation%E2%80%99s-best.aspx  "
"1135","Arizona","US_AZ","13-Oct","H1_Public.information.campaigns",2,"G",2,"G","Public information campaign continues.  https://web.archive.org/web/20201018212227/https://www.azdhs.gov/preparedness/epidemiology-disease-control/infectious-disease-epidemiology/index.php#novel-coronavirus-home"
"1136","Minnesota","US_MN","13-Oct","H1_Public.information.campaigns",2,"G",2,"G","No policy change noted. Minnesota continues to have a strong public information campaign online.  https://web.archive.org/web/20201002022834/https://mn.gov/covid19/"
"1137","Ohio","US_OH","13-Oct","H1_Public.information.campaigns",2,"G",2,"G","A new public service announcement featuring former Ohio State coaches Jim Tressel and Urban Meyer encourages everyone to stay in the game and to stick to the game plan.    Ohio Governor announced the creation of a new Lab Capacity Dashboard to help pharmacists, nursing homes, colleges and universities, employers, and others administering COVID-19 tests find a lab to run their samples.    https://web.archive.org/web/20201021000641/https://coronavirus.ohio.gov/wps/portal/gov/covid-19/resources/news-releases-news-you-can-use/covid-19-update-10-13-20  "
"1138","Alaska","US_AK","14-Oct","H1_Public.information.campaigns",2,"G",2,"G","No changes detected in this indicator."
"1139","South Carolina","US_SC","14-Oct","H1_Public.information.campaigns",2,"G",2,"G","SCDHEC continues to frequently upload testing site locations and information for Covid.     Link:  https://web.archive.org/web/20201014134430/https://twitter.com/scdhec/status/1316373464748564480"
"1140","Vermont","US_VT","14-Oct","H1_Public.information.campaigns",2,"G",2,"G","No changes detected in this indicator. Vermont COVID-19 website remains live.    https://web.archive.org/web/20201014224849/https://www.healthvermont.gov/response/coronavirus-covid-19"
"1141","Iowa","US_IA","15-Oct","H1_Public.information.campaigns",2,"G",2,"G","On October 15th, the first day of early voting in Iowa, Iowa Department of Public Health (IDPH) reminded people via Twitter to wear a mask, maintain social distance, and follow hygiene practices.   https://archive.fo/25rCI "
"1142","New Hampshire","US_NH","15-Oct","H1_Public.information.campaigns",2,"G",2,"G","New Hampshire mobilizes 211NH to handle all coronavirus-related calls from NH residents.     '""211NH will serve as a coordinated and streamlined process for any Granite Stater concerned about the coronavirus,"" said Governor Chris Sununu. ""Now that it is up and running, any New Hampshire residents can call with questions or concerns. I would like to thank the folks at Granite United Way and Public Health for working around the clock to stay on top of this evolving public health situation by making this critical resource available 24/7.""'    https://web.archive.org/web/20200716211316/https://www.governor.nh.gov/news-and-media/state-launches-2-1-1-covid-19-hotline"
"1143","Rhode Island","US_RI","15-Oct","H1_Public.information.campaigns",2,"G",2,"G","RI Department of Health establishes Incident Command System https://web.archive.org/save/https://governor.ri.gov/documents/orders/Executive-Order-20-02.pdf"
"1144","Virgin Islands","US_VI","15-Oct","H1_Public.information.campaigns",2,"G",2,"G","The VI public health information campaign is active with a regularly updated site that also offers text updates. See archive: https://web.archive.org/web/20200817114624/https://www.vi.gov/covid/"
"1145","Connecticut","US_CT","16-Oct","H1_Public.information.campaigns",2,"G",1,"G","The Connecticut DPH issued recommendations for Halloween (regarding festivities starting October 16th) for all residents.     https://web.archive.org/web/20201027183658/https://alb.reddit.com/i.gif?a=2177&b=1205&c=301&d=2177&e=1205&f=301&g=0&h=0&i=1603823763596&o=1&q=0&r=4&sh=1000&sw=1600&t=1603823818806&w=0&z=gAAAAABfmGiMPQgyxGDU-WPYjaLDGuDRjDcerxbEPTGPFrJSaFtqGGHs9werwZ5P-30kTzmYj2Pi6qpi-3WBhl3STtY2YxSqD35bY-frc7jBtn0dkD4o2E04qYscg552IU4q0HfeA3-3H3gWTlHZgWo3L9hkFRoHi-aRF2AZXW2U_SjOtYx_cRLVedPGd0cqUxcrSnKHOX7lhWvdDYJLTv2-I_s9SbYi3OZGgJ7wp0zGSnx-Md1upNH5jupbG-kJSFMyPuXVO_cyX_N9U4phUHJRD_vf_VIayhQ5x8hw0xulixGG_b1aGksyOQEhiultqhi1vBKVM27YOE9R49VdS7-45O1zNjoFNt92hEFrVlbXNayhj4OrsQ8pN6usIRvIWKVq9ekQWXu_H1NEltrQrwX_TQTf2-AQOHvAEK6eiHr0yns01cudByuDJDkwMcxRNz0Dw_FXr_SvsGuVHsdj4bJokPL06a7PbiSl6pLrZYEjJaqRcuDC8hDCmgWGO4uMfB02VP3PDOyS4uF-SerVbIygR7GJB3iso5y-ooja9NUyiGy_jar8YjKHuBEemyfF4dpU0fuUjH_35KT828HluJl2iAWwgvzDc_eb6405V1s86UbaixyLs1vUGfI8mcbVq1TVN2KJVbUlpHwQ7JMMqDHjePkdoJ2JfWgy3WI16u3a7JHWdO9t_p3u3Bcx7AHmN5Zb9wqMygKgrAA9ugtP0UJI2kLgoPSftpyR2KBY041TmqvN_8cEziPEnH-Au7YB30SRzAxScyPE6tqNH3b57slNDTV17BMI6TDhAPgqz66OueG2J4Uu2uxUnLR36SNEWfscDqSM7qU24WL40fElGIJEDQIx1X2xp5fbazT7Vsdws3iR-uIZtFsUEDf6rVMNOD5TiTmdSufR_9CqEz0qGSuzHtImfT1kVsAh6u31Ak2wnVgSLt8TTOie_wxOZrB4W9hpNF8FffYk3XTY9mx7Ai6wnm_kYXfbkzvFBkSR60OYqK8cLxL9h8s6W1TK1vJueeD0N5mCaE1-ZdLuUvwPi_VZNlyk93-5du61jfblnHL-YfybQJeH3-bi_ElNV6WRrUyHLXz4kyE7ImHqnnXSMCYs0q4xbRB-USmtU03U2DQER3tKGOhNfjwrUx3PvgM3VQtf1oM-tp7bceZue5lgRYSKmMAYGmREbhJ4Ook2DRv0xLMJ1eRwaIMJhWMTnF1su0FSDVyT7R3FDgvZkhPliWymkdwWbtQ8hw6M-q-_Yse4uV1-swlie2KLDbIE6B0If-KZ3a43Q3CaqbGXNX79NvczmDM1QUEsuKsTLFv43m97vr4i_ANhVYxxb6WGkUORYK1GSRrm3q0jrW5N71FB8gJzNba2Nx6ACkIae3zVZmSkROhhvtoqCkC6A7cVRhGaadEphN-_iu_VVyiZpJ8nnhAs1qYmaXJGVtgK4b0vwVR8fU-yRhZnyoczvdv-umgPOL0yyFcmj_6Xw56YHao7kLKBbWJL8kLE5M0yoC5SuVhS6YUf1sLF6GElsYAk4O_oeZ7mihJ0nbabZOHJrXhhEnSDYESpISuJNngapQv0pW0AplitceV6hFRMBBVxWWuyzzsfm0dFrx4bCZq9vxIzH1l2ilgUGL8FRkVbd9WN_OUXCxs9F9kJLjXM6n3F-wZFHPQ4qf2XaNnD1Gfmowc97mo-6cOeCF68wTm8MEehTOa2CP0YQIv5Htvd9G4rTRMG3MWpV_PjTRpEg-gdjJYFkAcgYqmjQFGHzCMYPMXF1kkU11jdfcssX4A_VBCI58u6FjCVt78KIGCsho5PDjBd1i03M5_oQlYeq0vy-8-aVE_cOlRc36RX0-kyTkBYgZHvTUrWhqqkUi-p0Gqn5t0vAakE1-QaloWjfnzvdGfSCUuvuQBY-1kMVvZzjxylEi0Yyb76BAoDwGmbgI5hCQYqBCx6tYsoqsTGlEPdaKecmhLfEgf0Q6dg0j91rSq6ikH-U7Vnu8S1thsWUreUmQkAPDuuQvGYsJeqhPNJ01m_zVjnt82aqBXcsbSibpTg7EuejqoHePKtoq74LUDvLyvjxgFxqoMZT00jVGop6Bkg-YqLtCjCJQWIzXy04mMw09CV1GImavgHVb0s     (Not sure why the long url - here is the original: https://portal.ct.gov/DPH/Communications/Guidance/Connecticut-Halloween-Guidance)"
"1146","Washington DC","US_DC","16-Oct","H1_Public.information.campaigns",2,"G",2,"G","On October 16, Mayor Bowser and her government maintained an active public information campaign through their website coronavirus.dc.gov and social media. See DC Coronavirus Information website and Mayor Bowser’s tweet respectively, archived: https://web.archive.org/web/20201016125205/https://coronavirus.dc.gov/ and https://web.archive.org/web/20201016125408/https://twitter.com/MayorBowser/status/1317067101295751168"
"1147","Louisiana","US_LA","16-Oct","H1_Public.information.campaigns",2,"G",2,"G","The Office of the Governor's website and Louisiana Department of Health websites include a COVID19 resource section with news reports, executive orders, contacts and additional resources regarding COVID-19. The Governor's Twitter account also has COVID-19 information. See Official website, archived: https://web.archive.org/web/20200813074341/https://coronavirus.la.gov/  See LDH link: https://web.archive.org/web/20200813074244/https://ldh.la.gov/Coronavirus/  See Twitter link: https://web.archive.org/web/20200813074151/https://twitter.com/LouisianaGov"
"1148","Maryland","US_MD","16-Oct","H1_Public.information.campaigns",2,"G",2,"G","On October 16, the public information campaign on COVID-19 was still active. See Governor Hogan’s tweet and Maryland Coronavirus Platform, archived: https://web.archive.org/web/20201016140633/https://twitter.com/GovLarryHogan/status/1316755222354563073 and https://web.archive.org/web/20201016140526/https://coronavirus.maryland.gov/"
"1149","Maine","US_ME","16-Oct","H1_Public.information.campaigns",2,"G",2,"G","There has been no indication that Maine Department of Health and Human Services' ‘Keep It Maine’ public health campaign has ended as of 29th October 2020, therefore 2G remains the most appropriate level for this indicator.    Sources:  http://web.archive.org/web/20200716173700/https://www.wagmtv.com/content/news/Maine-DHHS-Launches-Keep-It-Maine-Campaign-to-Promote-Public-Health-Measures-That-Limit-the-Spread-of-COVID-19-570956981.html    http://web.archive.org/web/20200728104943/https://www.maine.gov/dhhs/documents/KeepItMaine.pdf"
"1150","North Carolina","US_NC","16-Oct","H1_Public.information.campaigns",2,"G",2,"G","October 22, 2020: Gov. Roy Cooper announces that North Carolina will remain in Phase 3 for an extended period of 3 weeks. Phase 3 was initially scheduled to end on October 23, 2020. Cooper also sent letters to 33 counties urging them to adopt ordinances that imposed fines for violating COVID-19 restrictions and to consider issuing more strict restrictions that those outlines in Phase 3.     Reference: https://web.archive.org/save/https://abc11.com/health/cooper-extends-phase-3-as-covid-19-metrics-surge/7219027/"
"1151","North Dakota","US_ND","16-Oct","H1_Public.information.campaigns",2,"G",2,"G","No changes after checking relevant sources. "
"1152","New Jersey","US_NJ","16-Oct","H1_Public.information.campaigns",2,"G",2,"G","  No change: ""Mask Up, New Jersey!""    https://web.archive.org/save/https://www.nj.gov/dep/maskup/"
"1153","South Carolina","US_SC","16-Oct","H1_Public.information.campaigns",2,"G",2,"G","South Carolina Department of Health and Environmental Control (DHEC) launches a COVID-19 vaccination plan webpage to regularly update using the most current and factual information available.    Vaccination plan website:  https://web.archive.org/web/20201019214417/https://scdhec.gov/covid19/covid-19-vaccination"
