"","RegionName","RegionCode","Date","indicator_type","past_value","past_flag","present_value","present_flag","Notes"
"1","Massachusetts","US_MA","24-Sep","C1_School.closing",2,"T",2,"T","Twelve of 16 school districts that received a letter recently from the Massachusetts Department of Elementary and Secondary Education have yet to announce that they will be holding in-person learning to the dismay of Baker and his administration.   He urged schools in low-risk COVID areas to make decisions the community can benefit from, given that precautions have already been taken. ""Remote only models should only be used for communities with three consistent weeks of red designations"".    https://web.archive.org/web/20200924181229/https://www.masslive.com/coronavirus/2020/09/massachusetts-gov-charlie-baker-re-emphasizes-the-need-for-children-in-16-low-risk-covid-communities-to-return-to-school.html    *High school re-closures*  7 Marlborough High School students tested positive for COVID-19, and the city’s school committee decided this week to suspend in-person learning starting September 24, and have all students learn remotely until they revisit the decision on Oct 5.  However, school authorities said the cases may not be connected, according to NECN.  The rest of Marlborough schools will stick with a hybrid model.    Similarly, on Sept 24, in Arlington, an elementary school staffer tested positive, and the school pivoted towards remote instruction only.    https://web.archive.org/web/20200924181232/https://www.boston.com/news/coronavirus/2020/09/24/live-updates-massachusetts-schools-covid-19"
"2","Maine","US_ME","24-Sep","C1_School.closing",1,"G",1,"G","As of 25th September, Oxford County has joined York County as a yellow-coded state for school reopening. Again, a yellow rating does not require schools to close unequivocally, therefore this development does not change this indicator’s level.     https://web.archive.org/web/20201029213210/https://www.maine.gov/doe/framework/part-I/"
"3","Montana","US_MT","24-Sep","C1_School.closing",1,"G",1,"G","Recoded from 0 to 1G as the state guidance states that strict social distancing must be kept in schools.    Schools in Montana remain open as of September 24. A report detailing that over 500 COVID-19 cases were found in schools in Montana, with over 200 found in post-secondary institutions.    See NBC article: http://web.archive.org/web/20201001050647/https://www.kulr8.com/news/covid-19-cases-in-montana-schools-more-than-doubled-since-last-week/article_e700dc3c-fec8-11ea-923d-6b6a2e8bdf38.html"
"4","Ohio","US_OH","24-Sep","C1_School.closing",2,"T",2,"T","Ohio Governor announced that Ohio's ResponsibleRestart guidelines for higher education will now include a recommendation that all residential colleges and universities regularly test a sample population of asymptomatic students.    https://web.archive.org/web/20201001042516/https://coronavirus.ohio.gov/wps/portal/gov/covid-19/resources/news-releases-news-you-can-use/covid-19-update-09-24-2020"
"5","Oregon","US_OR","24-Sep","C1_School.closing",2,"T",2,"T","At Oregon State University, a dashboard informs the public of cases within the OSU community (see here: https://web.archive.org/web/20200928230901/https://covid.oregonstate.edu/dashboard). OSU’s Corvallis campus is planning to deliver more than 90% of course sections by remote instruction in fall term 2020. Courses offered on-site on the Corvallis campus primarily are those with a significant experiential learning component, such as involving labs and field courses.     The University of Oregon also has a dashboard (https://web.archive.org/web/20200928231229/https://coronavirus.uoregon.edu/cases). 10 students tested positive on Sept 24 and 15 tested positive on the 25th. UO courses are primarily remote and online for the fall term. In limited circumstances, such as with some labs, studio experiences, and other small classes, in-person instruction is occurring.     Portland Community College, which serves nearly 73,000 full-time and part-time students, has decided to remain in remote operations for Fall 2020 and Winter 2021 terms. During these terms, the college will not return to in-person instruction or operations including off-site learning experiences (e.g., Co-op, internships, etc.). All PCC student services will continue to be available remotely. https://web.archive.org/web/20200928231837/https://www.pcc.edu/coronavirus/"
"6","Texas","US_TX","24-Sep","C1_School.closing",2,"T",2,"T","While some K-12 schools have proceeded to in-person classes, some remain closed to in- person learning at this time.     Plans for school districts in Houston area:   https://archive.fo/eMjET    Notes on Houston: Houston ISD is set to start face-to-face instruction on Oct 19. Some school districts have been open since Sept 8.     Plans for school districts in Dallas area:   https://archive.fo/uHcqy    Notes on Dallas: Dallas, Arlington and Irving ISDs plan to resume in- person learning on Oct 5.     Plans for reopening Austin ISD:   https://archive.fo/1e8q7    Notes on Austin: Austin ISD plans to begin on-campus learning from Oct 5, with much pushback from the community.     Updates on COVID- 19 cases at open schools in San Antonio:   https://archive.fo/ioGXi    Notes on San Antonio: Most school districts in San Antonio resumed face-to-face learning               "
"7","Vermont","US_VT","24-Sep","C1_School.closing",2,"T",2,"T","No changes detected in this indicator after searching news articles and the several largest school district and college websites."
"8","Washington","US_WA","24-Sep","C1_School.closing",3,"T",3,"T","The three largest school districts in Washington state are Seattle Public Schools, Spokane Public Schools, and Tacoma Public Schools, respectively. The following notes address these school districts. Seattle Public Schools began remote instruction on September 4.   On Sept 23 Spokane Public Schools stated they will begin phasing kindergarten students back to in-person instruction on Oct. 7. This will begin with an alternating schedule of groups attending school and then transition to kindergarten students attending every day (https://web.archive.org/web/20200928171742/https://www.spokaneschools.org/covid).     Tacoma Public Schools was planning on beginning in-person instruction on Monday, September 28. However, on September 24 they announced that they will postpone in-person instruction, explaining, ""School districts received clarified guidance this week from the state Department of Labor and Industries around the types of personal protective masks required for school employees who work in schools with students.    We also have discovered during safety testing of our N95 masks that many are not passing the safety standards.  In addition, we have learned that more information from Labor and Industries pertinent to school operations may come out the week of Sept. 28. As a result of these issues, we will delay the start of in-person instruction until we receive and understand any new information and can ensure the safety of our staff and students. For Tacoma Public Schools, this clarified guidance from L&I means school-based staff members must wear a higher level of personal protective masks than previously planned and communicated."" https://web.archive.org/web/20200928172313/https://www.tacomaschools.org/about/newsroom/story-detail/~board/20-21news/post/tacoma-public-schools-will-not-begin-bringing-students-back-to-school-on-monday-for-in-person-instruction    A new Covid-19 tracker dashboard is collecting information on coronavirus cases in schools as well as other safety measures and approaches across the US. Information on Washington can be found here: https://web.archive.org/web/20200928170610/https://statsiq.co1.qualtrics.com/public-dashboard/v0/dashboard/5f62eaee4451ae001535c839"
"9","Arizona","US_AZ","25-Sep","C1_School.closing",3,"T",3,"T","In some parts of the state, schools remain closed at all levels, with courses proceeding online. In others, learning continues via a hybrid model. In the state's most populous country, Maricopa County, schools are recommended to open or closed based on Covid-19 data in their area.  https://web.archive.org/web/20200924124150/https://www.maricopa.gov/5594/School-Metrics"
"10","California","US_CA","25-Sep","C1_School.closing",3,"T",3,"T","Orange County schools began to re-open as of September 25, as Orange County was in the 'red' (substantial) tier of California's re-opening stages for over 14 days. Other schools in counties that are still in the 'purple' (widespread) tier, such as Los Angeles, are still to remain closed.    LA Times article: http://web.archive.org/web/20201001025548/https://www.latimes.com/california/orange-county/story/2020-09-25/comparing-coronavirus-in-california-and-the-world-as-some-oc-schools-reopen"
"11","North Dakota","US_ND","25-Sep","C1_School.closing",2,"T",2,"T","No changes after checking relevant sources."
"12","New Hampshire","US_NH","25-Sep","C1_School.closing",2,"T",2,"T","Still decision of districts and universities to remain open or work remotely; NH government provides ""considerations for when schools can consider transitioning between the  different instructional models in response to the changing community and school-based COVID-19 epidemiology.""    https://web.archive.org/web/20200918034140/https://www.dhhs.nh.gov/dphs/cdcs/covid19/documents/school-instruction-guidance.pdf"
"13","Oregon","US_OR","25-Sep","C1_School.closing",2,"T",2,"T","According to The Oregonian on Sept 25, the Oregon Department of Education will ""begin requiring districts each Friday to provide detailed tallies quantifying how students are being taught. The state will post its data online beginning next week [Oct 2], offering the fullest picture yet about where Oregon students are learning amid the pandemic. School outbreaks will be publicly reported by a different state agency, the Oregon Health Authority. It’s unclear what benchmark the agency will set for disclosing cases linked to a school or classroom"". https://web.archive.org/web/20200928232748/https://www.oregonlive.com/coronavirus/2020/09/three-oregon-school-districts-have-covid-19-cases-and-state-officials-are-working-to-improve-transparency.html"
"14","Rhode Island","US_RI","25-Sep","C1_School.closing",2,"T",2,"T","Most schools in RI have the green light for reopening.    Most schools in RI have reopened for full in-person instruction on the 14th except for Providence and Central Falls school districts, which will start with partial re-opening before ramping up.     https://web.archive.org/web/20200918013608/https://turnto10.com/news/local/raimondo-expected-to-make-schools-announcement    https://web.archive.org/web/20200918013123/https://www.back2schoolri.com/a-layered-approach/"
"15","Virginia","US_VA","25-Sep","C1_School.closing",2,"G",2,"G","James Madison University temporal transition to online learning on September 1.   https://web.archive.org/web/20200909171059/https://www.jmu.edu/news/2020/09/01-online-class-announcement.shtml        UVA partially opens campus for students' return:  https://web.archive.org/web/20200910172611/https://news.virginia.edu/content/whats-open-and-when-students-return-grounds"
"16","Washington","US_WA","25-Sep","C1_School.closing",3,"T",3,"T","At the University of Washington, the largest public university in the state, more than 90% of class sections on the Seattle campus will be held online during fall term, which start on Sept 30. Only classes that cannot be taught remotely will be held in person, with appropriate safety measures and physical distancing in place. Data on Covid-19 testing is updated regularly on their website. 11 people (students, faculty, staff) tested positive between Sept 20-27. https://web.archive.org/web/20200928191911/https://www.washington.edu/coronavirus/testing-results/    Washington State University's fall semester undergraduate courses will be delivered at a distance and will be completed remotely, with extremely limited exceptions for in-person instruction. Classes began Aug 24. https://web.archive.org/web/20200928192742/https://wsu.edu/covid-19/covid-19-ready/    Western Washington University in Bellingham began classes on Sept 23rd, with most of them conducted remotely. All WWU classes will be moved to remote/online after the Thanksgiving break. This means that instruction during the last week of classes and exams during Finals Week will be delivered/administered remotely. https://web.archive.org/web/20200928193505/https://www.wwu.edu/fall-guide"
"17","Wisconsin","US_WI","25-Sep","C1_School.closing",2,"T",2,"T","On September 25th, the City of Milwaukee Health Department allowed three more schools to reopen.   http://web.archive.org/web/20201001051042/https://city.milwaukee.gov/ImageLibrary/Groups/healthAuthors/ADMIN/PDFs/PressReleases/2020/MediaReleaseSchoolSafetyPlansUpdateSept25.pdf "
"18","West Virginia","US_WV","25-Sep","C1_School.closing",1,"T",1,"G","On September 25, Gov. Justice announced that the West Virginia Department of Education has posted a list of schools across the state that have active outbreaks of COVID-19 on the WVDE website.    A confirmed outbreak is described as two or more confirmed COVID-19 cases among students and/or staff from separate households, within a 14-day period, in a single classroom or core group.    The Current Outbreaks in Schools chart lists the school and county where the outbreak has been identified, the number of cases in that facility, the date when the outbreak was identified, and information about whether the outbreak led to full remote learning.     See the Office of the Governor website, archived: https://web.archive.org/web/20200926202543/https://governor.wv.gov/News/press-releases/2020/Pages/COVID-19-UPDATE-Gov.-Justice-announces-WVDE-now-reporting-school-outbreaks-online-County-Alert-map-to-match-School-map.aspx"
"19","Wyoming","US_WY","25-Sep","C1_School.closing",2,"T",2,"T","University of Wyoming Law School has gone to entirely virtual instruction following Covid outbreak.  https://web.archive.org/web/20201002110507/https://localnews8.com/news/2020/10/01/university-of-wyoming-wrestling-reports-6-covid-19-cases/"
"20","Missouri","US_MO","26-Sep","C1_School.closing",2,"T",2,"T","The University of Missouri has disciplined 20 more students with suspension, probation, and other sanctions, as of Sept. 26.  https://web.archive.org/web/20201001090805/https://www.kctv5.com/school_authority/missouri-university-disciplines-20-for-pandemic-violations/article_e0168036-64f0-5280-a9bc-6ee34dc7c444.html"
"21","Vermont","US_VT","26-Sep","C1_School.closing",2,"T",2,"T","On 26 September 2020 the Agency of Education moved to Step 3 of the school reopening plan.    The move allows schools to resume use of common areas such as gymnasiums and cafeterias for their intended purposes, but with smaller group sizes, staggering the use of the areas and ensuring they are properly cleaned between uses.    Vermont school districts are still able to choose whether to offer remote learning, full-time in-person instruction of a combination.    Still coded as 2T as I could not find evidence for any school districts that have reopened for solely in-person instruction as of yet - expected in the coming weeks.    https://web.archive.org/web/20201001185001/https://whdh.com/news/vermont-schools-take-next-step-in-re-opening-fall-sports-start-saturday/"
"22","Wisconsin","US_WI","26-Sep","C1_School.closing",2,"T",2,"T","University of Wisconsin Madison resumed in-person instruction on September 26th after switching to 100% remote learning on Sept 10th. http://web.archive.org/web/20201004102500/https://smartrestart.wisc.edu/campus-to-resume-some-in-person-activities-maintain-strict-health-measures/   "
"23","Alabama","US_AL","28-Sep","C1_School.closing",2,"T",2,"T","The two of the largest school districts in Alabama (Mobile County and Jefferson County) reopened for hybrid-model instruction for special education students and elementary schools (Jefferson County only) on September 28. Mobile County will open with staggered grade levels starting on October 5. Middle schools and high schools are expected to reopen for hybrid instruction in early October, with all levels transitioning to traditional in-person instruction by the end of the month. Both counties will allow families the option of continuing with virtual learning.    https://web.archive.org/web/20201001093555/https://www.mcpss.com/sys/content/newspost/98955adfa527439585f6281f0ca9f756    https://web.archive.org/web/20201001093816/https://www.jefcoed.com/domain/3062"
"24","Iowa","US_IA","28-Sep","C1_School.closing",2,"T",2,"T","On September 28th, Iowa City Community School District switched to hybrid learning. Students were required to wear a face covering.   http://web.archive.org/web/20201008073748/https://www.iowacityschools.org/site/default.aspx?PageType=3&DomainID=8&ModuleInstanceID=11948&ViewID=6446EE88-D30C-497E-9316-3F8874B3E108&RenderLoc=0&FlexDataID=51573&PageID=9  "
"25","Michigan","US_MI","28-Sep","C1_School.closing",2,"T",2,"T","On September 28th, the board of education for Detroit Public schools stated that 75% of their students were receiving remote learning. See archive: https://web.archive.org/web/20200907144430/https://www.detroitk12.org/site/Default.aspx?PageID=7145"
"26","Wyoming","US_WY","28-Sep","C1_School.closing",2,"T",1,"G","Schools have been allowed by state public health orders to be open and to provide in-person for groups of up to 50 in a classroom (or 250 in certain circumstances) throughout the fall.  Original link of most recent extension of order:  https://tb2cdn.schoolwebmasters.com/accnt_311585/site_311586/Documents/Current-Health-Orders.pdf  archived link:https://web.archive.org/web/20201021160805/https://tb2cdn.schoolwebmasters.com/accnt_311585/site_311586/Documents/Current-Health-Orders.pdf  University of Wyoming paused its return to in-person to classes until September 28 when they allowed return to calls for hybrid instruction.  original link:  https://www.uwyo.edu/alerts/campus-return/#:~:text=All%20students%20welcomed%20back%20to,capacity%20while%20promoting%20social%20distancing.  archived link:  https://archive.fo/nmniJ"
"27","Alaska","US_AK","29-Sep","C1_School.closing",3,"T",3,"T","No detected change in this indicator.     Mat-Su school district teaching remains to be delivered in-person.  Teaching in the Anchorage and Fairbanks North Star borough school districts remain online.     Fairbanks North Star borough school district has planned to begin in-person school for elementary and K-8 students on October 5, 2020. The Board also passed a motion to begin in-person school for middle schools on October 19.    Fairbanks North Star school reopening announcement:  https://web.archive.org/web/20200929214115/https://drive.google.com/file/d/1r5JQHywE9BC9pnkg5IkvwMB0ziUZkyHo/view    A mixture of online and in-person classes are still being conducted at the University of Alaska's three campuses. UAA classes are still mainly conducted online.          "
"28","Arkansas","US_AR","29-Sep","C1_School.closing",0,NA,0,NA,"This week, 36 Arkansas schools are operating differently due to positive cases or a high number of people quarantined within their schools, Education Secretary Johnny Key said during a COVID-19 briefing. Of those, 26 schools modified their plans last week.     Since schools returned last month, 129 have had to modify their plans; 93 of those schools have returned to their normal operations.    This comes as the Little Rock Education Association (LREA) has claimed working conditions are unsafe for teachers in central Arkansas, leading to a strike of 170 teachers absent from school Monday, 28 September. However, the District ultimately concluded that they had the resources for students to attend classes with over 170 teachers absent, and most teachers returned to classrooms on Tuesday.    If things change, and the LREA decides to switch all schools to remote learning, this could warrant a code change.     https://web.archive.org/web/20200930151733/https://katv.com/news/local/arkansas-gov-asa-hutchinson-to-give-covid-19-briefing-09-29-2020  "
"29","Kentucky","US_KY","29-Sep","C1_School.closing",2,"T",2,"T","The state Department of Education institutes a color-coded set of ""Mode of Instruction Metrics"" for when remote, hybrid, and in-person instruction is appropriate based on rates of community transmission.    https://education.ky.gov/comm/Documents/FINAL%20DPH%20KDE%20COVID-19%20Mode%20of%20Instruction%20Metrics%20for%20K-12%20Education%209-12-20.pdf"
"30","New York","US_NY","29-Sep","C1_School.closing",2,"T",2,"T","Coded by Laura de Lisle (code value revised to 2T due to several school districts deciding to go fully remote): This article from CNN (linked below) indicates that elementary schools in New York City reopened on 29th September.     Source: http://web.archive.org/web/20201029203914/https://edition.cnn.com/2020/09/29/us/new-york-schools-reopen-wellness/index.html"
"31","Washington","US_WA","29-Sep","C1_School.closing",3,"T",3,"T","MyNorthwest has put together a reopening tracker so that it’s easier to compare districts’ plans as they develop throughout the school year, which can be accessed here: https://web.archive.org/web/20201001162534/https://mynorthwest.com/2034736/districts-reopening-schools-western-washington/    "
"32","Hawaii","US_HI","30-Sep","C1_School.closing",2,"T",2,"T","Most schools continue to operate distance-learning models, though ""there have been exceptions where schools offer learning hubs on campus to provide in-person educational programming for vulnerable students.""     https://web.archive.org/web/20200829051027/http://www.hawaiipublicschools.org/ConnectWithUs/MediaRoom/PressReleases/Pages/School-Year-2020-21-Models.aspx"
"33","Mississippi","US_MS","30-Sep","C1_School.closing",2,"T",2,"T","On September 30, a Mississippi middle school made headlines when it was forced to quarantine all of its students after 35% of them tested positive for COVID-19. The threshold recommended by the state Dept. of Health is 33%. Staff will continue to report to the school, and students will transition to distance learning for at least the next two weeks.    https://web.archive.org/web/20201001183227/https://apnews.com/article/virus-outbreak-health-mississippi-d8d7486e2bc303bcbf024a9363240544    https://web.archive.org/web/20201001190650/https://lbms.lbsdk12.com/"
"34","Oregon","US_OR","30-Sep","C1_School.closing",2,"T",2,"T","Oregon Health Authority is publishing weekly data on COVID-19 cases associated with schools (K-12) that offer in-person instruction. This will be published each Wednesday. Six schools have had cases during September (https://web.archive.org/web/20200930224340/https://www.oregon.gov/ode/students-and-family/healthsafety/Documents/COVID-19-Weekly-Schools-Report-2020-09-30.pdf)    For more information on what data will be collected, view this archived website: https://web.archive.org/web/20200930224448/https://www.oregon.gov/oha/ERD/Pages/Oregon-reports-220-new-confirmed-and-presumptive-COVID-19-cases-4-new-deaths.aspx"
"35","Utah","US_UT","30-Sep","C1_School.closing",2,"T",2,"T","Both BYU and University of Utah moved back into Orange restrictions which recommend moving mostly to online classes, limits extra curriculars, requires mask wearing and limits mixing of students.  University of Utah described the measures as a ""mini-circuit breaker"" which will expire if no longer needed on October 10, 2020.  https://www.byu.edu/coronavirus/  https://archive.fo/NvzbQ  https://coronavirus.utah.edu/  https://archive.fo/Vq4kE"
"36","Alaska","US_AK","01-Oct","C1_School.closing",3,"T",3,"T","Anchorage school district had planned to reopen schools for in-person teaching in the coming weeks - however, this has now been delayed indefinitely due to rising cases in the district.    https://web.archive.org/web/20201007203843/https://www.adn.com/alaska-news/education/2020/10/01/anchorage-school-district-will-delay-the-start-of-in-person-classes/    No detected change in this indicator."
"37","Arizona","US_AZ","01-Oct","C1_School.closing",3,"T",3,"T","Maricopa County, the state's most populous, reports some areas in which schools are asked to remain closed because of Covid-19 variables.  https://web.archive.org/web/20200930001842/https://www.maricopa.gov/5594/School-Metrics"
"38","California","US_CA","01-Oct","C1_School.closing",3,"T",3,"T","On October 1, it was reported that many schools in San Diego, that were not a part of San Diego Unified School District had either already opened or were beginning to reopen. Although San Diego Unified, has not set a date for reopening for most of their students, they are offering limited in-person support sessions for select groups of students. San Diego Unified’s sessions will start Oct. 13 and are geared toward students with learning loss and students with high needs for special education.    San Diego Tribune article: https://web.archive.org/web/20201008040823/https://www.sandiegouniontribune.com/news/education/story/2020-10-01/most-san-diego-county-school-districts-have-reopened-or-are-reopening-in-october"
"39","Georgia","US_GA","01-Oct","C1_School.closing",2,"T",2,"T","Gov. Kemp has extended a State of Emergency order in Georgia until November 9. Local schools are following reopening guidelines based on the number of positive cases in their respective areas.    https://archive.fo/julbz"
