"","RegionName","RegionCode","Date","indicator_type","past_value","past_flag","present_value","present_flag","Notes"
"466","Montana","US_MT","24-Sep","C4_Restrictions.on.gatherings",3,"G",3,"G","On September 24, Montana updated their COVID-19 FAQ's. As Montana is still in Phase 2 of their re-opening as of June 1, groups greater than 50 are not advised. However, if an event is planned with more than 50 people a consult with the local public health office on a plan to implement adequate social distancing is recommended. Event cutoff threshold is at the discretion of community leadership based on current circumstances in that community.    See Montana COVID-19 FAQ's: http://web.archive.org/web/20201001052232/https://covid19.mt.gov/Frequently-Asked-Questions"
"467","New York","US_NY","24-Sep","C4_Restrictions.on.gatherings",3,"G",3,"G","As of 1st October, all regions of New York are still in Phase IV of the reopening plan, which restricts gatherings to 50 people or fewer.     Source: http://web.archive.org/web/20200903122950/https://coronavirus.health.ny.gov/travel-large-gatherings-and-quarantines"
"468","South Carolina","US_SC","24-Sep","C4_Restrictions.on.gatherings",NA,NA,4,"G","Effective September 24, Governor McMaster's Executive Order No. 2020-62 extends the State of Emergency by an additional 15 days. No additional closure/containment measures have been issued per this Executive Order.    Link:  https://web.archive.org/web/20201001031959/https://governor.sc.gov/sites/default/files/Documents/Executive-Orders/2020-09-24%20FILED%20Executive%20Order%20No.%202020-62%20-%20State%20of%20Emergency.pdf"
"469","Vermont","US_VT","24-Sep","C4_Restrictions.on.gatherings",3,"T",3,"T","Burlington's emergency order mains in effect.    https://web.archive.org/web/20200903121052/https://go.boarddocs.com/vt/burlingtonvt/Board.nsf/files/BSMRVN6962C2/$file/Mayor%20-%20COVID-19%20Emergency%20Order%20-%20Limits%20on%20Gathering%20Size%20%26%20Alcohol%20Sales.pdf"
"470","Wisconsin","US_WI","24-Sep","C4_Restrictions.on.gatherings",4,"T",4,"T","As of September 24th, Emergency Order #9 was still in effect in Madison and Dane County. The order limited the number of attendees for mass gatherings and events to 10 and 25 people for indoor and outdoor venues, respectively.   Status: http://web.archive.org/web/20200924091143/https://publichealthmdc.com/coronavirus/forward-dane/current-order  Emergency Order #9:  https://web.archive.org/web/20200910025939/https://publichealthmdc.com/documents/2020-09-01_Order_9amendment.pdf  "
"471","Arizona","US_AZ","25-Sep","C4_Restrictions.on.gatherings",0,NA,0,NA,"No policy change noted."
"472","Florida","US_FL","25-Sep","C4_Restrictions.on.gatherings",4,"T",3,"T","On September 25, Palm Beach County extends the Declaration of Continuing a State of Emergency for an additional 7 days, or until October 2. No changes to containment or closure measures have been issued per this extension.  Link  https://web.archive.org/web/20200927222533/https://discover.pbcgov.org/PDF/COVID19/Declaration-of-Continuing-State-of-Emergency.pdf    Restaurant occupany restraints have been lifted statewide per Governor DeSantis's Executive Order enacted September 25. Local Emergency Orders in Miami-Dade, Palm Beach, and Broward Counties to amend existing EOs to the new Executive Order are various in respondes. Critically, the counties have various responses in restrictions to gatherings in private gatherings, for instance, MDC limits gatherings to 50 in hotels while Broward states:   ""Indoor events at Parks in Broward County exceeding 100 people are strictly prohibited. Outdoor open-air events at Parks in Broward County exceeding 100 people are prohibited unless operating pursuant to an operational plan approved in accordance with Section 1. 8(21) of Emergency Order 20-21 , as amended.""     Broward local Emergency Orders:  https://web.archive.org/web/20200929194422/https://www.broward.org/CoronaVirus/Documents/EmergencyOrder20-25.pdf    Code change from 4T to 3T as private events, whether indoor or outdoor, are restricted to no more than 50-100 persons."
"473","Indiana","US_IN","25-Sep","C4_Restrictions.on.gatherings",2,"G",0,NA,"9/25/2020  Stage 5 places no restrictions on the size of gatherings, but masks and social distancing are still required.     Stage 5:https://web.archive.org/web/20201001214443/https://backontrack.in.gov/files/BoT_Stage5_Stage5REVISED_2020-09-24.pdf"
"474","Missouri","US_MO","25-Sep","C4_Restrictions.on.gatherings",3,"T",3,"T","“Music activities” like DJs and dancing will be restricted along a four-block stretch of downtown St. Charles, MO to limit late-night crowds, effective Sept. 25.  https://web.archive.org/web/20200927120849/https://www.stltoday.com/news/local/govt-and-politics/it-s-not-footloose-but-st-charles-restricts-dancing-music-to-limit-crowds/article_43c33679-6b50-5e9f-a749-6ed1b0426306.html"
"475","North Dakota","US_ND","25-Sep","C4_Restrictions.on.gatherings",0,NA,0,NA,"No changes after checking relevant sources."
"476","New Hampshire","US_NH","25-Sep","C4_Restrictions.on.gatherings",0,NA,0,NA,"No update since Aug 11 announcement: Face coverings required for individuals attending gatherings of 100 or more people.    https://web.archive.org/web/20200813191318/https://www.governor.nh.gov/sites/g/files/ehbemt336/files/documents/emergency-order-63.pdf"
"477","New Jersey","US_NJ","25-Sep","C4_Restrictions.on.gatherings",3,"G",3,"G","""Yes, attending a gathering, ceremony, or celebration is permitted as long as the event complies with the following limits on gatherings.    Gatherings are allowed, but different limits apply depending on the type of gathering, and where it is happening:    Indoor Gatherings:  General indoor gatherings must be limited to 25 people or 25% of a room's capacity -- whichever number is lower. All attendees at indoor gatherings must wear face coverings and stay six feet apart.  Indoor gatherings for weddings, funerals, or memorial services must be limited to 150 people or 25% of a room's capacity -- whichever number is lower.  Indoor gatherings for religious and political activities protected under the First Amendment must be limited to 150 people or 25% of a room's capacity -- whichever number is lower.  Indoor gatherings for entertainment centers where performances are viewed or given, including movie theaters, performing arts centers, and other concert venues, must be limited to 150 people or 25% of a room's capacity -- whichever number is lower.    Outdoor Gatherings:  General outdoor gatherings must be limited to 500 people and social distancing must be practiced  There is no limit for outdoor gatherings for religious or political activities protected under the First Amendment.""    https://web.archive.org/web/20200924193900/https://covid19.nj.gov/faqs/nj-information/reopening-guidance-and-restrictions/are-people-allowed-to-gather-in-person"
"478","Rhode Island","US_RI","28-Sep","C4_Restrictions.on.gatherings",3,"G",3,"G","Phase III reopening has been extended under Executive Order 20-79 until the 28th of October, 2020.    All orders from the previous order are in place unless terminated or modified.    https://archive.fo/WqI3V"
"479","Alaska","US_AK","29-Sep","C4_Restrictions.on.gatherings",3,"T",3,"T","Anchorage's Emergency Order EO-14 v2 remains in effect. "
"480","Alabama","US_AL","29-Sep","C4_Restrictions.on.gatherings",0,NA,0,NA,"On Sept. 29, the Governor extended the “Safer at Home” order until November 8. No major changes were introduced. There continues to be no restriction on public gatherings.    https://web.archive.org/web/20201001090822/https://governor.alabama.gov/assets/2020/09/Safer-at-Home-Order-Final-9.29.2020.pdf    https://web.archive.org/web/20201001091147/https://governor.alabama.gov/assets/2020/09/GKI-0040-2020-Health-Order-Update-Nov-8-Horizontal-2.pdf"
"481","California","US_CA","29-Sep","C4_Restrictions.on.gatherings",4,"T",4,"T","The state of California updated their COVID-19 FAQ's on September 29. The state continues to restrict all gatherings other than the May exception for  mass gatherings for faith-based services and cultural ceremonies as well as protests. Those types of gatherings are now permitted indoors in counties in Substantial (red), Moderate (orange), and Minimal (yellow) tiers, subject to certain restrictions in those counties.    See FAQ's: http://web.archive.org/web/20201001044554/https://covid19.ca.gov/stay-home-except-for-essential-needs/"
"482","Mississippi","US_MS","30-Sep","C4_Restrictions.on.gatherings",4,"G",3,"G","Governor Tate Reeves signed the Safe Recovery order on 30 September, effective until 11 November. As of this new Safe Recovery order, gatherings where social distancing is impossible are limited to 20 people indoors and 100 people outdoors. Exceptions for religious ceremonies, schools, and voting precincts apply. See Executive Order, archived:     https://web.archive.org/web/20201001191254/https://www.msema.org/wp-content/uploads/2020/09/Executive_Order_1525.pdf"
"483","North Carolina","US_NC","30-Sep","C4_Restrictions.on.gatherings",3,"G",3,"G","On September 30, 2020 Gov. Roy Cooper announced that North Carolina will progress to Phase 3 starting on October 2, 2020 through October 23, 2020. Entertainment venues, restaurants, and nightlife will operate at increased capacity, and restrictions will be relaxed on gatherings.     https://web.archive.org/save/https://governor.nc.gov/news/governor-cooper-moves-north-carolina-phase-3-stable-numbers"
"484","Nevada","US_NV","30-Sep","C4_Restrictions.on.gatherings",3,"G",2,"G","Nevada Governor Steve Sisolak announced that he will be issuing an Emergency Directive adjusting the COVID-19 Statewide Baseline Mitigation Standards, including increasing limits on gathering sizes.    The new directive and accompanying guidance addresses gatherings of all types and iterations. This new directive increases the limit on gatherings from 50 to 250 people or 50 percent of capacity, whichever is less, so long as social distancing can be maintained and all other requirements can be met.    https://web.archive.org/web/20201001213839/https://gov.nv.gov/News/Press/2020/Gov_Sisolak_adjusts_COVID-19_Statewide_Baseline_Mitigation_Standards_increases_limit_on_gathering_sizes/"
"485","Vermont","US_VT","30-Sep","C4_Restrictions.on.gatherings",3,"T",3,"T","Burlington's emergency order remains in effect until today, 30 September.    https://web.archive.org/web/20200903121052/https://go.boarddocs.com/vt/burlingtonvt/Board.nsf/files/BSMRVN6962C2/$file/Mayor%20-%20COVID-19%20Emergency%20Order%20-%20Limits%20on%20Gathering%20Size%20%26%20Alcohol%20Sales.pdf"
"486","Washington DC","US_DC","01-Oct","C4_Restrictions.on.gatherings",3,"G",3,"G","On October 1, the phase two of reopening was still in place. See DC Coronavirus Information, website, archived: https://web.archive.org/web/20201001225555/https://coronavirus.dc.gov/ "
"487","Florida","US_FL","01-Oct","C4_Restrictions.on.gatherings",3,"T",3,"T","The Mayor of Miami-Dade County extends the Declaration of a State of Emergency for an additional 7 days commencing October 1. No changes have been implemented per this extension.    Link:   https://web.archive.org/web/20201001213029/https://www.miamidade.gov/information/library/09.30.20-state-of-emergency-declaration-extension-30.pdf"
"488","Georgia","US_GA","01-Oct","C4_Restrictions.on.gatherings",3,"G",3,"G","Gov. Kemp extends state of public health emergency till November 9. All restrictions under this order remain unchanged.     ""There are two minor changes made in his latest order, which include allowing workers at restaurants and bars to return to work once they have been symptom-free for 24 following a confirmed positive or suspected COVID-19 case.""    https://archive.fo/julbz"
"489","Wyoming","US_WY","01-Oct","C4_Restrictions.on.gatherings",3,"G",3,"G","Governor kept the gathering size limit (unless an exempted activity) at 50 people but increased the number who can congregate together--for instance together at a restaurant to 8 from 6.  https://archive.fo/02IFN  https://drive.google.com/file/d/1D-fu6mv72ZXIrcHJTDlrM3jzNyceXUQV/view    https://web.archive.org/web/20201002110625/https://trib.com/news/state-and-regional/health/as-coronavirus-cases-surge-wyoming-loosens-restaurant-restrictions-extends-health-orders/article_0f745a77-b6f2-52cd-a409-37883ddf5d75.html  "
"490","Florida","US_FL","02-Oct","C4_Restrictions.on.gatherings",3,"T",3,"T","On October 2, Palm Beach County extends the Declaration of Continuing State of Emergency for an additional 7 days or until October 9. The prolonged state of emergency does not include additional changes to containment/closure measures.    Link:   https://web.archive.org/web/20201004181222/https://discover.pbcgov.org/PDF/COVID19/Declaration-of-Continuing-State-of-Emergency.pdf"
"491","Massachusetts","US_MA","05-Oct","C4_Restrictions.on.gatherings",3,"G",3,"G","Under the revised gatherings order, the limit for indoor gatherings remains at a maximum of 25 people for all communities.    https://web.archive.org/web/20201004160002/https://www.mass.gov/doc/governors-covid-19-order-52/download"
"492","Mississippi","US_MS","31-Aug","C5_Close.public.transport",0,NA,0,NA,"There is currently no policy on closing public transport. The Official Website for Mississippi Department of Transportation states that ""Our maintenance crews and operational staff remain on duty throughout the state to keep our roads and bridges safe and open"". See official website, archived: http://web.archive.org/web/20200730210944/https://mdot.ms.gov/portal/covid19"
"493","Montana","US_MT","31-Aug","C5_Close.public.transport",1,"T",1,"T","On August 31, Helena's Capital Transit reinstated all bus lines, although with modified hours, stops and ridership capacity limits.     See Helena Capital Transit alert page: /web/20200903190408/http://www.ridethecapitalt.org/alerts/"
"494","South Carolina","US_SC","31-Aug","C5_Close.public.transport",0,NA,0,NA,"COMET reminds passengers/riders to limit travel to only essential locations and to be aware about the importance of social distancing. Regular service of buses and trolleys continues under normal schedules.     Link:    https://web.archive.org/web/20200820002916/http://catchthecometsc.gov/whats-new/the-comet-is-working-hard-to-keep-you-safe-on-our-buses-and-fight-covid-19/    ** Code change to 0 (previously 1T) as resumed regular schedules and normal volume of public transit services, although continued face mask mandates and social distancing, indicates a difference in coding."
"495","New Mexico","US_NM","03-Sep","C5_Close.public.transport",2,"T",2,"T","No updates on NM rail runner site     Link to Rio Metro site:   http://web.archive.org/web/20200803131029/https://riometro.org/CivicAlerts.aspx?AID=200 "
"496","Nevada","US_NV","03-Sep","C5_Close.public.transport",0,NA,0,NA,"No evidence found of road, rail or bus networks being affected in this period."
"497","Delaware","US_DE","04-Sep","C5_Close.public.transport",1,"G",0,NA,"No evidence of restricted/reduced public transport.     1. No measures highlighted in latest governor EO.  2. The Delaware Authority of Regional Transit website mentions that service had resumed to full capacity as of June 1.     https://web.archive.org/web/20200622132930/https://dartfirststate.com/dtc.ejs?command=PublicDTCPressRelease    https://web.archive.org/web/20200623160925/https://dartfirststate.com/dtc.ejs?command=PublicDTCPressReleaseDisplay&id=8145"
"498","Maine","US_ME","04-Sep","C5_Close.public.transport",2,"G",2,"G","There has been no further update to Governor Mills’ Executive Order of 31st May (linked below) mandating that no one shall use public transportation unless necessary for an essential purpose.     http://web.archive.org/web/20200803130009/https://www.maine.gov/governor/mills/sites/maine.gov.governor.mills/files/inline-files/An%20Order%20to%20Further%20Implement%20the%20Restarting%20Plan.pdf"
"499","New York","US_NY","04-Sep","C5_Close.public.transport",1,"G",1,"G","There has been no update to New York State's public transport policy, therefore this indicator remains coded at 1G."
"500","Tennessee","US_TN","04-Sep","C5_Close.public.transport",1,"T",1,"T","9/4/2020  Current placeholder until more information can be obtained. WeGo, the public transit organization for Nashville has cancelled some lines, but increased buses on others to increase social distancing.     "
"501","Washington DC","US_DC","08-Sep","C5_Close.public.transport",0,NA,0,NA,"On September 8, Vienna and Dunn Loring stations reopened, “marking [the] first time all 91 Metro stations will be open since Metro implemented station closures as part of its pandemic response in March.” See WMATA website, archived: https://web.archive.org/web/20201001222039/https://www.wmata.com/about/news/Vienna-and-Dunn-Loring-Station-to-reopen-Tuesday.cfm"
"502","Pennsylvania","US_PA","08-Sep","C5_Close.public.transport",1,"T",0,NA,"SEPTA resumes running major bus routes in University City district of Philadelphia. By September 8, most subway, bus, and trolley lines are back in service under regular schedules. Face masks are still a requirement for all riders and drivers in stations and while riding SEPTA, and seat social distancing is still enforced.     This indicates a coding change from 1 to 0.    Link:  https://web.archive.org/web/20200908120137/https://twitter.com/SEPTAPHILLY/status/1303302067742601221  https://web.archive.org/web/20200927220250/http://www.septa.org/covid-19/service-information.html"
"503","Colorado","US_CO","11-Sep","C5_Close.public.transport",1,"T",1,"T","RTD in Denver continues to operate for essential travel with certain social distancing requirements.    Link: http://web.archive.org/web/20200730101241/https://www.rtd-denver.com/coronavirus"
"504","Florida","US_FL","11-Sep","C5_Close.public.transport",1,"T",1,"T","Miami-Dade Transit continues social distancing measures that limits the passenger capacity, and carefully controls passengers using public transport, current 17 September.  https://web.archive.org/web/20200916092402/http://www.miamidade.gov/global/initiatives/coronavirus/transit-services-updates.page  "
"505","Louisiana","US_LA","11-Sep","C5_Close.public.transport",1,"T",1,"T","As an extension of previous measures, the New Orleans Regional Transit Authority website was checked on August 12 and says that all bus and streetcar routes are still operating on the Saturday schedule, Monday through Saturday. On Sunday, bus and streetcar routes will operate on the Sunday schedule. Fares are being collected.     See NORTA link: https://web.archive.org/web/20200813071802/https://www.norta.com/COVID19"
"506","Montana","US_MT","11-Sep","C5_Close.public.transport",1,"T",0,NA,"As of September 11, there do not seem to be any remaining restrictions on Helena's Capital Transit.    See Capital Transit webpage: https://web.archive.org/web/20200917064930/http://www.ridethecapitalt.org/"
"507","North Carolina","US_NC","11-Sep","C5_Close.public.transport",1,"G",1,"G","No changes found after checking relevant resources. "
"508","Washington","US_WA","11-Sep","C5_Close.public.transport",1,"T",1,"T","According to Washington State Department of Transportation: ""Most of Washington’s transit providers are still operating, many at reduced levels of scheduled service. To help prevent the spread of COVID-19, transit agencies are expanding their efforts to keep buses, trains and paratransit vehicles clean...  In addition, some transit agencies and nonprofit transportation providers are providing a new service in response to the COVID-19 pandemic: They are delivering food, meals, and prescriptions to people in need. In response to requests from these community-based agencies, WSDOT determined that meal, food bank, and grocery delivery — as well as prescription drop-off/pickup — to homebound people is allowable for our partners that receive state and/or federal funds to support their operations."" https://web.archive.org/web/20200914213646/https://wsdot.wa.gov/transit/home"
"509","Arizona","US_AZ","12-Sep","C5_Close.public.transport",1,"G",1,"G","No new measures have been introduced. Previously noted policies remain valid."
"510","Maine","US_ME","12-Sep","C5_Close.public.transport",2,"G",2,"G","As of 17th September 2020, there has been no further update to Governor Mills’ Executive Order of 31st May (see previous note in this indicator) mandating that no one shall use public transportation unless necessary for an essential purpose. "
"511","New York","US_NY","14-Sep","C5_Close.public.transport",1,"G",1,"G","Governor Cuomo's Executive Order of 10th September, which comes into effect on 10th September and directs the MTA to develop a plan to bolster mark compliance across public transit, confirms that public transit is still running.     Source (Wayback Machine unavailable): https://www.governor.ny.gov/news/governor-cuomo-issues-executive-order-directing-mta-develop-plan-bolster-mask-compliance-public "
"512","Georgia","US_GA","15-Sep","C5_Close.public.transport",1,"T",1,"T","No changes found.    Reduced service restrictions due to COVID-19 remain in place in Atlanta    https://web.archive.org/web/20200818085856/https://itsmarta.com/MARTA-service-modifications.aspx"
"513","Alaska","US_AK","16-Sep","C5_Close.public.transport",0,NA,0,NA,"No changes detected in this indicator after searching news articles, press releases and executive orders."
"514","Arizona","US_AZ","17-Sep","C5_Close.public.transport",1,"G",1,"G","No policy change noted."
"515","Vermont","US_VT","17-Sep","C5_Close.public.transport",0,NA,0,NA,"No changes detected in this indicator after searching news articles, press releases and executive orders."
"516","Wisconsin","US_WI","17-Sep","C5_Close.public.transport",1,"T",1,"T","As of September 17th, the city of Madison still limited the number of passengers to 20 per bus.   http://web.archive.org/web/20200917044356/https://www.cityofmadison.com/metro/contact/covid-19-updates "
"517","Alaska","US_AK","18-Sep","C5_Close.public.transport",0,NA,0,NA,"No changes detected in this indicator after searching news articles, press releases and executive orders.  "
"518","Louisiana","US_LA","18-Sep","C5_Close.public.transport",1,"T",1,"T","As an extension of previous measures, the New Orleans Regional Transit Authority website was checked on August 12 and says that all bus and streetcar routes are still operating on the Saturday schedule, Monday through Saturday. On Sunday, bus and streetcar routes will operate on the Sunday schedule. Fares are being collected.     See NORTA link: https://web.archive.org/web/20200813071802/https://www.norta.com/COVID19"
"519","Massachusetts","US_MA","18-Sep","C5_Close.public.transport",1,"T",1,"G","Capacity limitations remain common throughout the country. (See previous note)"
"520","Maine","US_ME","18-Sep","C5_Close.public.transport",2,"G",2,"G","Again, there has been no update to Governor Mills' Executive Order of 31st May allowing the use of public transport only for essential journeys. "
"521","Mississippi","US_MS","18-Sep","C5_Close.public.transport",0,NA,0,NA,"There continues to be no official policy on public transit operations nor evidence of closures or restrictions. "
"522","North Carolina","US_NC","18-Sep","C5_Close.public.transport",1,"G",1,"G","No changes found after checking relevant resources. "
"523","North Dakota","US_ND","18-Sep","C5_Close.public.transport",0,NA,0,NA,"No changes after checking relevant sources. "
"524","New Jersey","US_NJ","18-Sep","C5_Close.public.transport",0,NA,0,NA,"""Executive Order 165 requires all staff & customers to wear face coverings on board all transit vehicles and inside all stations & facilities. Masks are also required on train platforms & bus stops when distancing is not possible. Eating & drinking are strictly prohibited aboard all transit vehicles.""    https://web.archive.org/web/20200924194446/https://www.njtransit.com/covid19"
"525","New Mexico","US_NM","18-Sep","C5_Close.public.transport",2,"T",2,"T","No updates on NM Rail Runner site    Link to NM Rail Runner site:   http://web.archive.org/web/20200803131029/https://riometro.org/CivicAlerts.aspx?AID=200 "
"526","Minnesota","US_MN","21-Sep","C5_Close.public.transport",0,NA,0,NA,"Public transit appears to operate without significant disruptions."
"527","New Mexico","US_NM","23-Sep","C5_Close.public.transport",2,"T",2,"T","No updates on NM Rail Runner site    Link to NM Rail Runner site:   http://web.archive.org/web/20200803131029/https://riometro.org/CivicAlerts.aspx?AID=200 "
"528","Maryland","US_MD","24-Sep","C5_Close.public.transport",0,NA,0,NA,"As of September 24, the Maryland Department of Transportation had proposed some service adjustments that would start on January 3, 2021. These adjustments come after financial difficulties that were caused by the COVID-19 pandemic. Public comments can be made until November 16, 2020. During October there will also be 10 public hearings to gather public testimony. See Maryland Department of Transportation’s website, archived: https://web.archive.org/web/20200924095651/https://www.mta.maryland.gov/servicechanges/winter2021"
"529","Maine","US_ME","24-Sep","C5_Close.public.transport",2,"G",2,"G","Again, there has been no update to Governor Mills' Executive Order of 31st May allowing the use of public transport only for essential journeys. "
"530","New York","US_NY","24-Sep","C5_Close.public.transport",1,"G",1,"G","As of 1st October, there has been no update to New York's public transport policy, therefore this indicator remains at 1G. "
"531","Vermont","US_VT","24-Sep","C5_Close.public.transport",0,NA,0,NA,"No changes detected in this indicator after searching news articles, press releases and executive orders."
